character,text,gender
ELIO, L'usurpateur. (The usurper),male
ELIO, Il faut que je descende. (I’d better go down.),male
ELIO, Hello.,male
ELIO, An my room is now your room. I’ll be next door.,male
ELIO, We're sharing the bathroom. It's my only way out...,male
ELIO, We’re being called to dinner.,male
ELIO, I can show you around.,male
ELIO, Should I take him to Montodine?,male
ELIO, Should we take Anchise’s bikes?,male
ELIO, Nothing. Wait for summer to end.,male
ELIO, We come here only for Christmas and some other vacation..,male
ELIO," And Easter too. We are Jewish, English, American, Italian, French... somewhat atypical. Besides my family you are probably the only other Jew who has set foot in this town.",male
ELIO, Transcribe music. Read books. Swim at the river. Go out at night.,male
ELIO, He does this every year...,male
ELIO, How did you know about this place?,male
ELIO, But I am relaxing.,male
ELIO, Je ne sais pas. (Who knows?),male
ELIO, Non vi sembra ineducato come dice “Later...”? arrogante? Mi sembra che facciamo di tutto per farlo stare a suo agio da noi. (Don’t you think it’s rude when he says “Later...”? Arrogant?,male
ELIO," You watch, this is how he’ll say goodbye to us when the time comes. With his gruff, slapdash, Later!",male
ELIO," Yeah, but what if I grow to hate him?",male
ELIO, Non mi va. (I don’t feel like it),male
ELIO, Perché non mi va!,male
ELIO, J’en ai pas envie. (I don’t want to.),male
ELIO, I’m... I’m... I have... an allergy.,male
ELIO," Later, maybe.",male
ELIO, Must we?,male
ELIO, Reading my music.,male
ELIO," Thinking, then.",male
ELIO, Private.,male
ELIO, So I won’t tell you.,male
ELIO, I thought you didn’t like it. Hated it...,male
ELIO, The same one?,male
ELIO, Follow me.,male
ELIO, I just played it the way Liszt would have played it if he’d jimmied around with it.,male
ELIO, Not by much. That’s how Busoni would've played it if he’d altered Liszt’s version.,male
ELIO," Bach never wrote it for guitar. In fact, we’re not even sure it’s Bach at all.",male
ELIO," Okay, okay. No need to get so worked up.",male
ELIO, Sei stato al fiume? (You've been at the river?),male
ELIO, I was.,male
ELIO, Maybe it did when you wrote it.,male
ELIO, Kind?,male
ELIO, Che ne so. (I don’t care.),male
ELIO, Pourquoi je serais fâché contre Chiara ? (Why should I be angry with Chiara?),male
ELIO, Je serai là avant toi. (Let’s meet tomorrow night. I’ll be here before you.),male
ELIO, We almost did it. Marzia and me.,male
ELIO, Dunno.,male
ELIO," All I had to do was find the courage to reach out and touch, she would have said yes.",male
ELIO, Can’t I come too?,male
ELIO, On va au lac de Garde avec mon père. Il veut montrer à Oliver l'endroit où ils draguent. (We’re going to Lake Garda with dad. He wants to show Oliver where they’re dredging.),male
ELIO," Il est à l'intérieur, il aide mon père. Tu étais incroyable sur la piste, hier soir. (He’s inside helping dad. You were great on the dance floor last night.)",male
ELIO," Et il est beau aussi, non? (And he’s great looking, isn’t he?)",male
ELIO, Dad always sits up front with Anchise to navigate.,male
ELIO, What would be the harm in that?,male
ELIO, Tregua? (Truce?),male
ELIO, Oliver!,male
ELIO, I have to go!!,male
ELIO, “The Cosmic Fragments” by Heraclitus.,male
ELIO, I’d never have the courage to ask such a question.,male
ELIO, My mom’s been reading this German romance. She read some of it to my Father and I the day the lights went out.,male
ELIO, Yes.,male
ELIO," Better to speak, she said. But she’s on her guard. She senses a trap somewhere.",male
ELIO," No, he fudges.",male
ELIO," I’ll go, if you want me to.",male
ELIO, Now?,male
ELIO, No.,male
ELIO, Not bad at all. I thought you didn’t smoke.,male
ELIO, No. This is World War I. You’d have to be at least eighty years old to have known any of them.,male
ELIO," I know nothing Oliver. Nothing, just nothing.",male
ELIO, If you only knew how little I know about the things that really matter.,male
ELIO, You know what things. By now you of all people should know.,male
ELIO, Because I thought you should know.,male
ELIO, Because I want you to know Because there is no one else I can say this to but you.,male
ELIO, Yes.,male
ELIO, You know I’m not going anywhere.,male
ELIO, I wish I hadn’t spoken.,male
ELIO, Does this mean we’re on speaking terms - but not really?,male
ELIO," Andiamo, americano!",male
ELIO, (speaking like Mussolini) Popolo italiano! That’s Italy!,male
ELIO," The spring is in the mountains, the Alpi Orobie. The water comes straight down from there.",male
ELIO," I don’t know. So you won’t, I suppose.",male
ELIO," I love this, Oliver.",male
ELIO, That too.,male
ELIO, Not yet.,male
ELIO, Did I offend you?,male
ELIO, We can stop by the pharmacist on the way back.,male
ELIO," Ghiaccio, ice, Mafalda, per favore, presto!",male
ELIO," I’m a mess, aren’t I?",male
ELIO, Sit for a second.,male
ELIO, I have one of those.,male
ELIO, My mother says we are Jews of discretion.,male
ELIO," Funny witch. You’re going to kill me, you know that? Ouch!",male
ELIO, I’ll get over it.,male
ELIO," Peut-être. Mais si on sort, il ne faut pas que ma mère me voie, elle s'inquiéterait. (regardant autour de lui) Où est Oliver? (Maybe. But if I go out my mother can't see me. She'll get worried. Where’s Oliver?)",male
ELIO, Il est où Oliver? (Is Oliver around?),male
ELIO," Io esco stasera, non ceno (I’m going out this evening, I won’t have dinner)",male
ELIO, Ma di che? (about what?),male
ELIO, Everyone likes Oliver.,male
ELIO, Is that your impression?,male
ELIO, When did he tell you that?,male
ELIO, Traitor. Traitor!,male
ELIO," C'était rien. Tu veux sortir ? Je peux passer te prendre en vélo, on peut aller... (It was nothing. Do you want to go out? I can come on my bike and pick you up. We can go to...)",male
ELIO, Ca t’a dérangé? (Did it bother you?),male
ELIO, Parce que j'en avais envie. (Because I felt like it.),male
ELIO, Je comprends pas ta question. (I don’t understand what you’re asking.),male
ELIO, Je te suis toujours pas. (I still don’t follow.),male
ELIO," Si tu ne me le dis pas, je vais imaginer des choses... (If you don’t tell me, I’ll imagine all sort of things...)",male
ELIO, Pourquoi tu ne le dis pas? (Why don’t you tell anyone?),male
ELIO, Tu caches qui tu es vraiment? (Do you hide who you are?),male
ELIO," Si, sûrement. Tu le fais avec moi aussi? (I suppose. Do you hide from me?)",male
ELIO, Comment ça? (Like what?),male
ELIO, Pourquoi tu dis ça? (Why do you say that?),male
ELIO," Je suis désolé! Je suis désolé! (I’m sorry! I’m sorry...) Oh, my God, that felt so good... Please don’t avoid me. Please don’t avoid me. It kills me. Your silence is killing me.",male
ELIO, Way over the top. Can’t stand thinking you hate me. I’d sooner die than know you hate me. Can’t stand the silence. I need to speak to you.,male
ELIO, Insomma (so-so).,male
ELIO, I don’t play poker.,male
ELIO, Otherwise known as Sonny and Cher.,male
ELIO, It’s way to big on me. It’s looks ridiculous.,male
ELIO, I can’t put it on now! They’ve already met me. It will look like a put-up job.,male
ELIO, Mom called them that.,male
ELIO, I’m afraid I have to go to bed now.,male
ELIO, Change my mind? Of course I was coming.,male
ELIO, I’m nervous.,male
ELIO, Me okay.,male
ELIO, Nothing.,male
ELIO," Yes, please.",male
ELIO, Did we make noise?,male
ELIO, Mafalda always looks for signs.,male
ELIO," You wore that shirt on your first day here. Will you let me have it, leave it here when you go?",male
ELIO, Let’s go swimming.,male
ELIO, No.,male
ELIO, I just had to see you.,male
ELIO," I just wanted to be with you. If you want, I’ll go back now.",male
ELIO, I don’t know.,male
ELIO, I’m not telling anyone. There won’t be any trouble.,male
ELIO, Are you sorry I came here?,male
ELIO," I’m sick, aren’t I?",male
ELIO, Don’t!,male
ELIO, Let it go! No!,male
ELIO, I don’t want you to go.,male
ELIO, Why didn’t you give me a sign?,male
ELIO, When?,male
ELIO, What? I thought you...,male
ELIO, I.. had to work.,male
ELIO, What?,male
ELIO, Listen to what?,male
ELIO,,male
ELIO, Did you get your passport?,male
ELIO," Mafalda? Maman... Bonjour. Oui, je vais bien. Je suis à Clusone, à la gare. Oui... il est parti. Maman, s'il te plaît, tu pourrais venir me chercher? (Mafalda? Mom... Hey. Yes, I'm fine. I'm in Clusone, at the station. Yes.. he left. Mom.. please could you come pick me up?)",male
ELIO," Good, thanks.",male
ELIO, Pour la vie? (Forever?),male
ELIO, I think he did.,male
ELIO, Yes.,male
ELIO, Oliver was Oliver.,male
ELIO, Oliver may be very intelligent -,male
ELIO, I think he was better than me.,male
ELIO, Does mother know?,male
ELIO," I’m here, I’m here. How are you?",male
ELIO," Fine, too... I miss you.",male
ELIO," What news? You’re getting married, I suppose.",male
ELIO, You never said anything.,male
ELIO, But that’s wonderful news!,male
ELIO, They know about us...,male
ELIO, How?,male
ELIO," “Elio, Elio...”",male
PERLMAN," Welcome! Welcome! Oh, my, you are much bigger than your picture!",male
PERLMAN," Elio, Oliver.  Oliver, Elio.",male
PERLMAN, Make yourself at home. Our house is your house.,male
PERLMAN, None of our residents has ever had a local bank account.,male
PERLMAN, I’m think they’re closed for summer vacation. Try Crema.,male
PERLMAN," Pesca, ciliege, albicocche... (peaches, cherries, apricots...)",male
PERLMAN," The word apricot comes from the Arabic - it’s like the words “algebra”, “alchemy”, and “alcohol”. It derives from an Arabic noun combined with the Arabic article ‘al-’ before it. The origin of our Italian ‘albicocca’ was ‘al-barquq’...",male
PERLMAN, Ah?,male
PERLMAN, How so?,male
PERLMAN, Passes with flying colors.,male
PERLMAN," Ah, frizzante! (Sparkling wine!)",male
PERLMAN, I don’t think he’s arrogant. I think Oliver is shy.,male
PERLMAN," I’m telling you, he’s just shy. You’ll grow to like him.",male
PERLMAN," Elio, play something.",male
PERLMAN, Perchè non ti va? (Why don’t you feel like it?),male
PERLMAN," You are? Good. I think this needs firming up. Your insights are persuasive, but..",male
PERLMAN, And why didn’t you?,male
PERLMAN," I just heard from the people in Sirmione, they say they’ve come up with something. I’m going there today, would you like to go with me?",male
PERLMAN, On condition that you remain silent.,male
PERLMAN, Nothing is being dug up. It’s what has been brought up - out of the water.,male
PERLMAN," Guido io oggi, non ti preoccupare. Non fare quella facci Anchise! Prenditi il pomeriggio libero. (I think i will drive myself today. Anchise, don’t be upset! Take the afternoon off)",male
PERLMAN," What’s going on, boys? Oliver, come sit up front and be my navigator.",male
PERLMAN, The ship went down in 1827 on the way to the villa of Count Lechi...,male
PERLMAN, Who would like to go for a swim before we head back?,male
PERLMAN, Are you going too?,male
PERLMAN, How about a drink to celebrate the day?,male
PERLMAN, It must be over there...,male
PERLMAN," Elly-belly, you know you can talk to us about anything?",male
PERLMAN, Must be tired then. Or were you playing poker too?,male
PERLMAN, Several hundred color slides of our boxer and the others like him arrived yesterday from Berlin. We should start cataloging them. That will keep us busy until lunch I imagine. Grow up. I’ll see you at midnight.,male
PERLMAN, Beautiful aren’t they?,male
PERLMAN," Because these are more Hellenistic than the fifth-century Athenian, most likely sculpted under the influence of the greatest sculptor in antiquity: Praxiteles.  Their muscles are film- look at his stomach for example- and yet never a straight body in these statues, they are all curves, sometimes impossibly curved and so nonchalant, hence their ageless ambiguity.  As if they are daring you to desire them.",male
PERLMAN, Okay...,male
PERLMAN," No misbehaving tonight. When I tell you to play, then play! You’re too old not to accept people as they are. What’s wrong with them? I don’t think it’s very attractive of you to call them ‘Sonny and Cher’ behind their backs...",male
PERLMAN, ...and then accept gifts from them. Is it because they’re gay or because they’re ridiculous? Is that it? I hope not. And if you know as much about economics when you’re Mounir’s age you’ll be a very wise man indeed and a credit to me. Now get into this.,male
PERLMAN, Later.,male
PERLMAN, Oliver told me he has to go to Bergamo for a couple of days to do some research at the university there before he leaves.  He would then fly home directly from Linate.,male
PERLMAN, So? Welcome home. Did Oliver enjoy the trip?,male
PERLMAN, You two had a nice friendship.,male
PERLMAN," You’re too smart not to know how rare, how special, what you two had was.",male
PERLMAN," “Parce-que c’etait lui, parce-que c’etait moi.” (Because he was he, because I was I)",male
PERLMAN," Intelligent? He was more than intelligent. What you two had had everything and nothing to do with intelligence. He was good, and you were both lucky to have found each other, because you too are good.",male
PERLMAN," I’m sure he’d say the same thing about you, which flatters the two of you.",male
PERLMAN, I don’t think she does.,male
PERLMAN, You caught us while in the process of choosing the new you for next summer..,male
PERLMAN, Mazel Tov!,male
PERLMAN, And Happy Hannukah!,male
ANNELLA, Dove è Elio? (Where’s Elio?),female
ANNELLA, Aiuta Oliver a portare le sue cose in camera tua. (Help bring Oliver’s things up to your room.),female
ANNELLA," Did you recover from your trip, caro?",female
ANNELLA, Pomegranate.,female
ANNELLA, C’è Zia Marcella e annessi per cena. Oliver si ferma con noi o esce stasera? (Aunt Marcella is coming to dinner with her tribe. Is Oliver in or out tonight?),female
ANNELLA, Sono le otto passate! Noi ci mettiamo a tavola. (It’s eight o’clock! We’ll sit down),female
ANNELLA," Meanwhile, we’ll have to put up with him for six long weeks. Won’t we?",female
ANNELLA, Mio piccino! (My little one!) Può togliere i piatti di Mr. Oliver? (You can remove Mr. Oliver’s place setting away?),female
ANNELLA, Pourquoi tu ne vas pas à Moscazzano avec les autres? (Why not to Moscazzano with the others?),female
ANNELLA," Go see your friends. Go out. Do something. Ne reste pas là comme une araignée sur le mur, mon chéri! (Don’t just be a spider on the wall, darling!) You’re spoiling everyone’s fun.",female
ANNELLA, Elio!,female
ANNELLA," Try later, what?",female
ANNELLA, Have you seen my Heptameron?,female
ANNELLA," This is in German, but I’ll translate: Ein gut aus sehender junger Ritter ist wahnsinnig verliebt in eine Prinzessin. Sie auch ist in ihn verliebt. “...A handsome young knight is madly in love with a princess. She too is in love with him...",female
ANNELLA," Amore, è il compromesso storico! (Darling, I think it's the historic compromise...)",female
ANNELLA," Ma che c’entra? Sei matta? Sei una stronza! (What's that got to do with it? You're mad, darling.)",female
ANNELLA," Amore ma è americano! (Darling, he's American.)",female
ANNELLA," Non ti preoccupare, succede sempre! (It's nothing. It happens all the time...)",female
ANNELLA, Il n’est pas sorti? (Didn’t he go out?),female
ANNELLA," No grazie Mafalda, ceniamo tra poco. (No, thanks Mafalda, we’re going to dinner)",female
ANNELLA, Lasciamolo fare. (Let’s leave him),female
ANNELLA," He likes you too - more than you do, I think.",female
ANNELLA," No, it was Oliver’s.",female
ANNELLA, A while ago.,female
ANNELLA, Not in here!,female
ANNELLA, And don’t forget Mounier and Isaac are coming for dinner tonight.,female
ANNELLA, I want you to wear the shirt they sent you from Miami.  It will make them happy,female
ANNELLA," Oh, maybe Elio could go with him? It would be nice for them to get away for a couple of days before Oliver leaves.  What do you think?",female
ANNELLA, E questo? (This one?),female
ANNELLA, Why aren’t you here? When are you coming?,female
ANNELLA, And he is a she!,female
ANNELLA," Oh, Oliver that’s wonderful!",female
ANNELLA," Darling, we are going to let you speak with Elio now. Congratulations, again...",female
ANNELLA, Elio... Elio?,female
OLIVER, Hi.,male
OLIVER, Later. I’ll have to pass. Can you make my excuses to your mother?,male
OLIVER, Big time.,male
OLIVER, Good. Are we far from the town? I need to open a bank account.,male
OLIVER, Is that your orchard?,male
OLIVER," I know myself. If I have three, I’ll have a fourth, and more.",male
OLIVER, What does one do around here?,male
OLIVER," What do you do in the winter, then? Don’t tell me: wait for summer, right?",male
OLIVER, Christmas?,male
OLIVER," I am from a small town in New England. I know what its like to be the odd Jew out.(Beat) And what else do you do here in summer, besides this?",male
OLIVER, I beg to differ.,male
OLIVER, The word is not actually an Arabic word.,male
OLIVER," It’s a long story, so bear with me, Pro. Many Latin words are derived from the Greek. In the case of ‘apricot’, however, it’s the other way around. Here the Greek takes over from Latin. The Latin word was praecoquum, from pre-coquere, pre- cook, to ripen early, as in precocious, meaning premature. The Byzantines - to go on - borrowed praecox, and it became prekokkia or berikokki, which is finally how the Arabs must have inherited it as al-barquq.",male
OLIVER," Here, let me make it better. Relax.",male
OLIVER," You’re stiff as a board. You’re made of knots. Come here, feel this...",male
OLIVER, Why aren’t you with the others at the river?,male
OLIVER, Me too. We might have the same one.,male
OLIVER, Let’s go now.,male
OLIVER, I’m going to change. What about you?,male
OLIVER, See you downstairs!,male
OLIVER, Elio! What are you doing?,male
OLIVER, No you’re not.,male
OLIVER, About?,male
OLIVER, So you won’t tell me?,male
OLIVER, So he won’t tell me.  In that case I’m going with your mom.,male
OLIVER, Just play it again.,male
OLIVER," Hated it? Just play it, will you?",male
OLIVER, The same one.,male
OLIVER, You changed it. What did you do to it? Is it Bach?,male
OLIVER," Just play it again, please!",male
OLIVER, Can’t you just play the Bach the way Bach wrote it?,male
OLIVER, Forget I asked.,male
OLIVER," Go on, I’m okay with criticism.",male
OLIVER, I’m okay with firming up - I’m okay with paradox. Back to the drawing board.,male
OLIVER, Are you sleeping?,male
OLIVER," Just listen to this drivel: “For the early Greeks, Heidegger contends, this underlying hidden- ness is constitutive of the way beings are, not only in relation to themselves but also to other entities generally. In other words, they do not construe hidden- ness merely or primarily in terms of entities' relation to human beings.”",male
OLIVER, That’s the kindest thing anyone’s said to me in months.,male
OLIVER," Yes, kind.",male
OLIVER, Better to have tried and failed...,male
OLIVER, Try again later.,male
OLIVER, I’d like that very much.,male
OLIVER," Silent as in too many opinions on things, or silent as in Security: not telling anybody what fabulous things have been dug up?",male
OLIVER, Are you trying to make me like her?,male
OLIVER," No harm. Except I like to go at it alone, if you don’t mind.",male
OLIVER," Don’t play at being the good host, just don’t.",male
OLIVER, Elio!,male
OLIVER," No Prof, I have to work.",male
OLIVER, That would be great.,male
OLIVER," The meaning of the river flowing is not that all things are changing so that we cannot encounter them twice, but that some things stay the same only by changing.",male
OLIVER, About the knight who doesn’t know whether to speak or die? You told me already.,male
OLIVER," Well, does he or doesn’t he?",male
OLIVER, So does he speak?,male
OLIVER," That figures. Listen, I need to pick up something in town.",male
OLIVER, Let’s go together.,male
OLIVER," Why, have you got anything better to do?",male
OLIVER, So let’s go.,male
OLIVER, I fell the other day on the way back and scraped myself pretty badly. Anchise insisted on applying me some sort of witch’s brew. He also fixed the bike for me.,male
OLIVER, You want to try one?,male
OLIVER, I don’t.,male
OLIVER, Is there anything you don’t know? I never heard of the Battle of Piave.,male
OLIVER, You know more than anyone around here.,male
OLIVER, What things that matter?,male
OLIVER, Why are you telling me all this?,male
OLIVER, Because you thought I should know.,male
OLIVER, Are you saying what I think you’re saying?,male
OLIVER, Wait for me here. Don’t go away.,male
OLIVER, They’ve mixed up my pages and now they have to retype the whole thing. So I have nothing to work on this afternoon. Which sets me back a whole day. Damn!,male
OLIVER, I’m going to pretend you never did.,male
OLIVER," Look, we can’t talk about such things, we really can’t.",male
OLIVER, It's freezing cold!,male
OLIVER, I like the way you say things. Why are you always putting yourself down?,male
OLIVER, Are you so scared of what others think? Or what I think?,male
OLIVER," What? This? Us, you mean?",male
OLIVER, Better now?,male
OLIVER, We can’t do this - I know myself. So far we’ve behaved. We’ve been good. Neither of us has done anything to feel ashamed of. Let’s keep it that way. I want to be good.,male
OLIVER, Just don’t.,male
OLIVER, Elio! Where are you?,male
OLIVER, I guess. The ancients said it never hurts to be bled from time to time.,male
OLIVER, My bubbe. She did it all the time to us.,male
OLIVER, You don’t ever wear it?,male
OLIVER, I guess that fits your mom...,male
OLIVER, I hope not.,male
OLIVER, I think so. Just a bit of a nose bleed.,male
OLIVER, Did you enjoy yourself last night?,male
OLIVER, They’re amazing. But these are far more... sensual.,male
OLIVER, What's the time?,male
OLIVER," (in his halting Italian) Mafalda, non sarò con voi a cena stasera. (I won’t be home for dinner this evening).",male
OLIVER, I’m glad you came. I thought you had changed your mind.,male
OLIVER, Sometimes.,male
OLIVER, Me too.,male
OLIVER," Come, sit.",male
OLIVER, What are you doing?,male
OLIVER, That’s a start.,male
OLIVER," Off, and off, and off, and off...",male
OLIVER, Nothing to worry about.,male
OLIVER, She won’t find any.,male
OLIVER, Are you going to hold last night against me?,male
OLIVER, Take your trunks off.,male
OLIVER," I’m going to town, I have to collect my typed up pages. Later I'd like to show them to you, Professor.",male
OLIVER, So.. Later!,male
OLIVER, Something wrong?,male
OLIVER, Aren’t you sick of me?,male
OLIVER, Do you have any idea how glad I am we slept together?,male
OLIVER, It’s just like you not to know. I don’t want you to regret any of it. I don’t want either of us to have to pay one way or another.,male
OLIVER, I didn’t mean that.,male
OLIVER, I’d kiss you if I could.,male
OLIVER, I was looking everywhere for you.. What are you doing up here?,male
OLIVER, I wish everyone were as sick as you. Want to see sick?,male
OLIVER, The peach juice helps a lot. Want to try it?,male
OLIVER, Then let go.,male
OLIVER, I did. At least I tried.,male
OLIVER," Once, when we were playing volleyball, I touched you... Just as a way of showing... I liked you. The way you reacted made me feel I’d almost molested you. I decided to keep my distance. I come out here every night and just sit for hours.",male
OLIVER, I know what you thought.,male
OLIVER, Listen!,male
OLIVER, This song!,male
OLIVER, Let’s go!,male
OLIVER, Psychedelic Furs. The best!,male
OLIVER, Best way to travel around!,male
OLIVER," Yeah, I did.",male
ELIO, We’re being called to dinner.,male
ELIO," It’s young Bach, he dedicated it to his brother.",male
ELIO, She seems to like you a lot - She’s more beautiful than she was last year.,male
ELIO, I saw her naked on a night swim. She has a great body.,male
ELIO, This is my spot. All mine. I come here to read. I can’t begin to tell you the number of books I’ve read here.,male
ELIO, I come here to escape the known world.,male
ELIO, Where did you learn to do that?,male
ELIO, See if Oliver doesn’t think I look like a scarecrow in it.  I’ll model it for you.,male
ELIO, So you do smoke?,male
ELIO, You’re hurting me.,male
OLIVER," So, this is usually your room..",male
OLIVER," Thanks, buddy.",male
OLIVER, What do you do?,male
OLIVER, Courtesy Philology 101.,male
OLIVER, Here. Feel it? He should relax more.,male
OLIVER, Want to go for a swim? Just the two of us?,male
OLIVER, I can’t believe you changed it again.,male
OLIVER, Does this make any sense to you? Not to me. Nor to your dad.,male
OLIVER," Not bad, right?",male
OLIVER, World War II? Did the Allies fight near here?,male
OLIVER, You’re making things very difficult for me.,male
OLIVER, I think we should go.,male
OLIVER, I should make sure it doesn’t get infected.,male
OLIVER, Was it my fault?,male
OLIVER, Are you going to be okay?,male
OLIVER, You okay?,male
OLIVER, Does this make you happy? You aren’t going to have a nosebleed are you?,male
OLIVER, You sure you want this?,male
OLIVER, Can I kiss you?,male
OLIVER, Call me by your name and I’ll call you by mine.,male
OLIVER, Sit down.,male
OLIVER," Well, this is promising. You’re hard again. Good.",male
OLIVER, What have you done?,male
OLIVER, Is this what I think it is?,male
