character,text,gender
OLIVER," You tried out the plant kingdom? Next will be minerals? You’re rejecting the animal kingdom already? That would be me, I suppose.",male
OLIVER, Now may I taste it?,male
OLIVER, Li ho visti a New York l’anno scorso. Richard Butler.. spettacolo! (I saw them in New York last year. Richard Butler... awesome!),male
MAFALDA," Lasci fare a me, Signore. (Let me)",female
MAFALDA, Che muvi star! (What a movie star!),female
MAFALDA, Signora vuole un frullato pure lei? (Madame do you want a smoothie too?),female
MAFALDA, Ma dove vai a quest’ora? Mi fai preoccupare. (But where at this hour? I worry),female
MAFALDA, Secondo me non va bene. Signora... (I’d advise against it),female
MAFALDA, Ciao Marzia!,female
ANNELLA, Have another egg.,female
ANNELLA," You like him, don’t you? Oliver?",female
PERLMAN, It’s amazing that today in Israel and many Arab countries the fruit is referred to by a totally different name: ‘mishmish’.,male
PERLMAN, Before you leave we'll certainly find the time to go over these revisions.,male
PERLMAN," When you least expect it, Nature has cunning ways of finding our weakest spot. Just remember: I am here. Right now you may not want to feel anything. Perhaps you never wished to feel anything. And perhaps it’s not to me that you’ll want to speak about these things. But feel something you obviously did.",male
PERLMAN," Look - you had a beautiful friendship. Maybe more than a friendship. And I envy you. In my place, most parents would hope the whole thing goes away, to pray that their sons land on their feet. But I am not such a parent. In your place, if there is pain, nurse it. And if there is a flame, don’t snuff it out. Don’t be brutal with it.",male
PERLMAN," We rip out so much of ourselves to be cured of things faster, that we go bankrupt by the age of thirty and have less to offer each time we start with someone new. But to make yourself feel nothing so as not to feel anything - what a waste!",male
PERLMAN, Have I spoken out of turn?,male
PERLMAN," Then let me say one more thing. It will clear the air. I may have come close, but I never had what you two had. Something always held me back or stood in the way. How you live your life is your business. Remember, our hearts and our bodies are given to us only once. And before you know it, your heart is worn out, and, as for your body, there comes a point when no one looks at it, much less wants to come near it. Right now there’s sorrow. Pain. Don’t kill it and with it the joy you’ve felt.",male
PERLMAN," We may never speak about this again. But I hope you’ll never hold it against me that we did. I will have been a terrible father if, one day, you’d want to speak to me and felt that the door was shut, or not sufficiently open.",male
MARZIA," Sicuramente è meglio di quello dell’anno scorso, ti ricordi? (He’s certainly a big improvement from last year, do you remember?)",female
MARZIA, You should relax more.,female
MARZIA," Lo vuole a tutti i costi, eh. (She’s really after him, that’s clear.)",female
MARZIA, Tu n'es pas avec moi parce que tu es fâché contre Chiara? (You’re not with me because you’re angry with Chiara?),female
MARZIA, A cause de lui. (Because of him.),female
MARZIA, Laisse-le tranquille! (Leave him alone!),female
MARZIA," OK, je viens. (Yeah. I’ll come.)",female
MARZIA, Bien sûr que non. (Of course not.),female
MARZIA, Pourquoi tu m’as acheté ce livre? (Why did you buy me this book?),female
MARZIA," Oui, mais pourquoi tu l'as acheté pour moi? Pourquoi m'acheter un livre à moi? (Yes but why did you buy it for me? Why buy me a book?)",female
MARZIA, N’importe qui comprendrait pourquoi et toi tu ne comprends pas! (An idiot would understand why I’m asking but you don’t.),female
MARZIA, Tu es désespérant. (You’re hopeless.),female
MARZIA, Sei un coglione. (Tu n'es qu'un crétin) Donne-moi une cigarette. (Give me a cigarette.),female
MARZIA, Je ne sais pas... Les gens qui lisent sont cachottiers. Ils cachent ce qu'ils sont vraiment. Les gens qui cachent n'aiment pas toujours ce qu'ils sont. (I don’t know.. People who read are hiders. They hide who they are. People who hide don’t always like who they are.),female
MARZIA, Parfois. Pas toi? (Sometimes. Don’t you?),female
MARZIA," Non, pas avec toi. Ou si, peut- être, un petit peu. (No, not from you. Or maybe, yes, a bit.)",female
MARZIA, Tu sais très bien ce que je veux dire. (You know exactly like what.),female
MARZIA, Pourquoi? Parce que je pense que tu peux me faire souffrir,female
MARZIA, Buongiorno Mafalda!,female
MARZIA,,female
MARZIA, Tu as disparu pendant trois jours. (You’ve been gone three days.),female
MARZIA, Mais tu as disparu... (But you disappeared.),female
MARZIA, Ciao.,female
MARZIA," J'ai lu le livre que tu m'as offert, les poèmes. Ils sont très beaux. J’aime beaucoup cette Antonia Pozzi. (I read the book you gave me, the poems, they are beautiful. I really love Antonia Pozzi.)",female
MARZIA, Pour la vie. (Forever),female
MARIA, Molto meglio. Guarda che fico! (Much better! Look how cool he is!),female
ELIO," After all, it’s just to show him a good time here.)",male
ANCHISE, Si.,male
ANCHISE," Mafalda, guarda cosa ho portato! (Mafalda, look what I’ve got!)",male
ANCHISE, (I straightened the wheel. It took some doing. I also put air in the tires),male
MARZIA, (Turn around. Don’t stare at me.),female
MARZIA," Tu lis vraiment autant que ça ? Je veux direi: moi aussi, j'aime lire, mais je ne le dis à personne. (Do you really read that much? Don’t get me wrong. I like to read, too. But I don’t tell anyone.)",female
MARZIA," Pas parce que tu cherches à blesser, mais parce que tu changes toujours d'avis, alors, on ne sait donc jamais à quoi s'en tenir. Tu m'effraies. (Not that you mean to hurt anyone, but because you’re always changing your mind, so no one knows where to find you. You scare me.)",female
MARZIA, Tu m'embrasses encore? (Kiss me again?),female
MARZIA, Comme tu es dur! (You’re so hard.) Embrasse-moi encore. (Kiss me again.),female
MARZIA, Am I your girl? (Est-ce que je suis ta copine?),female
MARZIA, How are you?,female
MARZIA, I'm sorry you feel so bad. I just wanted to tell you that I'm not mad at you. I love you. (Je suis désolée que tu sois si malheureux. Je voulais juste te dire que je ne t'en veux pas. Je t'aime.),female
MARZIA, On reste amis? (Friends.),female
CHIARA, Dis-lui que je suis passée. (Tell him I came by.),female
CHIARA, Il danse très bien. (He dances great.),female
CHIARA," Tu veux jouer les entremetteurs? (What are you trying to do, fix us up?)",female
CHIARA, How is he? Will he live?,female
CHIARA, Really? I’ll be back in a minute. Don’t go anywhere.,female
CHIARA," Ça t'a fait mal ? Pourtant, tu as des pieds de paysan qui ne sentent rien. Paysan! (You felt that? You have peasant feet. They don’t feel things. Peasant!)",female
CHIARA, Doucement. Tu vas encore le faire saigner. (Easy. You’ll make him bleed again.),female
CHIARA, Qu’est-ce que j’en sais? (How would I know?),female
PERLMAN," There are four known sets of statues, after the Praxiteles originals. This fellow should be Number Three. The Emperor Hadrian had a pair, dug up at Tivoli, but one of the more philistine of the Farnese popes melted them down and had them recast as a particularly voluptuous Venus that was traded to Napoleon later on.",male
ANNELLA," ...obwohl es so scheint, als sei sie sich nicht vollig ihrer eigenen Liebe bewusst. ...though she seems not to be entirely aware of it. Despite the friendship... Freundschaft... that blossoms between them, or perhaps because of that very friendship, the young knight finds himself so humbled and speechless that he is totally unable to bring up the subject of his love. One day he asks the princess point-blank: Ich bitte euch ratet mir was besser ist... reden oder sterben. ‘Is it better to speak or die’.",female
MARCO," E così siamo arrivati al pentapartito, con Craxi al governo... (So we got to the government of Bettino Craxi).",male
MARCO, Lasciami parlare. Abbiamo cinque partiti che non fanno altro che discutere. (Let me speak. We have five parties that do nothing but fight.),male
MARCO, E vogliamo parlare della morte di Bunuel? Un genio assoluto! (Why don't we talk about the death of Buñuel? He was a genius.) Tu conosci Bunuel? (Know him?),male
MARCO, Il cinema è lo specchio della realtà. (Cinema is a mirror of reality).,male
ELENA," Perché non siamo capaci di fare più niente se non parlare, parlare, parlare... (Because we don't do anything but talk, talk, talk).",female
ELENA," E allora fuma e stai zitto, w lasciali parlare, vorrei sapere cosa ne pensano loro. Annella tu che ne pensi? Il pentapartito! (Smoke and shut up! Let them speak, him, her... I'd like to know what they think too. Annella, what do you think? A 5-party government!)",female
ELENA," E lo dici così? E’ una tragedia! Annella, da quando hai ereditato questo posto sei cambiata... (Compromises are tragic. Annella, you've changed since you inherited this place.)",female
ELENA, E tu non dici niente? (Say something. You're resigned).,female
ELENA, Il cinema non può essere la risposta per tutto... (Cinema isn't the answer...),female
ELENA, Sentiamo che ha da dire lui. (Let's hear his opinion. Say something.),female
ELENA, Americano non vuol dire stupido! (American doesn't mean stupid!),female
ELENA, Ma che succede? (What's the matter?),female
ELENA, Vi state abituando proprio a tutto! (You get used to absolutely everything).,female
CHIARA, Alors... On sort ou pas? (So... are we going somewhere?),female
MARZIA, Tu es encore malade? (Are you still sick?),female
MARZIA, et que je ne veux pas souffrir. (Why? Because I think you can hurt me and I don’t want to be hurt.),female
MARZIA, Montons dans ta chambre. (Let’s go up to your room.),female
ELIO, J'ai une meilleure idée. (I have a better idea.),male
OLIVER, Elio? Are you there?,male
OLIVER, Fine. How are your parents?,male
OLIVER, I miss you too. Very much. (long beat) I have some news.,male
OLIVER, I might be getting married this spring.,male
OLIVER, It’s been off and on for two years.,male
OLIVER, Do you mind?,male
OLIVER," Well, I have some news for you. I got engaged.",male
OLIVER, I figured.,male
OLIVER, From the way your father spoke - he made me feel like a member of the family - almost like a son-in-law. You’re lucky. My father would have carted me off to a correctional facility.,male
OLIVER, (After a very long beat) Oliver.. I remember everything ...,male
