,character,text,gender
616,NATE, Doug and some of his banker buddies are playing Texas Hold ‘Em at his apartment. Gonna go get me some of that Wall Street cash.,male
617,NATE," Man, I’m sorry. You didn’t make that crystal clear when you stormed off after calling me an asshole.",male
618,NATE," I’ll see you later, okay?",male
619,NATE, Quit? Are you sure?,male
620,NATE," Wow. Good for you. Congratulations, Andy. You’re free.",male
621,NATE," I went over to Dean & DeLuca -- man, they charge like five bucks a strawberry, but I figured, you quit, we should celebrate.",male
622,NATE," So you quit, but you’re still doing the twins’ science project. Big of you.",male
623,NATE, Either that or your job sucks and your boss is a wacko.,male
624,NATE," No, no. It’s an important magazine. That’s what you said, right?",male
625,NATE, The new Botox. The new pea coat. The new Gstaad. What the hell is--,male
626,NATE," See? I now live with someone who knows that. Thank you, Miranda Priestly.",male
627,NATE, That’s the thing -- I liked your old clothes.,male
628,NATE, I like that.,male
629,NATE, Don’t worry about it. I’m going to bed.,male
630,NATE, You look really pretty.,male
631,NATE, You’re going to Paris?,male
632,NATE, I thought Paris was some big deal for Emily and--,male
633,NATE, What the hell is wrong with you?,male
634,NATE," I know, I know. That’s your answer for everything lately. I didn’t have a choice. Like this job was forced on you. Like you don’t make these decisions yourself...",male
635,NATE," Oh, come on. What am I, four?",male
636,NATE," Andy, I make port wine reductions all day. I’m not exactly in the Peace Corps. I wouldn’t care if you were out all night pole dancing if you did it with some integrity.",male
637,NATE, You used to say this was just a job. You made fun of the Runway girls. And now you’ve become one of them.,male
638,NATE," Look at you. Now that I know how much you’re willing to change to be successful, it makes me wonder if we ever had anything in common.",male
639,NATE, I do. I really do.,male
640,NATE," In case you’re wondering, the person whose calls you always take, that’s the relationship you’re in.",male
641,NATE, I have to be at work in ten minutes. What’s up?,male
642,NATE, Shoes. And jackets and belts and--,male
643,NATE, I flew up to Boston while you were gone. Interviewed at the Oak Room.,male
644,NATE, You’re looking at their new sous-chef. I’m moving up there in a few weeks.,male
645,NATE, They have bread in Boston. Might even have Jarlsberg. We might be able to figure something out.,male
646,NATE, You never know.,male
647,NATE," I’m not worried about you. Anything you try, you’re gonna kick ass.",male
648,NATE, No. I know it.,male
649,NATE, And that’s what you’re wearing?,male
359,NIGEL, I thought she was coming in at 9.,male
360,NIGEL," All right, everyone. Man your battle stations! Did somebody eat an onion bagel?",male
361,NIGEL," We got the exclusive on the yellow Cavalli for Gwyneth, the one he showed with a huge feathered headpiece, but she’ll look like she’s working the mainstage at the Golden Nugget, so instead...",male
362,NIGEL, Who IS that sad little person? Are we doing a Before and After piece I don’t know about?,male
363,NIGEL, No...,male
364,NIGEL, Clearly my opinion means nothing. Nigel Kipling. Fashion Director. Let’s see what we’re working with. Wow. It’s like Oklahoma and New Jersey had a baby out of wedlock.,male
365,NIGEL," No, it’s not possible. Not you.",male
366,NIGEL, I guessed 8 1/2.,male
367,NIGEL, Do you?,male
368,NIGEL, She means you. Go.,male
369,NIGEL, Corn chowder. Interesting choice.,male
370,NIGEL, Not since 2 became the new 4 and 0 became the new 2.,male
371,NIGEL, Which is the new 14.,male
372,NIGEL, You’re right. That’s what this multi- million dollar industry is all about. Inner beauty.,male
373,NIGEL, Mr. Ravitz.,male
374,NIGEL, Our biggest September ever.,male
375,NIGEL," About 300,000.",male
376,NIGEL, Always.,male
377,NIGEL," I’m sorry... this is Andy Sachs, Miranda’s new assistant.",male
378,NIGEL," Chairman of Elias Clarke.  You know what they say, tiny man, huge ego. We should have taken the stairs.",male
379,NIGEL, You know me. A full ballerina skirt with a hint of saloon and I’m on board.,male
380,NIGEL," --LaCroix from July? I thought of that, but with the right accessories, it could work...",male
381,NIGEL," And that’s my problem because -- wait, no. Not my problem.",male
382,NIGEL, So quit.,male
383,NIGEL," Andy, please. Be serious. You’re not trying. You’re whining.",male
384,NIGEL," Oh, no. No way...",male
385,NIGEL, The other girls are different. They really want it.,male
386,NIGEL, I don’t know what you expect me to do. These are all sample sizes -- 2 and 4.,male
387,NIGEL, You’ll take what I give you and you’ll like it.,male
388,NIGEL, They’re not expecting us until Tuesday. Did she say why?,male
389,NIGEL, I see your point.,male
390,NIGEL, And then there’s the pursing of the lips.,male
391,NIGEL, Catastrophe.,male
392,NIGEL," You still don’t get it, do you? Her opinion is the only one that matters.",male
393,NIGEL," ...Posen’s doing some very sculptural suits, so Testino wants to shoot them at the Noguchi Garden in the Chase building.",male
394,NIGEL, Of course. A few extra yards of fabric and a staple gun and we’re in business.,male
395,NIGEL," Remember, there are two keys to wearing an evening gown -- one is to maintain a regal bearing. The second--",male
396,NIGEL," ...this benefit is the social event of the season. It represents what Runway is about -- grace, style, elegance...",male
397,NIGEL, The lizard’s better with the Dolce. Sometimes I can’t believe I talk about this crap all day.,male
398,NIGEL, Get these to Miranda right away. Tell her I switched in the Dior for the Rochas.,male
399,NIGEL, Hey. Adjust the attitude. Don’t make me feed you to one of the models.,male
400,NIGEL," Join the club. You start to do well at work, that’s what happens.",male
401,NIGEL," Hi. Listen, I need Miranda’s itinerary because--",male
402,NIGEL, That outfit.,male
403,NIGEL," Incredible. Well, I guess my work here really is done. Come on. Let’s have champagne. We’re celebrating.",male
404,NIGEL," To getting the dream job, the one a million girls wanted.",male
405,NIGEL, I’m not talking about you.,male
406,NIGEL," Can you believe it? For the first time in eighteen years, I’m going to call the shots in my own life. One day I might be able to come to Paris and actually... see Paris.",male
407,NIGEL, Bet your ass.,male
408,NIGEL," For seventy-two years, Runway has been more than a magazine, it’s been a beacon of elegance and grace. Miranda Priestly is the finest possible guardian of that beacon, setting a standard that inspires people across the globe. Ladies and gentlemen, I give you Miranda Priestly.",male
409,NIGEL," I’ve given her everything I have, Andy. She knows that.",male
410,NIGEL," When the time is right, she’ll pay me back.",male
411,NIGEL, No. But I hope for the best. I have to.,male
673,NIGEL, You do know that cellulite is one of the ingredients of corn chowder.,male
674,NIGEL, Something tells me you’ve got more polyblend where that came from.,male
675,NIGEL, Miranda wants us upstairs. Chairman’s on his way down to her office.,male
676,NIGEL, We could replace you in five minutes. With someone who really wants this job.,male
677,NIGEL," You want me to say poor you, Miranda is picking on you? She’s just doing her job. Wake up, Six. You’re working at the place that first published some of the major artists of the century -- Halston, De La Renta, Lagerfeld. And what they made is cooler than art, because you live your life in it -- I mean, not you, but some people. This is not just a magazine. It’s a shining beacon of hope for, oh, I don’t know, say a young boy growing up in Rhode Island with six brothers, pretending to go to soccer practice when he was actually at sewing class and reading Runway at night under the covers with a flashlight.",male
678,NIGEL," You have no idea how many legends have walked these halls and what’s worse, you don’t care. Because this is a “stepping stone” for you. This place, that people would die to work, you deign to work. And you want to know why she doesn’t give you a kiss on the forehead and put a gold star on your homework?",male
679,NIGEL," Versace peasant skirt -- we can pull it up, belt it, make it a dress... Miu Miu boyfriend cardigan... Alberta Ferretti dress -- smocked, very forgiving. And let’s find you some Chanel. You’re in desperate need of Chanel.",male
680,NIGEL, Don’t just stand there. We have to get you to the beauty department too. And God knows how long that will take.,male
681,NIGEL, Make sure the girls face forward.,male
682,NIGEL, Not bad. How do you feel?,male
683,NIGEL, Let me know when your whole life goes up in smoke. That means it’s time for a promotion.,male
684,NIGEL, Who put that together for you?,male
685,NIGEL," James Holt. Massimo is investing in James’ company, taking it global with the rest of CFG -- shoes, bags, fragrances, the works. So James needs a partner. And that would be me. Miranda knows. She put me up for it.",male
