,character,text,gender
720,CHRISTIAN, Don’t worry. I know this city like the back of my hand. It’s my favorite place on the planet. You know what Gertrude Stein said -- “America is my country and Paris is my hometown.”,male
721,CHRISTIAN, I work free-lance. Leaves me with some time on my hands.,male
722,CHRISTIAN, Thank God.,male
723,CHRISTIAN, What does it look like? It’s a mock- up.,male
724,CHRISTIAN, Of what American Runway will look like when Jacqueline is the new editor-in- chief.,male
725,CHRISTIAN," Yes. And she’s bringing me in to run all the editorial content. Are you really surprised? Jacqueline is a lot younger than Miranda. Has a fresher take on things. Not to mention that American Runway is one of the most expensive books in the business. Jacqueline does the same thing with a lot less money. Irv is a businessman, you know.",male
726,CHRISTIAN, It’s done. Irv’s going to tell Miranda after the party for James.,male
727,CHRISTIAN, She’s a big girl. She’ll be fine.,male
728,CHRISTIAN," It’s done, Andy.",male
650,DOUG, Miranda Priestly is famous for being unpredictable.,male
651,DOUG, I’m actually a girl.,male
652,DOUG," Seriously, Miranda is a huge deal. I bet a million girls would kill for that job.",male
653,DOUG," Lucky for me, I have my dream job.",male
654,DOUG, -- which totally rocks. The free bagels on Thursday? The booze? The whores?,male
655,DOUG," Dammit, I love your job.",male
656,DOUG, Men can be pink. I have a pink side.,male
657,DOUG," Fashion is not about utility, Nate. An accessory is merely a piece of iconography used to express individual identity.",male
658,DOUG, That too.,male
659,DOUG, You’re going to Paris for the couture shows? That’s the coolest fashion event of the year -- who are you going to see Galliano? Lagerfeld? Nicolas Ghesquiere?,male
268,EMILY, Human Resources certainly has a bizarre sense of humor. Follow me.,female
269,EMILY, I can’t even talk about it.,female
270,EMILY," No, stay. I don’t want you walking past her. Just sit there and I’ll pray she doesn’t notice you marring the area.",female
271,EMILY," Okay, first of all, you and I answer the phones. The phone MUST be answered every single time it rings.",female
272,EMILY," Phones roll to voicemail, she gets very upset. If I’m not here, you are chained to this desk.",female
273,EMILY," I get to wear couture, go to all the shows, all the parties, meet all the designers. It’s divine.",female
274,EMILY," Okay, stay here. I’m going to the art department to give them the Book.",female
275,EMILY," The Book is a mock-up of everything in the current issue. We deliver it to Miranda’s apartment every night and she returns it in the morning with her notes. The second assistant is supposed to do it, but Miranda is very private and doesn’t like strangers going to her house. So until she decides you’re not a psycho, I get the lovely task of waiting around for the Book.",female
276,EMILY," Now, be prepared. The run-through is at 12:30 and people are panicking, so the phone is going to be ringing off the hook.",female
277,EMILY," After the loo, Serena and I are going to lunch. This is her. The new me.",female
278,EMILY, I told you.,female
279,EMILY," I get twenty minutes for lunch, you get fifteen. When I come back, you can go.",female
280,EMILY, --disaster.,female
281,EMILY," When Miranda gives someone an impossible task, it generally means one of two things. One, she thinks you can actually pull it off.",female
282,EMILY, You have to learn these too.,female
283,EMILY," John Folger. New artistic director, Circle in the Square.",female
284,EMILY," What gets me about this whole thing is, you’re the one who pretends you don’t care about this stuff. You don’t care about fashion, you just want to be a journalist, blah, blah, blah. What a load of bollocks.",female
285,EMILY," And you know what really kills me? The clothes you’re about to get. You don’t deserve them. You eat carbs, for Christ’s sake. It’s so unfair. Just go.",female
286,EMILY," Okay, so... I was Miranda’s second assistant, but her first assistant recently got promoted so now I’m the first...",female
287,EMILY, I’m trying. Miranda sacked the last two girls after only a few weeks. We need to find someone who can survive here. Do you understand?,female
288,EMILY, You didn’t just ask me that. She’s the editor in chief of Runway. Not to mention a legend. Work a year for her and you can get a job at any magazine you want. A million girls would kill for this job.,female
289,EMILY," Andrea, Runway is a fashion magazine. An interest in fashion is crucial.",female
290,EMILY," Oh my God. No. No, no, no.",female
291,EMILY, She’s on her way -- tell everyone!,female
292,EMILY," Her driver text-messaged. Her facialist ruptured a disk. God, these people!",female
293,EMILY, Oh no. You’re still here. Go.,female
294,EMILY," I’m so sorry, Miranda. I did confirm last night, but--",female
295,EMILY, Right.,female
296,EMILY," Nobody. Human resources sent her up about the assistant job and I was pre- interviewing her for you, but--",female
297,EMILY, She wants to see you.. Go go go,female
298,EMILY, Andrea!,female
299,EMILY, Miranda decided to kill the Autumn Jacket story for September -- she’s pulling up the Sedona shoot from October. You need to go into the office right this second. Pick up her coffee order on the way. Write this down.,female
300,EMILY, Where are you?,female
301,EMILY, I hope you know this is a very difficult job for which you are totally wrong and if you mess up MY head is on the chopping block.,female
302,EMILY, One time an assistant left the desk because she sliced her hand open with a letter opener. Miranda missed Lagerfeld right before he boarded a 17 hour flight to Australia. She now works at TV Guide.,female
303,EMILY," Miranda Priestly’s office. She’s not available. I’ll tell her you called. Yet again. Remember, you and I have totally different jobs. You run errands, you get coffee, etcetera. I am in charge of her schedule, her expenses, her appointments. And, most importantly... I get to go with her to Paris for Fashion Week in the fall.",female
304,EMILY, I have no idea.,female
305,EMILY, I have Miranda Priestly calling. I have Patrick.,female
306,EMILY, Did she say which skirts? Did she say what kind? Color? Shape? Fabric?,female
307,EMILY," You never ask Miranda. Anything. All right, I’ll take care of the other stuff. You go to Calvin Klein.",female
308,EMILY, I’m sorry. Do you have a prior commitment? Is there some hideous pants convention?,female
309,EMILY, You’re not going to the store.,female
310,EMILY, You are catching on quickly. We always send assistants to a designer’s home on their very first day. You’re going to his showroom. I’ll give you the address.,female
311,EMILY, Good God. You do not. Under any circumstances. Take public transportation.,female
312,EMILY, Oh my God. What took you so long? I have to pee.,female
313,EMILY, You do the coat.,female
314,EMILY, The editors bring in options for a shoot and Miranda chooses. She chooses every single thing in every single issue. Run-throughs are a huge deal.,female
315,EMILY, No. Sometimes it’s busy.,female
316,EMILY," Oh, no. I was quite serious.",female
317,EMILY, Yes.,female
318,EMILY," Excuse me, where do you think you--",female
319,EMILY, I have no idea why Miranda hired her.,female
320,EMILY, I knew from the moment I saw her that she was a complete and utter--,female
321,EMILY, Guard this with your life.,female
322,EMILY," Yeah. Whoopee. Okay, now, it’s very important that you do EXACTLY what I’m about to tell you.",female
323,EMILY, Do not talk to anyone. Do not look at anyone. That is of the utmost importance. You must be invisible. Do you understand?,female
324,EMILY, You went upstairs? Oh my God. Why didn’t you just climb into bed with her and ask for a bedtime story?,female
325,EMILY," Don’t you understand? If you get fired, that might jeopardize Paris for me. And if that happens, I will search every Blimpie’s in the tri-state area until I find you and kill you.",female
326,EMILY, I don’t know. She’s not happy.,female
327,EMILY," Oh look, you’re getting paranoid. Yay. It’s not just me. Listen, don’t freak out. There could be a silver lining here.",female
328,EMILY," Or, you know, that thing you were saying about the cat.",female
329,EMILY," You know, I rarely say this to people who aren’t me, but you need to calm down.",female
330,EMILY," Tonight’s the benefit. I’ve been looking forward to it for MONTHS. I refuse to be sick. I’m wearing Valentino. Everyone’s going to be leaving to get dressed soon, so after you drop off Miranda’s Fendi bag at the re-beaders, you can just go home.",female
331,EMILY, I don’t see why she needs both of us.,female
332,EMILY, These are all the guests. Miranda invites everyone. We have to make sure they all think she knows exactly who they are. I’ve been studying for weeks.,female
333,EMILY, Don’t be silly.,female
334,EMILY," Oh my God, Andy. You look... chic.",female
335,EMILY," Do I? It’s for Paris. I’m on a new diet. I don’t eat anything, and then, when I feel like I’m about to faint, I eat a cube of cheese.",female
336,EMILY, I know. I’m just one stomach flu away from my goal weight.,female
337,EMILY, Ready?,female
338,EMILY, We need to make sure we’re there the second she walks in.,female
339,EMILY, There she is.,female
340,EMILY, She knows him.,female
341,EMILY, That’s... Wait... I know who that is... It’s...,female
342,EMILY, Thanks.,female
343,EMILY, Yes. Oh my God. Miranda hates her. She was supposed to arrive after Miranda left...,female
344,EMILY, You can go. I’ve got it from here.,female
345,EMILY, Go. Have fun.,female
346,EMILY, Everything okay?,female
347,EMILY, Sorry I’m late. Miranda wanted some scarves from Hermes and she told me yesterday but I forgot and so--,female
348,EMILY," I freaked out of course, but then I just called Martine at home and she opened the store early, so I got them.",female
349,EMILY, I hope it’s not another Miranda problem--,female
350,EMILY," Good. Because I’ve got so much to deal with before I go, I swear to God I can’t even--",female
351,EMILY," I don’t care if she was going to fire you or beat you with a red hot poker, you should have said no.",female
352,EMILY," Oh, please. That’s a pathetic excuse.",female
353,EMILY," Face it, Andy. You sold your soul the day you put on your first pair of Jimmy Choos.",female
354,EMILY," I said, go!",female
355,EMILY," My God, you call this a letter? Can you spell any word in the English language?",female
356,EMILY, You're joking. YOU have a favor to ask of ME?,female
357,EMILY," Well, I don't know. It is a huge imposition, but I suppose I could help you out... I'll have Roy pick them up this afternoon.",female
358,EMILY, Why can't you be more like Andy?,female
660,LILY, That would explain so much.,female
661,LILY, You have to start somewhere. Look at this dump Nate works in. Paper napkins? Hello?,female
662,LILY, Please. We’re eating.,female
663,LILY, And it’s preeeetty.,female
664,LILY, I’ll talk to her. Tell her she needs to get her own scrambled eggs.,female
665,LILY," Okay, but hurry.",female
666,LILY, I wasn’t sure you would be able to make it.,female
667,LILY, I’m just glad you’re here. Start with the murals in the other room. They’re amazing...,female
668,LILY, Yeah. That looked like work.,female
669,LILY," The Andy I know is madly in love with Nate, is always five minutes early and thinks Club Monaco is couture. For the last 16 years I’ve known everything about that Andy, but this person?",female
670,LILY, Sorry. Town car’s in the shop.,female
671,LILY, And you’d be lost without me.,female
672,LILY, Does this mean I have to give my purse back?,female
412,MIRANDA, I don’t understand why it’s so difficult to confirm an appointment.,female
413,MIRANDA, The details of your incompetence do not interest me.,female
414,MIRANDA," And tell Richard I saw the pictures of for the feature on female paramedics and they’re all so unattractive. I don’t understand. How hard is it to find a decent-looking paramedic?... Also, I need to see what Nigel has called in for Gwyneth’s second cover try...",female
415,MIRANDA, I’ll do it. The last two you sent me were total disappointments. Send her in.,female
416,MIRANDA, Who are you?,female
417,MIRANDA, What are you doing here?,female
418,MIRANDA, So you don’t read Runway?,female
419,MIRANDA," And before today, you had never heard of me?",female
420,MIRANDA, And you have no style or sense of fashion.,female
421,MIRANDA, That wasn’t a question.,female
422,MIRANDA, That’s all.,female
423,MIRANDA, Is there a reason my coffee is not here? Was I unclear in some way?,female
424,MIRANDA, Emily!,female
425,MIRANDA, It’s too dark. I can’t see any of the clothes...,female
426,MIRANDA, And what is this? I want the title of the layout to bleed over the left side of the photo...,female
427,MIRANDA," No, no, no. That’s not what I want. I made that abundantly clear...",female
428,MIRANDA, What a fantastic story. So entertaining and full of useful information.,female
429,MIRANDA, Please bore someone else with your questions. Make sure we can get Pier 59 at 8 am tomorrow... Remind Jocelyn I want to see a few of those satchels Marc is doing in the pony... And tell Simone I’ll take Frankie if Maggie is not available tomorrow... And did Demarchelier confirm?,female
430,MIRANDA, Get him on the phone.,female
431,MIRANDA, Do you have Demarchelier?,female
432,MIRANDA, No... No... No... I swear I don’t understand why it’s so difficult for you to pull together a decent run- through. You had hours to prepare... Where are all the advertisers?,female
433,MIRANDA, We need more.,female
434,MIRANDA, Is it too much like the--,female
435,MIRANDA, Where are the belts for this skirt?,female
436,MIRANDA, Is something funny?,female
437,MIRANDA," This... stuff? Okay. I understand. You think this has nothing to do with you. You go to your closet and select, say, that lumpy blue sweater because you're trying to tell the world that you take yourself too seriously to care about what's on your body. What you don't know is that your sweater is not blue. It's not even sky blue. It's cerulean. You also don't know that in 2002,  De La Renta did a collection of cerulean gowns, Yves St. Laurent showed a cerulean military jacket, Dolce did skirts with cerulean beads, and in our September issue we did the definitive layout on the color. Cerulean quickly appeared in eight other major collections, then the secondary and department store lines and then trickled down to some lovely Casual Corner, where you no doubt stumbled on it.",female
438,MIRANDA, Get me Isaac.,female
439,MIRANDA, These eggs are frigid.,female
440,MIRANDA, Pick up the Polaroids from the swimwear shoot.,female
441,MIRANDA, The brakes in my car are making a weird noise. Take it in.,female
442,MIRANDA, We need the hat from the finale of the Zac Posen show.,female
443,MIRANDA, The girls need new boogieboards for spring break.,female
444,MIRANDA, Pick up my shoes from Manolo.,female
445,MIRANDA," ...and while you’re out, get Patricia.",female
446,MIRANDA, Get me Isaac!,female
447,MIRANDA, My flight is cancelled... Some absurd weather problem.,female
448,MIRANDA," Please. It’s just drizzling. Someone must be getting out. Call Donatella and get her jet. Call everyone with a jet -- Irv, Armani...",female
449,MIRANDA, Emily. Stop making excuses. GET ME HOME.,female
450,MIRANDA, The girls’ recital was wonderful. They played Rachmaninoff and everyone loved it. Except for me... because I was not there.,female
451,MIRANDA, Do you know why I hired you?,female
452,MIRANDA, That’s all.,female
453,MIRANDA," The gowns are fabulous, Ralph. We’re using the burgundy for the cover try and the lemon chiffon for the goddess story.",female
454,MIRANDA, Emily!,female
455,MIRANDA, Just let us out here.,female
456,MIRANDA, Yes. I did.,female
457,MIRANDA, Make sure you confirm my dinner with--,female
458,MIRANDA, And I need to see the look book for the November denim shoot.,female
459,MIRANDA, Fine.,female
460,MIRANDA, What did you want me to do? Walk out in the middle of a photo shoot?,female
461,MIRANDA, We were in a loft near the Seaport. My phone didn’t work. I told you.,female
462,MIRANDA, An-dre-a.,female
463,MIRANDA, I need the new Harry Potter book for the twins.,female
464,MIRANDA, Did you fall down and smack your little head on the pavement?,female
465,MIRANDA, We have all the published Harry Potter books. The girls want to know what happens next.,female
466,MIRANDA," We know everyone in publishing. Shouldn’t be a problem. You can do anything, right?",female
467,MIRANDA, My girls are leaving on the train to their Grandmother’s at 3. They’ll need the book by then.,female
468,MIRANDA, I’d like my steak in fifteen minutes.,female
469,MIRANDA, What is that doing here? I ordered it ages ago.,female
470,MIRANDA, One copy? What are my twins supposed to do with that... share?,female
471,MIRANDA, And where exactly are those fabulous copies? I don’t see them anywhere.,female
472,MIRANDA, Perfect. What about the accessories pages for April?,female
473,MIRANDA, We did that two years ago. What else?,female
474,MIRANDA, Florals. For spring. Groundbreaking.,female
475,MIRANDA, No.,female
476,MIRANDA, No.,female
477,MIRANDA, I want to make sure before the benefit that you are both fully prepped on the guest list.,female
478,MIRANDA, Only when the first assistant hasn’t decided to be disgustingly ill. You’ll come and help Emily.,female
479,MIRANDA, John. Good to see you.,female
480,MIRANDA," Massimo, you made it. I was worried you’d be too busy with your new factory in Ortezzano--",female
481,MIRANDA, Emily?,female
482,MIRANDA," Ambassador, Rebecca.",female
483,MIRANDA," Ah, Bonsoir, Cherie. Ta robe est rudement chouette.",female
484,MIRANDA, Thank you for coming to our little get together tonight.,female
485,MIRANDA, And we’re all so grateful.,female
486,MIRANDA," Darling, there you are.",female
487,MIRANDA," Come on, darling, let’s get something to eat. I’m starved, aren’t you?",female
488,MIRANDA, Andrea. Come up here.,female
489,MIRANDA, Paris is the most important week of my year. I need the best team possible with me.,female
490,MIRANDA," If you don’t go, I’ll assume you’re not serious about your future at Runway or any other publication.",female
491,MIRANDA, That’s all.,female
492,MIRANDA, Don’t forget to tell Emily.,female
493,MIRANDA, There you are. We need to go over the seating chart for the luncheon.,female
494,MIRANDA," By all means, move at a glacial pace. You know how that thrills me.",female
495,MIRANDA, Stephen won’t be coming.,female
496,MIRANDA," Well, if you speak to him and he decides to rethink the divorce, then “fetch” him. Fetch away.",female
497,MIRANDA," Another divorce in the papers... and we all know what they’ll say about me - - Dragon Lady, career-obsessed, drove away another “Mr. Priestly”.",female
498,MIRANDA, Don’t be ridiculous... why would you do that?,female
499,MIRANDA, Your job.,female
500,MIRANDA, Go.,female
501,MIRANDA, Excuse me?,female
502,MIRANDA, Excuse us a moment.,female
503,MIRANDA, Do not disturb me again.,female
504,MIRANDA, Are those freesias?,female
505,MIRANDA," If I see freesia anywhere, I will be very disappointed.",female
506,MIRANDA," Thank you everyone. Before I talk to you about James and everything he’s accomplished, I have news.",female
507,MIRANDA, I’m ready to go.,female
508,MIRANDA, You thought I didn’t know.,female
509,MIRANDA, Then I let Irv know Jacqueline was unavailable.,female
510,MIRANDA, Any of his other choices would find the job impossible and the magazine would surely suffer.  Especially because of the list--,female
511,MIRANDA," ...all of whom have promised to follow me whenever and if ever I leave Runway.  To any publication I choose. Of course, as soon as Irv understood, he reconsidered.",female
512,MIRANDA," I must say, I was impressed with you, how intently you tried to warn me.",female
513,MIRANDA, Of course you can. You already did. To Emily.,female
514,MIRANDA," No. You did choose. You chose to get ahead. You want this life, those choices are necessary.",female
515,MIRANDA," Don’t be silly, Andrea. This is what everyone wants. Everyone wants to be us.",female
516,MIRANDA, ...I don’t understand why it’s so challenging to get a car when I ask for one.,female
517,MIRANDA," Tell Simone I’m not approving the girl she sent in for the Brazil layout. I wanted clean, athletic, and smiling not dirty, tired and paunchy...",female
518,MIRANDA," RSVP yes to the Michael Kors party -- the car will drop me at 9:30 and wait until I leave at 9:45... Tell Natalie at Glorious Foods for the fortieth time -- no, I don’t want the tortes filled with warm rhubarb compote. I want the chopped almonds.",female
519,MIRANDA, Call my ex-husband and remind him the Parent-Teacher conferences at Dalton are tonight. Then call my husband and tell him to meet me for dinner at that place I went with Massimo...,female
520,MIRANDA, Who is that?,female
521,MIRANDA, Emily!,female
522,MIRANDA," There you are, Emily. How many times do I have to scream your name?",female
523,MIRANDA, I need ten or fifteen skirts from Calvin Klein...,female
524,MIRANDA, And Emily.,female
525,MIRANDA, What do you think?,female
526,MIRANDA, That’s all.,female
527,MIRANDA, I have to get home. Tonight. The twins have a recital at school tomorrow morning.,female
528,MIRANDA, I had hope. I always have hope. But you’re as disappointing as anyone else.,female
529,MIRANDA, Call James Holt’s office. Tell them I want to move the preview to today at 12:30. And tell everyone else. Be ready to leave in half an hour.,female
530,MIRANDA, Thank you.,female
531,MIRANDA," Oh, and you’ll be bringing The Book to my home tonight. Emily will give you the key, Andrea.",female
532,MIRANDA," Luckily, before I starved to death, Irv invited me to lunch. Get rid of that. I’ll be back at 3. Please have my Starbucks order waiting.",female
533,MIRANDA," And if you don’t have the Harry Potter book by then, don’t come back.",female
534,MIRANDA, Anyone have anything I can actually use?,female
535,MIRANDA, That no longer includes Emily.,female
536,MIRANDA, The decision is yours.,female
537,MIRANDA," Okay, so, first of all, let’s put Jay- Z at my table.",female
538,MIRANDA," When we get back to New York, we’ll need to think of a way to keep it out of the press.",female
539,MIRANDA," He knew who I was, you know. They all did. And at first they’re always proud to be with a powerful, accomplished woman. That’s what they say. But then...",female
540,MIRANDA," I don’t care what anyone says about me, of course. But it’s so unfair to the girls... another disappointment, another stepfather, gone...",female
541,MIRANDA," I mean, the point is--",female
542,MIRANDA, We really need to figure out where to put Donatella because she’s barely speaking to anyone.,female
543,MIRANDA, Have you lost your mind?,female
544,MIRANDA," Tonight is not just an important night for me, for Runway, and for James, it’s also important for someone else in this room...",female
545,MIRANDA," As of next month, James will be partnering with CFG in an expansion of his line.",female
546,MIRANDA, James and Runway have one important thing in common -- a commitment to excellence.,female
547,MIRANDA, And so it comes as no surprise that James has selected someone from the Runway family as the new copresident of JH International...,female
548,MIRANDA," My esteemed colleague, Jacqueline Follet.",female
549,MIRANDA, Let’s wish Jacqueline the best as she pursues this wonderful opportunity.,female
550,MIRANDA, And now to the business at hand. A celebration of one of my favorite designers...,female
551,MIRANDA," I’ve known what was happening for quite some time.  It took a little while to find a suitable alternative for Jacqueline, one she would accept. Turned out, that James Holt job is so absurdly overpaid--",female
552,MIRANDA," I never thought I would say this, Andrea, but I see some of myself in you. Your dedication, your focus.",female
553,MIRANDA," People think success happens to you. It doesn’t. You choose it. Every day, I choose excellence. Who else does what I do, at my level? Nobody. They don’t even understand what it takes, the days, measured in milliseconds...",female
554,MIRANDA, But now you know --and I know -- that you have it in you. That you can see beyond what other people want and choose for yourself.,female
600,NATE, Wow. You got a job at a fashion magazine. Was it a phone interview?,male
601,NATE, And Lily works at that gallery doing-- What the hell is it that you do?,male
602,NATE, You’re a corporate research analyst.,male
603,NATE, You’re going to be answering phones and getting coffee. You need a ballgown for that?,male
604,NATE, I think you look great. Always.,male
605,NATE, Come on. Let’s go home. I can think of something you can do without clothes.,male
606,NATE, Gimme that. There’s about eight dollars worth of Jarlsberg in there.,male
607,NATE," Easy, Killer.",male
608,NATE," Oh, no way. It’s mine now.",male
609,NATE, I think we better get out of here before my girlfriend sees me with you.,male
610,NATE, All for a woman who doesn’t need anything. Perfect.,male
611,NATE," Why do women need so many bags? You get one, it holds all your junk, aren’t you done?",male
612,NATE," Why, does he need a sweater?",male
613,NATE, Look who’s drinking the KoolAid.,male
614,NATE," Oh, look. The Dragon Lady. Of course.",male
615,NATE, You got the nuclear briefcase from the undisclosed location. I’m proud of you.,male
