,character,text,gender
0,ANDY, What floor is Elias-Clarke? Human Resources.,female
1,ANDY, This article was about the Take Back the Night march. This was a four-part series on the impact of busing on the public schools...,female
2,ANDY, And the other one--?,female
3,ANDY," Hi, I have an appointment with Emily Charlton--",female
4,ANDY, And you’re replacing yourself.,female
5,ANDY, Yes. Of course. Who’s Miranda?,female
6,ANDY, Sounds great. I’d love to be considered.,female
7,ANDY, What makes you think I’m not interested in fashion?,female
8,ANDY, What’s wrong?,female
9,ANDY," Wow, this is like self-esteem camp.",female
10,ANDY, My name is Andy Sachs. I recently graduated from--,female
11,ANDY, I think I could do a good job as your assistant and--,female
12,ANDY, No.,female
13,ANDY, No.,female
14,ANDY, That depends on--,female
15,ANDY, I was Editor in Chief of the Daily Northwestern. I won a national competition for college journalists with a series on the janitor’s union --,female
16,ANDY, --that uncovered the exploitation of--,female
17,ANDY, Thank you for your time.,female
18,ANDY, Don’t be a jerk.,female
19,ANDY," Okay, how is it that you know who she is and I didn’t?",female
20,ANDY," Yeah, it’s just that I’m not one of them.",female
21,ANDY, You should see the way the girls dress at Runway. I’m not sure I have anything to wear to work.,female
22,ANDY, I think I might.,female
23,ANDY, You are so full of it.,female
24,ANDY, Hello? Now?,female
25,ANDY, I’m almost there.,female
26,ANDY, Yes. She gave me the job.,female
27,ANDY," Actually, I’m from Cincinnati.",female
28,ANDY, What if the building’s on fire or my appendix explodes or something?,female
29,ANDY, Man the desk at all times. Got it.,female
30,ANDY, How do I prove I’m not a psycho?,female
31,ANDY, Wait. What do I do if--,female
32,ANDY," Hi, I’m Andy, I’m the new--",female
33,ANDY," That’s very nice of you, but I don’t need those. Miranda hired me. She knows what I look like.",female
34,ANDY," Actually, it’s Andy.",female
35,ANDY, What kind of--,female
36,ANDY, Demar--,female
37,ANDY, Yes?,female
38,ANDY, Demarchelier... Demarchelier...,female
39,ANDY," She called me in and asked me about Pier 59. She said something about Simone and Frankie and someone else. And she needs skirts from Calvin Klein. I think that’s the most important thing, but I couldn’t tell. Oh, and there was something about a pony.",female
40,ANDY," I tried to ask her, but--",female
41,ANDY, Me?,female
42,ANDY," So I just, what, go down to the Calvin Klein store and ask them--",female
43,ANDY, Of course not. I’m going... to his house.,female
44,ANDY, Sorry. Got it. What’s the nearest subway stop?,female
45,ANDY, Thanks.,female
46,ANDY, You’re going to say a million girls would kill for my job.,female
47,ANDY, I’m about to walk in. I’ll call you as soon as--,female
48,ANDY," There’s a um, variety of skirts. Let’s see...",female
49,ANDY, I’m sorry. What’s your name?,female
50,ANDY, It’s Liz.,female
51,ANDY, Is Ivan in by any chance?,female
52,ANDY, You haven’t peed since I left?,female
53,ANDY, The run-through. Right.,female
54,ANDY, Is it always like this?,female
55,ANDY, You eat lunch?,female
56,ANDY, None of the girls here eat anything?,female
57,ANDY, I’m a 6.,female
58,ANDY," Okay. You think my clothes are hideous. I get it, okay?",female
59,ANDY," No, no, no. It’s just...",female
60,ANDY, You should have seen the look she gave me. I thought the flesh was going to melt off her face.,female
61,ANDY, I just have to stick it out for one year. Then I can do what I came to New York to do. I can’t let Miranda get to me. I won’t.,female
62,ANDY, And give me that sandwich.,female
63,ANDY," Good morning, Miranda!",female
64,ANDY, I have Isaac.,female
65,ANDY, Dad! I’ll be right down!,female
66,ANDY, How did you-- I’m gonna kill Mom. Thank you.,female
67,ANDY," Oh, just go ahead.",female
68,ANDY, Hey. Not fair. I wrote those e- mails.,female
69,ANDY, Oh please. Not this again.,female
70,ANDY, Because it’s what you wanted. This is what I want.,female
71,ANDY, I’m an executive assistant.,female
72,ANDY," You have to trust me. Being Miranda’s assistant opens a lot of doors. Emily is going to Paris with Miranda in a few months, she’ll meet editors and writers from every important magazine.",female
73,ANDY," Absolutely, Miranda. Let me see what I can do.",female
74,ANDY," I need a jet from Miami to New York... A jet, any kind of jet... Yes, tonight, right now. From Miami to New York. As soon as possible. Please call me back as soon as the situation changes. I’m trying, Miranda. No one is flying out because of the weather.",female
75,ANDY, I’ve done everything I could think of. I don’t know what else to do.,female
76,ANDY, Oh my God. She is going to murder me.,female
77,ANDY," I’m so sorry, Miranda.",female
78,ANDY, I did everything I could think of--,female
79,ANDY," She hates me, Nigel.",female
80,ANDY, I need your help. I don’t know what to do. It’s like I’m completely beneath her contempt.,female
81,ANDY," That’s not fair. I’m lucky to be working for Miranda -- I didn’t get that at first, but I do now. I want to be here. But it just seems like no matter how hard I try, I don’t do anything right.",female
82,ANDY," Okay, fine!",female
83,ANDY, You do it with the other girls.,female
84,ANDY," Please, Nigel. Don’t make me beg...",female
85,ANDY, A... poncho?,female
86,ANDY, Miranda Priestly’s office. She’s not in. I’ll leave word.,female
87,ANDY, What do you think?,female
88,ANDY," Wanna lift, stranger?",female
89,ANDY, Bang & Olufsen. Charlie Rose sent it to Miranda for her birthday.,female
90,ANDY," Here... A bunch of Kiehl’s, some Mason Pearson hair brushes...",female
91,ANDY, It’s called “Pink”. For women.,female
92,ANDY, Sure you can.,female
93,ANDY," Thing is, it turns out there’s a lot more to Runway than fancy purses... you know who’s coming into the office Friday? John Updike.",female
94,ANDY," Look, there’s a piece by Jay McInerney, an essay by Joan Didion, an interview with Christiane Amanpour oh...",female
95,ANDY, Give me the phone.,female
96,ANDY, Give me the phone.,female
97,ANDY," Come on, guys. Give me the phone!",female
98,ANDY, I’m looking for James Holt...,female
99,ANDY, You.,female
100,ANDY, I’ll guard it with my life.,female
101,ANDY," Hi. I, um... I have to go.",female
102,ANDY," God, I love it when total strangers tell me how I feel.",female
103,ANDY, Christian Thompson? You’re kidding. You write for every magazine I love. I actually reviewed your collection of essays for my college paper.,female
104,ANDY," No, but I did point out some factual errors and a penchant for confessional semi-fiction that borders on self-indulgent.",female
105,ANDY," Well, I want to work somewhere like the New Yorker or Vanity Fair. I’m also a writer, but--",female
106,ANDY," Thank you. That would be great. Anyway, for now I’m Miranda Priestly’s assistant.",female
107,ANDY, Excuse me?,female
108,ANDY, I have to go.,female
109,ANDY, You. Are not a nice person.,female
110,ANDY," For your information, he’s really handsome. And we already live together!",female
111,ANDY, Where are you going?,female
112,ANDY, But I came back so we could hang out.,female
113,ANDY," Okay, look, I’m sorry about that--",female
114,ANDY," Yes, she explained every detail of her decision-making, then we brushed each other’s hair and gabbed about American Idol.",female
115,ANDY, What does that mean?,female
116,ANDY," Last time I was here, James was having this cool party and-- --and this is why you don’t like people riding up in the elevator with you.",female
117,ANDY, She pursed her lips and because of that he’s going to change his entire collection?,female
118,ANDY, --Galliano at Pastis. Done.,female
119,ANDY, It’s in the car.,female
120,ANDY," Of course. If I can deliver the Book, that means I must have done something right, that she doesn’t think I’m psycho. Oh, and she actually called me Andrea instead of Emily. Isn’t that great?",female
121,ANDY, Shit.,female
122,ANDY, But I can’t... Shh...,female
123,ANDY," Okay, before you start freaking out, it wasn’t such a big deal. The twins said hello, I said hello back, then I went upstairs and gave the book to Miranda--",female
124,ANDY, You’re right. I made a mistake.,female
125,ANDY, Wait a second. She’s going to fire me?,female
126,ANDY," Miranda, about last night, I--",female
127,ANDY, Of course. I’ll run down to Barnes & Noble right now.,female
128,ANDY, Not that I can recall.,female
129,ANDY, So you want the... unpublished manuscript.,female
130,ANDY, She doesn’t get it. There’s no way I can get that book. I don’t care who I call.,female
131,ANDY, Of course.,female
132,ANDY, No problem.,female
133,ANDY, Or--,female
134,ANDY," It’s for Miranda Priestly... it’s very important. Yes, I know, it’s impossible to get",female
135,ANDY," Anything? Can you try again? I would really appreciate any leads at all... thanks. No pressure. If I don’t have it by 3, I’m fired.",female
136,ANDY, Yeah. It’s a real party.,female
137,ANDY, Listen. I desperately need a favor. And I don’t know many people in the book world...,female
138,ANDY," We’re talking about Miranda Priestly. There is no plan B, only plan A.",female
139,ANDY, Is she back? Am I fired?,female
140,ANDY," Harry Potter. The manuscript. It’s for Miranda Priestly. I need it today. Can you make it extra hot? Like, center of the sun hot?",female
141,ANDY," Actually, it is. A million girls would kill for it.",female
142,ANDY, Want a mocha?,female
143,ANDY, I failed. She’s going to fire me anyway. Might as well beat her to the punch.,female
144,ANDY, Call you later.,female
145,ANDY, You didn’t.,female
146,ANDY," No. That would mean I actually... did something right. But see... thing is... See, I was about to...",female
147,ANDY," Yes, I’m meeting someone...",female
148,ANDY, I’m begging you. You have to stall her. Just ten minutes.,female
149,ANDY," Actually I made two copies. And had them color-copied, re-set and bound so they wouldn’t look like manuscripts.",female
150,ANDY, Anything else I can do for you?,female
151,ANDY," Listen, Nate--",female
152,ANDY," After I called you, I realized... It doesn’t make sense to throw away all these months of hard work. I just had a moment of weakness. That’s all.",female
153,ANDY," That’s all it is, Nate. Just a job.",female
154,ANDY," I get the point, Nate.",female
155,ANDY, Gstaad. It’s a ski resort. In Switzerland.,female
156,ANDY," Nate, it’s not like I run the magazine. I just work there, remember?",female
157,ANDY, What about these? These are pretty nice.,female
158,ANDY, Are you okay?,female
159,ANDY," Great. Thanks. That’s perfect, because I need to get to Magnolia Bakery before they close...",female
160,ANDY, Um... I thought only the first assistant went to the benefit.,female
161,ANDY, Don’t look at me. This is the last thing I want to do.,female
162,ANDY, I need to learn all these people by tonight?,female
163,ANDY," Lily, just start without me. I’ll be there as soon as I can.",female
164,ANDY," I will. I promise. Believe me, this is the last thing I want to--",female
165,ANDY, And you look... so thin.,female
166,ANDY, It’s definitely working.,female
167,ANDY, That’s... great.,female
168,ANDY, I was wondering how long you think we’ll have to stay because I was hoping to--,female
169,ANDY," That’s Massimo Cortileono, chairman of-",female
170,ANDY," Ambassador Franklin. And that’s the woman he left his wife for, Rebecca. The woman he’s leaving HER for is the man walking down the stairs in Valentino.",female
171,ANDY," That’s... Jacqueline Follet, right? From French Runway.",female
172,ANDY," Alors, Jacqueline, ditez-moi, avez- vous rencontré Brad Pitt?",female
173,ANDY, Are you sure?,female
174,ANDY, Thank you. Thank you so much.,female
175,ANDY," I’m sorry to bother you, but I’ve been dying to ask you... Is it true that John Cheever used to ghostwrite the editor’s page of Manhattan Magazine in the 50’s?...",female
176,ANDY," Hey, I figured out a few things on my own, too. Turns out I’m not as nice as you thought.",female
177,ANDY, Do you really say things like that to people?,female
178,ANDY, I have to go...,female
179,ANDY," Well, maybe I could-- No no no. I can’t. I just can’t.",female
180,ANDY, Can you go any faster?,female
181,ANDY, Happy Birthday.,female
182,ANDY, Can we at least talk about it this--,female
183,ANDY," I don’t understand what’s so difficult about scheduling a preview. If you want Miranda to give you any editorial, we’ll need to see the clothing at least three weeks before the show. Yes, please. See what you can do.",female
184,ANDY, Yeah. I’m... fine.,female
185,ANDY, Great. No problem.,female
186,ANDY, Sorry. Busy day. And my personal life is going down the drain. That’s all.,female
187,ANDY," Wait. You want ME to -- oh, no. No, no. Emily would die. Her whole life is about Paris.",female
188,ANDY, But--,female
189,ANDY," Okay. Emily. When you get in, I want to talk to you about something--",female
190,ANDY, Not exactly.,female
191,ANDY, I didn’t have a choice. You know how she is.,female
192,ANDY," Look, I know you’re mad. And I don’t blame you.",female
193,ANDY, Emily--,female
194,ANDY," Okay, now you’re scaring me.",female
195,ANDY, What are you talking about? I wouldn’t miss this.,female
196,ANDY, Come on.,female
197,ANDY, Actually...,female
198,ANDY, Sorry. I’ll be too busy working. You’ll have to find someone else’s life to change.,female
199,ANDY, He’s just a guy I know from work.,female
200,ANDY, You’re making a big a deal out of--,female
201,ANDY, It just happened--,female
202,ANDY," Great. Now you’re going to give me a hard time, too?",female
203,ANDY," Miranda asked me and I couldn’t say no, okay? I didn’t have a choice.",female
204,ANDY," Okay. I get it, you’re mad because I work late all the time, because I missed your birthday party--",female
205,ANDY, You hate Runway. And Miranda. You think fashion is stupid. You’ve made that clear.,female
206,ANDY, So now I have no integrity. Great.,female
207,ANDY, That’s absurd.,female
208,ANDY, You don’t mean that.,female
209,ANDY, Then maybe this trip is coming at a good time. Maybe we should take a break.,female
210,ANDY," Hello, Miranda...",female
211,ANDY, Wait. This is not right. Miranda is staying in the suite.,female
212,ANDY, This is my room?,female
213,ANDY," Oh, do I?",female
214,ANDY," Actually, Miranda has a dinner.",female
215,ANDY," Oh, you’re so full of it. You are not desolé at all.",female
216,ANDY," Sure. No problem. I have it right here, um...",female
217,ANDY, But your table is full.,female
218,ANDY, So Stephen is not... so you don’t need me to fetch Stephen from the airport tomorrow?,female
219,ANDY, Of course.,female
220,ANDY," Miranda, I’m so sorry. If you want me to cancel your evening, I can.",female
221,ANDY," Miranda, is there... is there anything else I can do?",female
222,ANDY, What do you mean?,female
223,ANDY," Oh, I just threw it on.",female
224,ANDY, What are we toasting?,female
225,ANDY, Nigel. I got my job months ago.,female
226,ANDY," You’re leaving? Nigel, I can’t imagine Runway without you.",female
227,ANDY," God. I’m so happy for you, Nigel. You deserve it.",female
228,ANDY, ...I’ve never seen anyone as dedicated as Miranda.,female
229,ANDY," I’m just saying, yes, there are things she does I don’t agree with, but...",female
230,ANDY," Okay, so she’s tough, but if Miranda were a man, no one would notice anything but how great she is at her job.",female
231,ANDY, I resent that.,female
232,ANDY, Sexy? Really?,female
233,ANDY, I have no idea where we’re going. You could be leading me anywhere...,female
234,ANDY, You are unbelievable. Do you write that stuff down and file it away to use on girls?,female
235,ANDY," Well, I never understood why everyone was so crazy about Paris, but now...",female
236,ANDY, What the hell is this?,female
237,ANDY, Of?,female
238,ANDY, They’re replacing Miranda?,female
239,ANDY, Miranda will be devastated. Runway is her whole life. He can’t do that to her.,female
240,ANDY, And she has no idea...?,female
241,ANDY, I have to go.,female
242,ANDY," Oh, thank God. Where are you?",female
243,ANDY," I need to talk to you. Right away. It’s about Jacqueline Follet, she--",female
244,ANDY, I have to talk to you.,female
245,ANDY," Miranda, wait. I have to talk to you. You can fire me if you want to after that, but... Irv is going to make Jacqueline Follet editor-in-chief of Runway. Christian Thompson told me, he’s going to work for her. Irv’s going to tell you today. I thought if I told you now, you could fix it.",female
246,ANDY, What? No. I specifically told them--,female
247,ANDY, You said it was your dream job.,female
248,ANDY, But you don’t need her. You could just leave anyway and-,female
249,ANDY, You sure about that?,female
250,ANDY, But I don’t think I am like that.,female
251,ANDY, That’s not what I -- that was different. I didn’t have a choice.,female
252,ANDY," But what if it’s not what I want? I mean, what if I don’t want to live the way you do?",female
253,ANDY, You’re such a pain.,female
254,ANDY, True.,female
255,ANDY, I just wanted to say...,female
256,ANDY," Nate, I’m just... I’m so sorry.",female
257,ANDY, And?,female
258,ANDY," That’s great, I... congratulations.",female
259,ANDY, You think?,female
260,ANDY, Not sure.,female
261,ANDY, You think so?,female
262,ANDY, Thanks. I actually have a job interview today.,female
263,ANDY, That’s fine.,female
264,ANDY," Learned a lot. In the end, though, I kind of screwed it up.",female
265,ANDY," Emily, it's Andy. Don't hang up. I have a favor to ask you.",female
266,ANDY," Thing is, I have all these clothes from Paris and I don't have anyplace to wear them, so I was wondering... is there any way you could take them off my hands?",female
267,ANDY," Thanks, Emily. I appreciate it.",female
555,ANDY, I came to New York to be a journalist and I sent letters to everyone and I finally got a call from Elias-Clarke and met with Sherry in Human Resources and basically it’s this or Auto Universe.,female
556,ANDY," Okay, you’re right. I don’t fit in here. I’m not glamorous or skinny and I don’t know much about fashion. But I’m smart, I learn fast and I will work very hard.",female
557,ANDY, Oh no. Mrs. Priestly’s office. That’s what I meant. Miranda Priestly’s office.,female
558,ANDY, She’s in a meeting. Can I take message? I’m sorry. Can you spell Gabbana-- Guess not.,female
559,ANDY," My name is Andy. Andrea, but people call me Andy.",female
560,ANDY," It’s just that both of those belts look the same to me. I’m still learning about this stuff, so--",female
561,ANDY," It’s not funny. She could be the most horrendous person I’ve ever met. She’s not happy unless everyone around her is panicked, nauseous or suicidal. And all the Clackers just WORSHIP her... They call them Clackers. Their stilettos in the marble lobby... clack, clack, clack...",female
562,ANDY, And they all act like they’re curing cancer or something. The amount of time and energy they spend on things that DON’T MATTER!!! Poring over these minute details. And for what?,female
563,ANDY," So tomorrow they can spend an extra 300,000 dollars reshooting something that was probably fine to begin with? To sell people things they don’t need?",female
564,ANDY," God, I’m not even hungry anymore. Maybe that’s why everyone there is so skinny.",female
565,ANDY," Wow. Thank God it’s Friday, huh?",female
566,ANDY, My Dad’s coming in from Ohio this weekend. We’re having dinner tonight. Then we’re seeing “Chicago”...,female
567,ANDY, You doing anything fun this weekend?,female
568,ANDY, It’s so good to see you. You want to start grilling me now or should we wait until after dinner?,female
569,ANDY," Dad, I swear. This is my break. This is my chance. This is my--",female
570,ANDY, -boss.,female
571,ANDY, I have to get it.,female
572,ANDY," I’m so sorry, Dad. I have to deal with this.",female
573,ANDY," I’m sorry, Dad. Miranda, you don’t understand. Even if I get you a plane, they won’t let you take off tonight and--",female
574,ANDY," You’re right. I’m screwing this up. And I know this could be a big break for me. I’m going to try harder, I promise. But there’s one thing I can’t do by myself.",female
575,ANDY," Can I help you, luv?",female
576,ANDY," Hello, Miranda. Fine. No problem. I’m leaving right now. You guys didn’t need to be such assholes.",female
577,ANDY," Hi, I’m Andy. I’m picking up for Miranda Priestly.",female
578,ANDY," Great. I have to get the impossible manuscript in four hours. And Smith and Wollensky’s doesn’t open until 11:30. How am I supposed to get the steak? She’s going to fire me, isn’t she? She’s just prolonging the kill. Like an evil cat with a tiny unfashionable mouse.",female
579,ANDY," Sorry, my boss is particular. Are you sure? You’re my last shot. All right, well, thanks for trying.",female
580,ANDY, Hello?,female
581,ANDY, I’m the same person I was. I still want the same things.,female
582,ANDY," I promise. Same Andy, better clothes.",female
583,ANDY, And this skirt? Okay. What about this?,female
584,ANDY, ...it’s Nate’s birthday and we’re having a little party for him--,female
585,ANDY," Anyway, have fun tonight.",female
586,ANDY," Oh, I love that. I’ll call you the second I’m leaving.",female
587,ANDY, Will that fit me?,female
588,ANDY," Nate, I’m so sorry. I was trying to leave, but there was a lot going on and I didn’t have a choice and--",female
589,ANDY, Miranda Priestly’s office. Thanks. I gotta go pick up the Polaroids from the shoot.,female
590,ANDY," She hasn’t eaten in weeks. I can’t do that, Miranda. I can’t.",female
591,ANDY," Lily, this show is amazing. I am so proud of you.",female
592,ANDY, Nate!,female
593,ANDY, It’s. So. Beautiful.,female
594,ANDY, I can’t do this.,female
595,ANDY, Nate and I only split up a few days ago. I’ve had too much wine and my judgement is impaired. I barely know you and I’m in a strange city. I’m out of excuses.,female
596,ANDY, Shit!,female
597,ANDY," I couldn’t do what you did to Nigel, Miranda. There’s no way I could do something like that.",female
598,ANDY," Nate, you were right. About everything. I turned my back on my friends, my family, on everything I believed in. And for what?",female
599,ANDY, Don’t know what I’m going to do without those late night grilled cheeses.,female
686,CHRISTIAN," He’s right. I had the punch at James’s last party, woke up in Hoboken wearing nothing but boxers and a cowboy hat.",male
687,CHRISTIAN, But you want to stay. You’ve never been to a party like this.,male
688,CHRISTIAN, That’s my way. Christian Thompson.,male
689,CHRISTIAN, Did you mention my good looks and killer charm?,male
690,CHRISTIAN, You and the Times. And what do you do?,male
691,CHRISTIAN, Is that right? I should read your stuff. Send it over.,male
692,CHRISTIAN," You’re kidding. Oh, that’s too bad. You’ll never survive Miranda.",male
693,CHRISTIAN," You’re smart, you’re nice, you have a point of view. You can’t do that job.",male
694,CHRISTIAN," Let me guess. You have a boyfriend waiting. From... not high school... college? Nice-looking guy, devoted, about to ask you to move in with him, but you’re not sure...",male
695,CHRISTIAN," Nice to meet you, Miranda girl.",male
696,CHRISTIAN," Of course I remember you, Miranda Girl. You shaken off the college boyfriend yet?",male
697,CHRISTIAN, The Harry Potter manuscript? You’ve gotta be kidding.,male
698,CHRISTIAN, Just tell her it can’t be done. You’ll have to come up with a plan B.,male
699,CHRISTIAN, Oh yes. A friend of a friend does the cover art. She has the manuscript.,male
700,CHRISTIAN," You want this, you better hurry. Meet me at the St. Regis.",male
701,CHRISTIAN, You have one hour.,male
702,CHRISTIAN, Look at you... you’re a vision. Thank God I saved your job.,male
703,CHRISTIAN, God I hope not.,male
704,CHRISTIAN, Evidently.,male
705,CHRISTIAN," Are you sure? My editor from Vanity Fair is in there and I was going to introduce you to him. You sent me your stuff, remember? I have to be honest, I only read a couple -- that was quite a big packet - - but they weren’t half-bad. You’re pretty talented, Andy. He should meet you. Come on in. Just one drink.",male
706,CHRISTIAN, Say hello to the boyfriend for me.,male
707,CHRISTIAN," Hey, Miranda Girl.",male
708,CHRISTIAN, It’s true. I’m profiling Gaultier for Interview and I was making plans for Paris and found myself wondering if you would be there.,male
709,CHRISTIAN, That’s great. I’m staying at a fantastic little hotel in the Seventh across the street from a falafel restaurant that will change your life.,male
710,CHRISTIAN, But that’s just it. I’m starting to wonder if I can.,male
711,CHRISTIAN," You know, I’ve been thinking, and you still owe me for Harry Potter.",male
712,CHRISTIAN, Of course you do. You working tonight?,male
713,CHRISTIAN," So you’re free. Perfect. Oh, but there’s a problem, huh? Le Boyfriend.",male
714,CHRISTIAN," Yeah, not even a little. What time should I pick you up?",male
715,CHRISTIAN, That’s fantastic. Can we stop talking about her now?,male
716,CHRISTIAN," Oh, come on, Andy. You hate her. Just admit it. She’s a notorious sadist, and not in the good way.",male
717,CHRISTIAN, I can’t believe this. You’re defending her. The wide-eyed girl peddling her earnest newspaper stories -- you’re crossing over to the dark side.,male
718,CHRISTIAN, You shouldn’t. It’s sexy.,male
719,CHRISTIAN, Really.,male
