,character,text,number,types
2075,PROFESSOR LUPIN," Which perhaps explains her affection for your father.  James had, shall we say, a certain talent for trouble.  A gift, rumor has it, he passed on to you.",3,male
2076,PROFESSOR LUPIN," I could tell you stories -- and there are many about your parents, Harry -- but know this... They lived.  Every moment of every day.  You should know that. That's how they'd want to be remembered.",3,male
2077,PROFESSOR LUPIN," Dementors are among the foulest creatures that walk this earth. They feed on every good feeling, every happy memory, until a person is left with nothing but his worst experiences.  You're not weak, Harry.  The Dementors affect you most, because there are true horrors in your past.  Horrors your classmates can scarcely imagine.  You have nothing to be ashamed of.",3,male
2078,PROFESSOR LUPIN, I'd consider you a fool if you weren't.,3,male
2079,PROFESSOR LUPIN, There was only one that night...,3,male
2080,PROFESSOR LUPIN," I don't pretend to be an expert, Harry.  But yes, I can teach you. Perhaps after the holiday.  For now, though, I need to rest.  I'm feeling... tired.",3,male
2081,PROFESSOR LUPIN, Beautiful...,3,male
2082,PROFESSOR LUPIN," You're sure about this, Harry? This is very advanced magic.  Well beyond Ordinary Wizarding Level.",3,male
2083,PROFESSOR LUPIN, Very well.  The spell I'm going to teach you is called the Patronus Charm.  Ever hear of it?,3,male
2084,PROFESSOR LUPIN," A Patronus is a kind of positive force.  For the wizard who can conjure one, the Patronus works something like a shield.  The Dementor feeds on it instead of him.",3,male
2085,PROFESSOR LUPIN," But in order for it to work, you must think of a memory.  And not just any.  This memory needs to be a very happy one.  And powerful.",3,male
2086,PROFESSOR LUPIN, Got something?  Good.  Let it fill you up.  Lose yourself in it. Then speak the incantation: Expecto Patronum.  Without your wand...,3,male
2087,PROFESSOR LUPIN, Right then.  Shall we?,3,male
2088,PROFESSOR LUPIN," Concentrate, Harry. Concentrate...",3,male
2089,PROFESSOR LUPIN, Here!,3,male
2090,PROFESSOR LUPIN, Riddikulus!,3,male
2091,PROFESSOR LUPIN, Quickly.,3,male
2092,PROFESSOR LUPIN," Boggart, Harry.  The real thing would be much, much worse.  Just out of interest, what were you thinking of?  What memory did you choose?",3,male
2093,PROFESSOR LUPIN," That's not good enough, Harry. Not nearly.",3,male
2094,PROFESSOR LUPIN, Is it strong?,3,male
2095,PROFESSOR LUPIN, Then let's try it.,3,male
2096,PROFESSOR LUPIN," Think, Harry, think --",3,male
2097,PROFESSOR LUPIN, Riddikulus!,3,male
2098,PROFESSOR LUPIN, Well done.,3,male
2099,PROFESSOR LUPIN," So you know, Harry:  You'd have given your father a run for his money.  And, believe me, that's saying something.",3,male
2100,PROFESSOR LUPIN, Professor...?,3,male
2101,PROFESSOR LUPIN, Harry?  You all right?,3,male
2102,PROFESSOR LUPIN," I seriously doubt that, Severus. It looks to me as if it merely insults anyone who tries to read it.  I suspect it's a Zonko product.  Nevertheless, I shall pursue any hidden qualities it may possess.  As you say, it's my area of expertise.  Come, Harry.",3,male
2103,PROFESSOR LUPIN," I don't know how this map came to be in your possession, Harry, but I'm astounded that you didn't turn it in.  Did you ever stop to think that this -- in the hands of Sirius Black -- is a map to you?",3,male
2104,PROFESSOR LUPIN," Your father didn't set much store by rules either.  But he and your mother did give their lives to save yours.  Gambling their sacrifice by walking about the castle unprotected, with a killer on the loose, strikes me as a poor way to repay them.  I won't cover up for you again, Harry.",3,male
2105,PROFESSOR LUPIN," And who was that, Harry?",3,male
2106,PROFESSOR LUPIN," Very well.  I'd like you to return to your dormitory now.  Oh, and Harry?  Don't take any detours.",3,male
2107,PROFESSOR LUPIN, If you do.  I'll know.,3,male
2108,PROFESSOR LUPIN," Looking a bit ragged, aren't we, Sirius?  Finally the skin reflects the madness within.",3,male
2109,PROFESSOR LUPIN, How long have you known?,3,male
2110,PROFESSOR LUPIN," You're the brightest witch of your age I've ever met, Hermione.",3,male
2111,PROFESSOR LUPIN," Wait, Sirius --",3,male
2112,PROFESSOR LUPIN, All right then.  As you wish...,3,male
2113,PROFESSOR LUPIN, Harry!  You've got to listen --,3,male
2114,PROFESSOR LUPIN," Someone else betrayed your parents, Harry.  Someone in this room right now.  Someone who, until quite recently, I believed to be dead.",3,male
2115,PROFESSOR LUPIN, Severus --,3,male
2116,PROFESSOR LUPIN," Don't be a fool, Severus!",3,male
2117,PROFESSOR LUPIN," Quiet, Sirius!",3,male
2118,PROFESSOR LUPIN, Pettigrew.  He was at school with us.  We thought he was a friend.,3,male
2119,PROFESSOR LUPIN," I thought so, too.  Until you mentioned seeing Pettigrew on the Map.",3,male
2120,PROFESSOR LUPIN, We would.,3,male
2121,PROFESSOR LUPIN," Harry, this man...",3,male
2122,PROFESSOR LUPIN," Hello, Harry.",3,male
2123,PROFESSOR LUPIN, Saw you coming.,3,male
2124,PROFESSOR LUPIN," I've looked worse, believe me.",3,male
2125,PROFESSOR LUPIN," Resigned, actually.",3,male
2126,PROFESSOR LUPIN, It seems that someone has let slip the nature of my condition.,3,male
2127,PROFESSOR LUPIN," Whoever.  It was bound to get out. This time tomorrow, the owls will start arriving.  Parents will not want a -- someone like me -- teaching their children.",3,male
2128,PROFESSOR LUPIN," Has already risked enough on my behalf.  Besides, people like me, well... let's just say I'm used to this by now.  But before I go, tell me about your Patrons.",3,male
2129,PROFESSOR LUPIN, A stag.,3,male
2130,PROFESSOR LUPIN, Your father used to transform into one.  That's how he was able to keep me company when I became... sick.  He was a great friend James.,3,male
2131,PROFESSOR LUPIN, Mischief managed.,3,male
2132,DUMBLEDORE," Welcome!  Welcome to another year at Hogwarts!  I have a few things to say, before we become befuddled by our excellent feast.  I myself am particularly looking forward to the flaming kiwi cups, which, while somewhat treacherous for those of us with facial hair...",3,male
2133,DUMBLEDORE," Mm.  Yes.  First, I'm pleased to welcome Professor R.J. Lupin, who has kindly consented to fill the post of Defense Against the Dark Arts.  Good luck to you, Professor.",3,male
2134,DUMBLEDORE," As some of you may know, Professor Kettleburn, our Care of Magical Creatures teacher for many years, has decided to retire in order to spend more time with his remaining limbs.  Fortunately, I'm delighted to announce that his place will be filled by none other than our own Rubeus Hagrid!",3,male
2135,DUMBLEDORE," Finally, on a more disquieting note, Hogwarts -- at the request of the Ministry of Magic -- will, until further notice, play host to the Dementors of Azkaban.",3,male
2136,DUMBLEDORE," The Dementors will be stationed at the entrances to the grounds.  While they are under strict orders not to enter the castle itself, you will on occasion see them as you go about your daily activities.  Under no circumstances are you to approach them.  It is not in the nature of a Dementor to be forgiving.",3,male
2137,DUMBLEDORE, Mr. Filch.  Round up the ghosts. Tell them to search every painting in the castle for the Fat Lady.,3,male
2138,DUMBLEDORE, Dear lady.  Who did this to you?,3,male
2139,DUMBLEDORE," Secure the castle, Mr. Filch.  The rest of you... to the Great Hall.",3,male
2140,DUMBLEDORE, I didn't really expect him to linger.,3,male
2141,DUMBLEDORE," I do not believe a single professor inside this castle would have helped Sirius Black enter it, Severus.",3,male
2142,DUMBLEDORE," No... I feel quite confident the castle is safe.  And I'm more than willing to let the students return to their Houses.  But tomorrow. For now, let them sleep...",3,male
2143,DUMBLEDORE, It's astonishing what the body can endure when the mind allows itself to rest.,3,male
2144,DUMBLEDORE, Sir Cadogan.  Is it possible that you let a mysterious man enter Gryffindor Tower tonight?,3,male
2145,DUMBLEDORE, Scabbers...?,3,male
2146,DUMBLEDORE," I do, Miss Granger.  But I'm sorry to say the word of three thirteen- year-old wizards will convince few others.  A child's voice, however honest and true, is meaningless to those who have forgotten how to listen.",3,male
2147,DUMBLEDORE," Ah... a shooting star.  If ever one was to make a wish, now would be the time.  But time, I'm afraid, is precisely our problem...",3,male
2148,DUMBLEDORE," Mysterious thing, time.  Powerful. And, when meddled with... dangerous.  Sirius Black is in the topmost cell of the Dark Tower. You know the laws, Miss Granger. You must not be seen.  And you would, I feel, do well to return before this last chime.  If not... well, the consequences are really too ghastly to discuss.  Three turns should do it, I think.  If you succeed, more than one innocent life may be spared tonight.",3,male
2149,DUMBLEDORE," By the way, when in doubt, I find retracing my steps to be a wise place to begin... Good luck.",3,male
2150,DUMBLEDORE, Professor Dippet had those blackberries planted when he was Headmaster...,3,male
2151,DUMBLEDORE, How extraordinary!,3,male
2152,DUMBLEDORE," I'm quite sure the Minister isn't suggesting that you had anything to do with it, Hagrid.  How could you?  You've been with us all along.",3,male
2153,DUMBLEDORE," Search the skies if you must, Minister.  In the meantime, I wouldn't say no to a cup of tea, Hagrid.  Or... a large brandy. It seems your services will no longer be required.",3,male
2154,DUMBLEDORE," By the way, when in doubt, I always find retracing my steps to be a wise place to begin... Good luck.",3,male
2155,DUMBLEDORE, Well?,3,male
2156,DUMBLEDORE, Did what?,3,male
2173,HAGRID," C'mon now, get a move on!  Got a real treat for yeh.  Great lesson comin' up.  Follow me.",3,male
2174,HAGRID," Gather 'round.  Find yerself a spot. That's it.  Now, firs' thing yeh'll want ter do is open yer books --",3,male
2175,HAGRID, Crikey.  Didn' yeh know?  All yeh've got ter do is stroke 'em.  Look --,3,male
2176,HAGRID," Righ' then.  So... so... yeh've got yer books, an' now yeh need the Magical Creatures.  Right. So... I'll... I'll go an' get 'em.",3,male
2177,HAGRID," Gee up, there! Beau'iful, isn' he?",3,male
2178,HAGRID," A Hippogriff, o' course.  Now, firs' thing yeh gotta know is they're proud.  Easily offended, Hippogriffs are.  Don't never insult one, 'cause it migh' be the las' thing yeh do.  Right then -- who wants ter come an' say hello?",3,male
2179,HAGRID," Good man, Harry!",3,male
2180,HAGRID," Tha's it.  Easy now... stop!  This here's Buckbeak, Harry.  Yeh want ter let 'im make the firs' move. It's polite, see?  Jus' take step forward, give 'im a bow, and if Buckbeak bows back, yeh're allowed ter touch him.  Ready?",3,male
2181,HAGRID," Back off, Harry!  Back off!",3,male
2182,HAGRID," Well done, Harry!  Go on.  Give 'im a pat.",3,male
2183,HAGRID, Look at that!  I reckon he migh' let yeh ride 'im!,3,male
2184,HAGRID, We'll jus' set yeh behind the wing joint.  Mind yeh don' pull any feathers out.  He won' like that.,3,male
2185,HAGRID, Off yeh go!,3,male
2186,HAGRID," Good work, Harry! How'm I doin' me firs' day?",3,male
2187,HAGRID, Malfoy!  No!,3,male
2188,HAGRID, Calm yerself!  Yer fine... jus' a scratch...,3,male
2189,HAGRID, No.  I'm the teacher.  You all... you all just... Class dismissed!,3,male
2190,HAGRID, Buckbeak liked London.,3,male
2191,HAGRID," Oh.  That.  Well, I got up an' said my bit -- You know, how Buckbeak was a good Hippogriff an' as long as yeh treated 'im with respect, he'd treat you the same. Then Lucius Malfoy got up an' said his bit -- you know, how Buckbeak was a deadly dangerous beast that no teacher in their righ' mind would expose their students to...",3,male
2192,HAGRID, Buckbeak's not going back to the forest...,3,male
2193,HAGRID," He asked fer the worse, yeh see, Lucius Malfoy did.  An' the Committee granted it.  Buckbeak's bin sentenced ter death.",3,male
2194,HAGRID, Look at 'em.  Loves the smell o' the trees when the wind blows...,3,male
2195,HAGRID," They'd know I did it.  And tha' would only get Dumbledore in trouble.  Gonna come down, yeh know.  Says he wants ter be with me when it... when it happens. Great man, Dumbledore.",3,male
2196,HAGRID," Yeh will not!  Think I wan' yeh seein' a thing like this!  No. Yeh'll drink yer tea an' be off. But before yeh do -- I wan' ter see you an' Ron shake hands, Harry.",3,male
2197,HAGRID, Thin' I haven' seen 'ow it's bin betw'n you two?  Go on now...,3,male
2198,HAGRID," Good.  Now then.  Ron, I wan' ter see you give Hermione a hug.",3,male
2199,HAGRID, Go on!  You two've been at it all year.  An' I'm sick o' it.,3,male
2200,HAGRID," Crikey, tha's jus' abou' the most pathetic hug I e'er seen.  But yeh did it, an' tha's wha' matters. There's jus' one other thing...",3,male
2201,HAGRID," Yeh should keep a closer eye on yer pets, Ron.",3,male
2202,HAGRID, Crikey.  Here we go agin...,3,male
2203,HAGRID," Yeh got to go!  It's almost dark. Anyone sees yeh outside the castle it'll be trouble!  Big trouble! 'Specially you, Harry --",3,male
2204,HAGRID, Beaky...,3,male
2205,HAGRID," Professor, I swear!  I didn't!",3,male
2206,HAGRID, Just a broom.,3,male
2207,DRACO, And exactly how do we do that?,3,male
2208,DRACO," God, this place is going to the dogs.  Wait until my father hears Dumbledore's got this oaf teaching classes.",3,male
2209,DRACO," Potter, there's a Dementor behind you.",3,male
2210,DRACO," Give me a go at that thing.  If Potter can do it, it must be easy.  You're not dangerous at all, are you, you great ugly brute --",3,male
2211,DRACO, It's killed me!  It's killed me!,3,male
2212,DRACO," It comes and goes.  Still... I consider myself lucky.  According to Madam Pomfrey, another minute or two... and I could've lost the arm.",3,male
2213,DRACO, It's this class that's ridiculous.,3,male
2214,DRACO," Well, well.  Look who's here.  You two shopping for your dream home? Seems a bit grand for you, Weasel- Bee.  Don't your family all sleep in one room?",3,male
2215,DRACO," Now that's not very friendly. Boys, I think we're going to have to teach Weasel-Bee to respect his superiors.",3,male
2216,DRACO," How dare you speak to me, you filthy, little mud --",3,male
2217,DRACO, Who did that!,3,male
2218,DRACO," Well, don't just stand there!",3,male
2219,DRACO," Wait a minute, there's something out here -- Aaaaaaahhhh!!!",3,male
2220,DRACO," Did you see the big, fat blubbering oaf?!  Oh, this is going to be rich.  Did I tell you, Father said I can keep the head -- Ah.  Come to see the show?",3,male
2235,SNAPE," I've done the dungeons, Headmaster.  No sign of Black. Nor anywhere else in the castle.",3,male
2236,SNAPE," Remarkable feat, don't you think? To enter Hogwarts castle on one's own, completely undetected...",3,male
2237,SNAPE," You may recall, prior to the start of term, I did express my concerns when you appointed Professor --",3,male
2238,SNAPE, Turn to page 394.,3,male
2239,SNAPE," That's not really your concern, is it, Potter?  Suffice it to say, your Professor finds himself incapable of teaching at the present time.  Page 394.",3,male
2240,SNAPE, Quiet!,3,male
2241,SNAPE, Now.  Which of you can tell me the difference between an Animagus and a werewolf?,3,male
2242,SNAPE, No one?  How... disappointing.,3,male
2243,SNAPE," Quiet, Malfoy!  Though one must admit to feeling your pain.  That is the second time you have spoken out of turn, Miss Granger.  Tell me.  Are you incapable of restraining yourself?  Or do you take pride in being an insufferable know-it-all?",3,male
2244,SNAPE," Five points from Gryffindor! As a antidote to your ignorance, I prescribe two rolls of parchment on the werewolf by Monday morning, with particular emphasis placed on recognizing it. Passing notes, Potter?",3,male
2245,SNAPE," Not exactly Picasso, are you?  I hope you demonstrate more talent on the Quidditch pitch this weekend then you do as an artist.",3,male
2246,SNAPE, Potter.  What're you doing wandering the corridors at night?,3,male
2247,SNAPE," How extraordinarily like your father you are, Potter.  He, too, was exceedingly arrogant. Strutting about the castle --",3,male
2248,SNAPE, Turn out your pockets.,3,male
2249,SNAPE, Turn out your pockets!,3,male
2250,SNAPE, And this.  What might it be?,3,male
2251,SNAPE, Really... Reveal your secret!,3,male
2252,SNAPE, Read it.,3,male
2253,SNAPE, Go on.,3,male
2254,SNAPE, Why you insolent little --,3,male
2255,SNAPE," Well, well.  Lupin.  Out for a little walk in the moonlight, are we?",3,male
2256,SNAPE," That remains to be seen.  I've just now confiscated a rather curious artifact from Mr. Potter. Take a look, Lupin.  This is supposed to be your area of expertise.",3,male
2257,SNAPE," Clearly, it's full of Dark Magic.",3,male
2258,SNAPE, Expelliarmus!,3,male
2259,SNAPE," Ah, vengeance is sweet.  How I hoped I'd be the one to catch you.",3,male
2260,SNAPE, I told Dumbledore you were helping your old friend into the castle. And here's the proof.,3,male
2261,SNAPE, Give me a reason.  I beg you.,3,male
2262,SNAPE, Listen to you two.  Quarreling like an old married couple.  The creature and the criminal.,3,male
2263,SNAPE," Witty as ever I see.  Tell me, will you be so irreverent when I turn you over to the Dementors? Do I detect a flicker of fear? One can only imagine what it must be like to endure the Dementor's Kiss.  It's said to be unbearable to witness.  But I'll do my best.",3,male
2264,SNAPE, After you.,3,male
2265,SNAPE, Out of the way!,3,male
2266,SIRIUS BLACK, No.  Only one will die tonight.,3,male
2267,SIRIUS BLACK," Going to kill me, Harry?",3,male
2268,SIRIUS BLACK," You'd know all about the madness within, wouldn't you, Remus?",3,male
2269,SIRIUS BLACK," Yes, you glow like the sun.  And you howl at the moon.  Enough talk!  He dies.  Now.  If you won't do it with me, Remus, I'll do it alone.",3,male
2270,SIRIUS BLACK," I did my waiting!  Twelve years of it!  In Azkaban!  Trust me, you wouldn't have lasted a week!",3,male
2271,SIRIUS BLACK, It's a lie!  I never would've betrayed James and Lily!,3,male
2272,SIRIUS BLACK, No!  I wasn't there!  And I'll regret it the rest of my life!,3,male
2273,SIRIUS BLACK, He's as good as dead.,3,male
2274,SIRIUS BLACK, Oh yes there is...,3,male
2275,SIRIUS BLACK," Come out, come out, Peter Come out, come out and play...",3,male
2276,SIRIUS BLACK, Brilliant!  And -- as usual -- dead wrong.  Now give us our wands back.  Remus and I have a bit of unfinished business to tend to.,3,male
2277,SIRIUS BLACK, He can't help it.  It's habit by now.,3,male
2278,SIRIUS BLACK, The Map never lies.  Pettigrew's alive.  And he's right there.,3,male
2279,SIRIUS BLACK," Not you, you idiot.  Your rat.",3,male
2280,SIRIUS BLACK," Twelve years.  A curiously long life for a common garden rat. He's missing a toe, isn't he?",3,male
2281,SIRIUS BLACK, Finger.  Dirty coward cut it off so everyone would think he was dead.  Then he transformed into a rat.,3,male
2282,SIRIUS BLACK, Together.,3,male
2283,SIRIUS BLACK, Shut up!,3,male
2284,SIRIUS BLACK," Died!  Died rather than betray my friends!  And you should have realized, Peter, if Voldemort didn't kill you...",3,male
2285,SIRIUS BLACK," Beautiful, isn't it?  I'll never forget the first time I walked through those doors.  It'll be nice to do it again.  Freely. That was a noble thing you did back there.  He doesn't deserve it.",3,male
2286,SIRIUS BLACK," I don't know if you know, Harry, but when you were born, James and Lily made me your guardian...",3,male
2287,SIRIUS BLACK," And, well, I'll understand if you choose to stay with your aunt and uncle, but, so you know, you could --",3,male
2288,SIRIUS BLACK, Soon as my name's cleared...,3,male
2289,SIRIUS BLACK," Remus, old friend... did you take your potion tonight?",3,male
2290,SIRIUS BLACK, Run.  All of you.  Now.,3,male
2291,SIRIUS BLACK," You know the man you truly are, Remus.  This flesh is only flesh.",3,male
2292,SIRIUS BLACK, You might try --,3,male
2293,SIRIUS BLACK, That'll do.,3,male
2294,SIRIUS BLACK," You truly are your father's son, Harry!",3,male
2295,SIRIUS BLACK, I'll be forever grateful for this. To both of you.,3,male
2296,SIRIUS BLACK," One day perhaps.  For some time... life will be too... unpredictable. Besides, you're meant to be here.",3,male
2297,SIRIUS BLACK," But promise me something, Harry.",3,male
2298,SIRIUS BLACK, Trust yourself.  No matter the challenges you face -- and I fear they will be many -- you'll be surprised how many times you can find the answers... ...here.,3,male
2299,SIRIUS BLACK, A shooting star.  Make a wish.,3,male
2300,VOLDEMORT," NO! The boy is everything, it cannot be done without him and it WILL be done exactly as I say.",4,male
2301,VOLDEMORT," Good. First, gather our old comrades. Send them a sign.",4,male
2302,VOLDEMORT, Nagini tells me the old caretaker is standing outside the door.,4,male
2303,VOLDEMORT, Step aside so I can give our guest a proper greeting.,4,male
2304,VOLDEMORT," Ah yes, the time is close now. Harry! At last! Step aside Wormtail so I can give our guest a proper greeting! ",4,male
2305,VOLDEMORT, Kill the spare.,4,male
2306,VOLDEMORT," Do it, now!",4,male
2307,VOLDEMORT, My wand Wormtail.,4,male
2308,VOLDEMORT, Hold out your arm.,4,male
2309,VOLDEMORT, The other arm Wormtail.,4,male
2310,VOLDEMORT," Welcome my friends. Thirty years it's been, and yet you stand before me as though it were only yesterday. I confess myself disappointed, not one of you tried to find me.",4,male
2311,VOLDEMORT," Not even you, Lucius.",4,male
2312,VOLDEMORT," There were signs my friend, and more than whispers.",4,male
2313,VOLDEMORT," Out of fear, not loyalty. Still you have proved yourself useful these past few months Wormtail.",4,male
2314,VOLDEMORT," (To Cedric's corpse) Oh, such a handsome boy.",4,male
2315,VOLDEMORT," Harry! I'd almost forgotten you were here. Standing on the bones of my father. I'd introduce you but word has it you're almost as famous as me these days. The boy who lived. How lies have fed your legend Harry. Shall I reveal what really happened that night thirteen years ago? Shall I divulge how I truly lost my powers? It was love. You see when dear sweet Lily Potter gave her life for her only son she provided the ultimate protection. I could not touch you. It was old magic, something I should have forseen. But no matter, no matter. Things have changed, I can touch you now! ",4,male
2316,VOLDEMORT," Astonishing what a few drops of your blood will do eh Harry? Pick up your wand Potter. I said pick it up, get up. Get up! You've been taught how to duel I presume yes? First we bow to each other. Come on now Harry the niceties must be observed, Dumbledore would not want you to forget your manners now would he? I said bow!",4,male
2317,VOLDEMORT, That's better. And now...,4,male
2318,VOLDEMORT," Atta boy Harry, your parents would be proud. Especially your filthy mongrel mother. I'm going to kill you Harry Potter, I'm going to destroy you. After tonight no one will ever again question my powers. After tonight if they speak of you they'll speak only of how you begged for death, and I being a merciful lord obliged. Get up.",4,male
2319,VOLDEMORT," Don't you turn your back on me Harry Potter I want you to look at me when I kill you, I want to see the lights leave your eyes.",4,male
2320,VOLDEMORT, Do nothing. He is mine to finish. He's mine!,4,male
2321,VOLDEMORT, No!,4,male
2385,HARRY, Hermione. Bad dream. When did you get here?,4,male
2386,HARRY, Last night.,4,male
2387,HARRY, Where are we actually going?,4,male
2388,HARRY, Yes sir. This way.,4,male
2389,HARRY, Pleasure to meet you too sir.,4,male
2390,HARRY, Why are they all standing around that manky old boot?,4,male
2391,HARRY, What's a 'portkey'?,4,male
2392,HARRY, Thanks.,4,male
2393,HARRY, See ya later Cedric.,4,male
2394,HARRY, (Smiling) I love magic.,4,male
2395,HARRY, What is THAT?,4,male
2396,HARRY, Crime?,4,male
2397,HARRY, What crime?,4,male
2398,HARRY," Those people tonight, in the masks... they're his too aren't they? they're his followers.",4,male
2399,HARRY, There was a man. Before. There.,4,male
2400,HARRY, I dunno. I didn't see his face.,4,male
2401,HARRY, It's alright I'll get it.,4,male
2402,HARRY, Oh no thank you I'm not hungry.,4,male
2403,HARRY, I'm fine.,4,male
2404,HARRY, Well there's something you don't see every day.,4,male
2405,HARRY, I don't know but I don't think it's Pumpkin Juice.,4,male
2406,HARRY, Yeah well rather you than me.,4,male
2407,HARRY, No sir.,4,male
2408,HARRY, No sir.,4,male
2409,HARRY, Yes sir.,4,male
2410,HARRY, Let you know what?,4,male
2411,HARRY, I didn't ask for this to happen Ron. Okay? You're being stupid.,4,male
2412,HARRY," I didn't put my name in that cup. I don't WANT eternal glory I just wanna be.. Look, I don't know what happened tonight and I don't know why, it just did ok.",4,male
2413,HARRY, It's a broomcupboard.,4,male
2414,HARRY," Oh, no.",4,male
2415,HARRY, I'm fourteen.,4,male
2416,HARRY, I dunno I haven't really thought about it.,4,male
2417,HARRY, Fourteen.,4,male
2418,HARRY, No I didn't enter.,4,male
2419,HARRY," (looking at the notepad) Hey, my eyes aren't glistening with the ghosts of my past.",4,male
2420,HARRY, AGH!,4,male
2421,HARRY, Sirius?,4,male
2422,HARRY, Sirius?! How...,4,male
2423,HARRY, No!,4,male
2424,HARRY, I dunno.,4,male
2425,HARRY, No. Umm.. Voldemort was giving him a job to do. Something important.,4,male
2426,HARRY," He wanted... me. I dunno why, but he was gonna use this man to get to me. I mean it was only a dream right? ",4,male
