,character,text,number,types
3450,HARRY, Thanks.  All right.  This morning I’ll be putting you all through a few drills to assess your strengths.  But know this:  Just because you made the team last year does not guarantee you a spot this year.  Is that clear?,6,male
3451,HARRY," All right.  Cormac.  Ron.  It’s down to you two for Keeper.  We’ll decide it with a shootout. Demelza, you’ll bring the Quaffle up against Cormac.  Ginny, you’ll take on Ron.",6,male
3452,HARRY, Quiet!  I’m Captain.  We do it my way.  Now line up.  On three. One.  Two... Three!,6,male
3453,HARRY," C’mon, Ron...",6,male
3454,HARRY, Ever heard of this spell?,6,male
3455,HARRY, No.,6,male
3456,HARRY, It’s... old.  The binding is fragile.,6,male
3457,HARRY," I didn’t say I wasn’t curious. And, by the way, I don’t sleep with it.",6,male
3458,HARRY, And?,6,male
3459,HARRY, Good.  That settles it then.,6,male
3460,HARRY, Who’s up for a Butterbeer?,6,male
3461,HARRY, No.  Over here.,6,male
3462,HARRY," No, no.  Sit next to me.",6,male
3463,HARRY," Hello, sir.  Wonderful to see you.",6,male
3464,HARRY," So what brings you here, sir?",6,male
3465,HARRY," I’d consider it an honor, sir.",6,male
3466,HARRY, Dumbledore asked me to... get to know him.,6,male
3467,HARRY, Dunno.  But it must be important. Otherwise Dumbledore wouldn’t ask.,6,male
3468,HARRY, There’s no time!,6,male
3469,HARRY," She was cursed, wasn’t she?  I know Katie.  Off the Quidditch pitch she wouldn’t hurt a fly.  If she was bringing that to someone, she wasn’t doing it knowingly.",6,male
3470,HARRY, It was Malfoy.,6,male
3471,HARRY, I... just... know.,6,male
3472,HARRY, What does she see in him?,6,male
3473,HARRY, You called him a slick git not five hours ago.,6,male
3474,HARRY, I suppose.,6,male
3475,HARRY, I don’t know.  She’s smart. Funny.  Attractive...,6,male
3476,HARRY, You know.  She’s... got nice skin.,6,male
3477,HARRY," Well, no.  I mean... I’m just saying it could be a contributing factor.",6,male
3478,HARRY," I’ve never really thought about it.  But I suppose, yeah.  Very nice.",6,male
3479,HARRY, I think I’ll be going to sleep now.,6,male
3480,HARRY, What?,6,male
3481,HARRY," Sorry, sir, I was just admiring your hourglass.",6,male
3482,HARRY, I think I’ll be going.,6,male
3483,HARRY," The shelf, sir?",6,male
3484,HARRY," I don’t really know how to answer that, sir.",6,male
3485,HARRY," Did Voldemort ever make the shelf, sir?",6,male
3486,HARRY," You knew him, didn’t you, sir? Tom Riddle.  You were his teacher.",6,male
3487,HARRY, What was he like?,6,male
3488,HARRY," I’m sorry, sir.  Forgive me.  He killed my parents, you see...",6,male
3489,HARRY, Have it your way.  Juice?,6,male
3490,HARRY, Dunno what you’re talking about.,6,male
3491,HARRY, Yep.  Apparently it’s his lucky day.,6,male
3492,HARRY," Yeah.  I suppose I could’ve just used, I dunno... a Confundus charm?",6,male
3493,HARRY, Ah.  Well... they’re really good.,6,male
3494,HARRY, It feels like this.,6,male
3495,HARRY, Have you?,6,male
3496,HARRY," I just thought, you know, since neither one of us can take who we’d really like... maybe we’d go together.  As friends.",6,male
3497,HARRY, So who are you taking?,6,male
3498,HARRY, Really...?,6,male
3499,HARRY, But I am the Chosen One.,6,male
3500,HARRY, Okay.  Kidding.  I’ll just ask someone I like.  Someone cool.,6,male
3501,HARRY, Neville...?,6,male
3502,HARRY, And what’s happened to you?,6,male
3503,HARRY, Cormac!  That’s who you invited!,6,male
3504,HARRY, I think she went to powder her nose.,6,male
3505,HARRY, Dragon balls.,6,male
3506,HARRY," I think I should rejoin the party, sir.  My date...",6,male
3507,HARRY, A message...?,6,male
3508,HARRY, Traveling?  Where?,6,male
3509,HARRY, Positive.  Why?,6,male
3510,HARRY," I’d worked that much out for myself, funnily enough.",6,male
3511,HARRY, Lovely.,6,male
3512,HARRY, I’ll take your word for it.,6,male
3513,HARRY, So what happens?  If you break an Unbreakable Vow?,6,male
3514,HARRY," Draco’s plotting something, I know it, something to do with Voldemort.  He’s been given a task or a mission -- and Snape was offering to help.",6,male
3515,HARRY, I know it sounds mad --,6,male
3516,HARRY, That’s not what it sounded like.,6,male
3517,HARRY, But Dumbledore can make mistakes. He’s said it himself --,6,male
3518,HARRY, I’m not --,6,male
3519,HARRY, It’s good.,6,male
3520,HARRY," Are you alright, Mr. Weasley?",6,male
3521,HARRY, Did you get my owl?,6,male
3522,HARRY, Go on.,6,male
3523,HARRY, A Vanishing Cabinet?,6,male
3524,HARRY, What happened to it?  The one at Borgin & Burkes?,6,male
3525,HARRY, Soon.,6,male
3526,HARRY," I know who I am, Hermione, alright? Sorry.",6,male
3527,HARRY," If Dumbledore’s traveling places, it’s news to the Ministry.  But get this:  that night at Borgin & Burkes?  It seems Draco was looking at a Vanishing Cabinet.",6,male
3528,HARRY, You tell me.,6,male
3529,HARRY, Who could tell the difference?,6,male
3530,HARRY, I don’t understand -- what happened?,6,male
3531,HARRY, But why would he tamper with his own memory?,6,male
3532,HARRY, Why?,6,male
3533,HARRY," I don’t know him that well, sir --",6,male
3534,HARRY," Well, sir, I wondered if I might ask you something.",6,male
3535,HARRY," Well, you see, the other day I was in the Restricted Section -- in the library -- and I stumbled upon something rather odd while reading.  Something about a bit of rare magic...",6,male
3536,HARRY," I’m not sure... That is, I don’t recall the name... exactly.  But it got me wondering... Are there some kinds of magic you’re not allowed to teach?",6,male
3537,HARRY," Yes, well, we don’t exactly see eye-to-eye, sir.  What I mean to say is, he’s not like you.  He might... misunderstand.",6,male
3538,HARRY," Did you say the same to Tom Riddle, sir?  When he came asking questions.",6,male
3539,HARRY, Sir --,6,male
3540,HARRY, Nice.,6,male
3541,HARRY, Hermione.  I think Malfoy’s leaving the castle.,6,male
3542,HARRY, I’ve seen it.  Sometimes... sometimes he just disappears off the Map.,6,male
3543,HARRY, The Map is never wrong.,6,male
3544,HARRY," Divine.  Had ourselves a little late-night snack, did we?",6,male
3545,HARRY, Or twenty.,6,male
3546,HARRY," Really?  Honestly, I reckoned she was starting to annoy you.",6,male
3547,HARRY, Excuse me?,6,male
3548,HARRY, Well... Brilliant.,6,male
3549,HARRY, Bloody well hope so.  She’s been snogging you for three months.,6,male
3550,HARRY, Who’re you talking about?,6,male
3551,HARRY, Okay.  Very funny.,6,male
3552,HARRY, What the hell was that for?,6,male
3553,HARRY, Okay!  Fine!  You’re in love with her!  Have you ever actually met her!,6,male
3554,HARRY," Ron, these chocolates, they’re -- C’mon.  I’m going to introduce you to Romilda Vane.",6,male
3555,HARRY, Devastatingly handsome.,6,male
3556,HARRY, Sir.  I’m sorry.  I wouldn’t bother you if it weren’t absolutely --,6,male
3557,HARRY," I figured this called for a more practiced hand, sir.",6,male
3558,HARRY," I’m sorry, sir.  About the other day.  Our... misunderstanding.",6,male
3559,HARRY," I mean, I’m sure you’re tired of it, after all these years.  The questions.  About... Voldemort.",6,male
3560,HARRY," Yes, sir.  It’s just, well, Dumbledore once said that fear of a name only increases fear of the thing itself.  It seemed sensible.",6,male
3561,HARRY, Love potion.,6,male
3562,HARRY," Ron!  Ron!!!  Professor, help him!",6,male
3563,HARRY, Professor!  Do something!!,6,male
3564,HARRY, He’s choking!!,6,male
3565,HARRY," Breathe!  C’mon, Ron, don’t be a prat.  Breathe!  BREATHE!",6,male
3566,HARRY," How are you, Katie?",6,male
3567,HARRY, SECTUMSEMPRA!,6,male
3568,HARRY, The Room of Requirement...,6,male
3569,HARRY, Who showed you this?  First.,6,male
3570,HARRY, What?,6,male
3571,HARRY, Oh.  Yeah.,6,male
3572,HARRY, Say that again.,6,male
3573,HARRY, Excellent.  Really excellent.,6,male
3574,HARRY, Right.  I’m going down to Hagrid’s.,6,male
3575,HARRY," No.  I’ve got a good feeling about going to Hagrid’s.  I feel like it’s the place to be tonight, know what I mean?",6,male
3576,HARRY, Trust me.  I know what I’m doing. Or at least Felix does.,6,male
3577,HARRY," Sorry, sir.  I should’ve announced myself.  Cleared my throat. Coughed.  You probably feared I was Madam Sprout.",6,male
3578,HARRY," Just the general behavior, sir. The sneaking around.  The jumping when you saw me.  By the way, those Tentacula leaves -- they’re quite valuable, aren’t they?",6,male
3579,HARRY," Personally, these plants have always kind of freaked me out.",6,male
3580,HARRY," Through the front doors, sir.  I’m off to Hagrid’s, you see.  He’s a very dear friend and I felt like paying him a visit.  So if you don’t mind, I’ll be going.",6,male
3581,HARRY, Sir?,6,male
3582,HARRY," Well, then by all means come along, sir.",6,male
3583,HARRY," That would be counterproductive, sir.",6,male
3584,HARRY, No idea.,6,male
3585,HARRY," A dead one, I think, sir.",6,male
3586,HARRY, Not to mention the pincers.,6,male
3587,HARRY, Through the front doors.,6,male
3588,HARRY, Oh yeah.,6,male
3589,HARRY, Poof.,6,male
3590,HARRY, Do you know why I survived?  The night I got this.,6,male
3591,HARRY, Because of her.  Because she sacrificed herself.  Because she refused to step aside.  Because her love was more powerful than Voldemort.,6,male
3592,HARRY," I’m not afraid of the name, Professor.  And I’m not afraid of him.  And you shouldn’t be either. She didn’t just die for me that night.  She died for you too.  She died for everyone who’s ever woken in the middle of the night afraid a Death Eater waited on their doorstep.",6,male
3593,HARRY," Professor.  I’m going to tell you something, something others have only guessed at.  It’s true.  I am the Chosen One.",6,male
3594,HARRY," Only I can kill him.  But in order to do so, I need to know what Tom Riddle asked you that night in your office all those years ago. And I need to know what you told him.",6,male
3595,HARRY," Be brave, Professor.  Be brave like my mother.  Otherwise you disgrace her.  Otherwise she died for nothing.  Otherwise, the bowl remains empty forever.",6,male
3596,HARRY, Sir --,6,male
3597,HARRY," Do you mean to say he succeeded, sir?  In making a Horcrux?",6,male
3598,HARRY, Seven.  He made seven -- the most powerfully magical number.  But... what are they exactly?,6,male
3599,HARRY, Tom Riddle’s diary --,6,male
3600,HARRY, And the ring...?,6,male
3601,HARRY, But if you could find them all. If you did destroy each Horcrux...,6,male
3602,HARRY," But how would you find them?  They could be hidden anywhere, couldn’t they...",6,male
3603,HARRY," It’s where you’ve been going, isn’t it, sir?  When you leave the school.",6,male
3604,HARRY," Hermione, is the Room of Requirement unplottable?",6,male
3605,HARRY, It would explain why I thought Malfoy was leaving the castle when he disappeared off the Map.,6,male
3606,HARRY, He was going to the Room of Requirement.,6,male
3607,HARRY, But I’m telling you.  I saw it --,6,male
3608,HARRY, What if there are two?  Vanishing cabinets.,6,male
3609,HARRY, I don’t know...,6,male
3610,HARRY, I don’t need luck.  I’ll be with Dumbledore.,6,male
3611,HARRY," You look the same to me, sir.",6,male
3612,HARRY," Yes, sir.",6,male
3613,HARRY, My word.,6,male
3614,HARRY," Sir, I thought one couldn’t Apparate within Hogwarts.",6,male
3615,HARRY," It’s there, isn’t it?",6,male
3616,HARRY, Sir!,6,male
3617,HARRY," You should’ve let me, sir.",6,male
3618,HARRY," We couldn’t, perhaps, just try a Summoning Charm, sir?",6,male
3619,HARRY, Accio Horcrux!,6,male
3620,HARRY, Sir... have you ever taken Felix Felicis?,6,male
3621,HARRY, Professor... there are bodies in this lake.,6,male
3622,HARRY," Do you think the Horcrux is in there, sir?",6,male
3623,HARRY," Why can’t I drink it, sir?",6,male
3624,HARRY, Professor?,6,male
3625,HARRY, Professor?  Can you hear me?,6,male
3626,HARRY," You... you can’t stop, Professor. You’ve got to keep drinking.  Like you said.  Remember.",6,male
3627,HARRY," It will, sir.  It’ll stop.  But only if you drink...",6,male
3628,HARRY, What?,6,male
3629,HARRY, No...,6,male
3630,HARRY, One more.  Just one more.  And then -- I promise... I’ll do what you say.,6,male
3631,HARRY, I promise.,6,male
3632,HARRY, Aguamenti.,6,male
3633,HARRY," You did it, sir.  Look --",6,male
3634,HARRY," I’m trying, sir.  I’m --",6,male
3635,HARRY," Don’t worry, sir.  We’re nearly there.",6,male
3636,HARRY," We need to get you up to the hospital, sir, to Madam Pomfrey --",6,male
3637,HARRY, All right.  Okay.,6,male
3638,HARRY," Sir, are you... praying?",6,male
3639,HARRY, Cruciatus!,6,male
3640,HARRY, Incacerata!,6,male
3641,HARRY, Impedimenta!,6,male
3642,HARRY," Fight!  Fight back, you coward!",6,male
3643,HARRY, Sectumsempra!,6,male
3644,HARRY, Hagrid... HAGRID!,6,male
3645,HARRY, Hagrid!  You alright?,6,male
3646,HARRY," Hagrid, Dumbledore --",6,male
3647,HARRY," No.  He was lowering his wand.  In the end, it was Snape.  It was always Snape.  And I did nothing...",6,male
3648,HARRY," Yeah, strange.  Only... it’s not. It’s a fake.",6,male
3649,HARRY, Go on.  Open it.,6,male
3650,HARRY," Dunno.  But whoever they are, they have the real Horcrux.  Which means, it was a waste.  All of it.",6,male
3651,HARRY," I’m not coming back, Hermione.",6,male
3652,HARRY, I have to finish what Dumbledore started.  I’m not sure where that will lead me... but I’ll let you and Ron konw where I am -- when I can. Dumbledore started.  And... I have to do it alone.),6,male
3653,HARRY, Yeah.  I do.  But do me a favor. When I’m around?  Keep the snogging to a minimum.,6,male
3654,HARRY," Funny, he says the same about you.",6,male
3655,HARRY, You’re brilliant.  You both are.,6,male
3656,HARRY, I don’t know.,6,male
3657,DUMBLEDORE," I once knew a Muggle girl from Liverpool with hair like spun silk.  No light could resist it... You’ve been reckless this summer, Harry.",6,male
3658,DUMBLEDORE," Rather unpleasant to behold, isn’t it?  The tale is thrilling if I do say so myself, but I’m afraid now is not the time to tell it.  Take my arm. Do as I say.",6,male
3659,DUMBLEDORE, Indeed.  And quite successfully I might add.  Most people vomit their first time.,6,male
3660,DUMBLEDORE," Welcome to the charming village of Budleigh Babberton, Harry.  I assume right about now you’re wondering why I’ve brought you here, am I right?",6,male
3661,DUMBLEDORE," Wand out, Harry.",6,male
3662,DUMBLEDORE, Lumos...,6,male
3663,DUMBLEDORE, Horace!,6,male
3664,DUMBLEDORE," I must say, you make a very convincing armchair, Horace.",6,male
3665,DUMBLEDORE, Dragon’s blood.,6,male
3666,DUMBLEDORE," Ah yes.  Introductions.  Harry, this is an old friend and colleague of mine, Horace Slughorn.  Horace, this is, well, you know who this is. Apparently there’s some thought he may be the Chosen One.",6,male
3667,DUMBLEDORE," So why all the theatrics, Horace? You weren’t perhaps expecting someone else, were you?",6,male
3668,DUMBLEDORE, Take matters into their own hands?,6,male
3669,DUMBLEDORE," Well, I think it should be put back in order for them, don’t you? Mind?",6,male
3670,DUMBLEDORE, That was fun.  May I use the loo?,6,male
3671,DUMBLEDORE, Mind if I take this?  I do love knitting patterns.,6,male
3672,DUMBLEDORE," I think I know a lost cause when I see one.  Regrettable.  I would have considered it a personal triumph had you consented to return to Hogwarts, Horace.  You are, like my friend Mr. Potter -- one of a kind.",6,male
3673,DUMBLEDORE, Indeed they are.,6,male
3674,DUMBLEDORE," You are talented, famous and powerful -- everything Horace values.  Professor Slughorn is going to try to collect you, Harry.  You would be his crowning jewel.  That is why he is returning to Hogwarts.  And it is crucial he return...",6,male
3675,DUMBLEDORE," I fear I may have stolen a wondrous night from you, Harry. She was, truthfully, very pretty. The girl.",6,male
3676,DUMBLEDORE," You’ll not be going back to Little Whinging tonight, Harry.",6,male
3677,DUMBLEDORE, Both are waiting for you.,6,male
3678,DUMBLEDORE," The very best of evenings to you! First off, please join me in welcoming the newest member of our staff, Horace Slughorn.",6,male
3679,DUMBLEDORE," Professor Slughorn, I’m happy to say, has agreed to resume his old post of Potions master.  Meanwhile the post of Defense Against the Dark Arts will be assumed by Professor Snape.",6,male
3680,DUMBLEDORE," Now, as you know, each and every one of you was searched upon your arrival tonight.  You have a right to know why.",6,male
3681,DUMBLEDORE," Today, of course, the world knows him by another name.  Which is why, as I stand looking out upon you all tonight, I am reminded of a sobering fact.  Each day, every hour, this very minute perhaps, dark forces attempt to penetrate this castle.  But in the end, their greatest weapon remains... you.",6,male
3682,DUMBLEDORE," Just something to keep in mind. Now, off to bed.  Pip pip!",6,male
3683,DUMBLEDORE," Good evening, Harry.  You got my message, I see.  Come, come.  Sit.",6,male
3684,DUMBLEDORE, So.  How are you?,6,male
3685,DUMBLEDORE," Enjoying your classes?  Professor Slughorn, for one, is most impressed with you.",6,male
3686,DUMBLEDORE, Do you?,6,male
3687,DUMBLEDORE, And what of your activities outside the classroom?  Do they bring you satisfaction?,6,male
3688,DUMBLEDORE, I notice you spend a great deal of time with Miss Granger.  One can’t help but wonder if --,6,male
3689,DUMBLEDORE," Forgive me, Harry, I...",6,male
3690,DUMBLEDORE," ... I was merely curious. In any event, I’m sure you’re wondering why I’ve summoned you here tonight.  The answer lies here.",6,male
3691,DUMBLEDORE, What you see before you are memories.  In this case pertaining to one individual:  Voldemort.  Or as he was known then... Tom Riddle.,6,male
3692,DUMBLEDORE, This vial contains a most particular memory -- of the day I first met him.  I’d like you to see it.  If you would...,6,male
3693,DUMBLEDORE, I am not family.  But his name has been known to me since birth.,6,male
3694,DUMBLEDORE, Perhaps you could give me an example.,6,male
3695,DUMBLEDORE," How do you do, Tom.",6,male
3696,DUMBLEDORE, As you wish.,6,male
3697,DUMBLEDORE, No.  I am a Professor.,6,male
3698,DUMBLEDORE, Perhaps they’re right.,6,male
3699,DUMBLEDORE, Hogwarts is not a place for mad people.,6,male
3700,DUMBLEDORE, It’s a school.  A school of... magic.,6,male
3701,DUMBLEDORE," You can do things, can’t you, Tom? Things the other children can’t.",6,male
3702,DUMBLEDORE," Tell me some of the things you can do, Tom.",6,male
3703,DUMBLEDORE," I’m like you, Tom.  Different.",6,male
3704,DUMBLEDORE," I think there is something trying to get out of your wardrobe, Tom. Open it.  Open.  It.",6,male
3705,DUMBLEDORE, Take it out.,6,male
3706,DUMBLEDORE, Is there anything in that box you ought not to have?,6,male
3707,DUMBLEDORE," Why did you want these things, Tom?",6,male
3708,DUMBLEDORE," Thievery is not tolerated at Hogwarts.  At Hogwarts, you will be taught not only how to use magic, but to control it. Understood? I’ll be going now, Tom.  Leave your window open tonight.  An owl will bring you a message.  Read it carefully.",6,male
3709,DUMBLEDORE, It is unusual.  But not unheard of.,6,male
3710,DUMBLEDORE, Did I know that I had just met the most dangerous Dark Wizard of all time?  No.  Had I...,6,male
3711,DUMBLEDORE," Over time, while here at Hogwarts, Tom Riddle grew close to one particular teacher.  Can you guess which teacher that might be?",6,male
3712,DUMBLEDORE," No.  I did not.  You see, Professor Slughorn possesses something I desire very dearly. And he will not part with it easily... I’d rather not divulge any more just yet, Harry.  But I promise. In time you will know everything.",6,male
3713,DUMBLEDORE, I did.,6,male
3714,DUMBLEDORE, Yes.,6,male
3715,DUMBLEDORE, Confused?  I would be surprised if you weren’t.,6,male
3716,DUMBLEDORE," This is perhaps the most important memory I’ve collected.  It’s also a lie. This memory has been tampered with.  In this case by the person whose memory it is, our friend Professor Slughorn.",6,male
3717,DUMBLEDORE, I suspect he is ashamed of it.,6,male
3718,DUMBLEDORE, Why indeed.,6,male
3719,DUMBLEDORE, I asked you to get to know Professor Slughorn and you’ve done so.,6,male
3720,DUMBLEDORE," You’re the Chosen One, Harry.  And Horace is, at heart, a decent man. Provide the proper circumstances and he will confess his sins.",6,male
3721,DUMBLEDORE," This memory is everything, Harry. Without it, we are blind.  Without it, we leave the fate of our world to chance.  You have no choice. You must not fail.",6,male
3722,DUMBLEDORE," Quick thinking on your part, Harry.  Using a Bezoar.  You must be very proud of your student, eh, Horace?",6,male
3723,DUMBLEDORE, Why indeed.,6,male
3724,DUMBLEDORE," This appears to be a gift, Horace. You don’t by chance remember who gave you this bottle, do you -- which by the way possesses remarkably subtle hints of licorice and cherry when not polluted with poison.",6,male
3725,DUMBLEDORE, To whom might I ask?,6,male
3726,DUMBLEDORE," Ah, to be young and feel love’s keen sting.  Come, everyone, I think Mr. Weasley is well tended.",6,male
3727,DUMBLEDORE, How is he?  Horace?,6,male
3728,DUMBLEDORE, This is beyond anything I imagined.  In my life I have seen things that are unimaginably horrific.  I know now... you will see worse.,6,male
3729,DUMBLEDORE," Oh he succeeded.  And not just once.  Think, Harry.  He’s just told us.",6,male
3730,DUMBLEDORE," They can be anything.  The most commonplace of objects.  A ring, for example.  Or a book...",6,male
3731,DUMBLEDORE," It’s a Horcrux, yes.  Four years ago, when you saved Ginny Weasley’s life in the Chamber of Secrets, when you brought me this -- I knew.  This was a different kind of magic.  Very dark.  Very powerful.  But until tonight, I had no idea just how powerful...",6,male
3732,DUMBLEDORE, Belonged to Voldemort’s mother. It was difficult to find and... ... even more difficult to destroy.,6,male
3733,DUMBLEDORE, One destroys Voldemort.,6,male
3734,DUMBLEDORE," True.  But magic, especially Dark magic...",6,male
3735,DUMBLEDORE, ... leaves traces.,6,male
3736,DUMBLEDORE, Yes.  And I think... perhaps... I may have found another.  But this time I cannot hope to destroy it alone.,6,male
3737,DUMBLEDORE," Once again, I shall ask too much of you.",6,male
3738,DUMBLEDORE," Whether it has or hasn’t is irrelevant.  I will not negotiate this with you, Severus.  You agreed.  There’s nothing more to discuss.",6,male
3739,DUMBLEDORE," Harry.  You need a shave, my friend.",6,male
3740,DUMBLEDORE," At times I forget how much you’ve grown.  At times I still see the small boy from the cupboard. Forgive my mawkishness, Harry.  I am an old man.",6,male
3741,DUMBLEDORE," Like your mother, you are unfailingly kind.",6,male
3742,DUMBLEDORE," The place to which we journey tonight is exceedingly dangerous, Harry.  I promised that you could accompany me and I stand by that promise.  But there is a condition:  You must obey any command I give you -- without question.",6,male
3743,DUMBLEDORE," Understand what I’m saying. Should I tell you to hide, you must hide.",6,male
3744,DUMBLEDORE," Should I tell you to run, you will run.",6,male
3745,DUMBLEDORE, And should I tell you to abandon me and save yourself...,6,male
3746,DUMBLEDORE, You will do so.,6,male
3747,DUMBLEDORE," Your word, Harry.",6,male
3748,DUMBLEDORE, Take my arm.,6,male
3749,DUMBLEDORE, Being me has its privileges.,6,male
3750,DUMBLEDORE," This is the place.  Oh yes, this place has known magic. Where you stand, Harry, Tom Riddle once stood many, many years ago, when he was but a poor orphan boy with a penchant for cruelty...",6,male
3751,DUMBLEDORE," One wintry afternoon, he lured two younger classmates to this cave. What happened is unclear.  But this much is known:  the children were damaged.",6,male
3752,DUMBLEDORE," In order to gain passage, payment must be made, payment intended to weaken any intruder.",6,male
3753,DUMBLEDORE," Oh, no, Harry.  Your blood is much more precious than mine.",6,male
3754,DUMBLEDORE, Careful.  The water.,6,male
3755,DUMBLEDORE, It’s there.  The only question is how do we get to it?,6,male
3756,DUMBLEDORE, Perhaps not.,6,male
3757,DUMBLEDORE," If you would, Harry...",6,male
3758,DUMBLEDORE," Only recreationally.  You see, I believe one creates one’s own luck.",6,male
3759,DUMBLEDORE, Yes.,6,male
3760,DUMBLEDORE, Remember... the water.,6,male
3761,DUMBLEDORE, Oh yes.,6,male
3762,DUMBLEDORE, It has to be drunk. You remember the condition on which I brought you with me?,6,male
3763,DUMBLEDORE," This potion might paralyze me.  It might cause me to forget why I’m here.  It might create so much pain I beg for relief.  You are not to indulge these requests, Harry.  It is your job to make sure I keep drinking this potion even if you have to force it down my throat.  Understood?",6,male
3764,DUMBLEDORE," Because I am much older, much cleverer... and much less valuable. Your good health, Harry.",6,male
3765,DUMBLEDORE, Don’t... don’t make me...,6,male
3766,DUMBLEDORE, Nooooooo!!!,6,male
3767,DUMBLEDORE, Make it stop... Please... make it stop...,6,male
3768,DUMBLEDORE, My fault.  It’s all my fault...,6,male
3769,DUMBLEDORE," Too much... I can’t... take it... I want... to die... kill... kill me... KILL ME, HARRY!",6,male
