character,text,gender
GRUMPY, Three of a kind.  Let's do this.,male
GRUMPY, There's two on the roof.  Every guy is an extra share.  Five shares is plenty.,male
GRUMPY, Yeah?  He thinks he can sit it out and still take a slice then I get why they call him the Joker.,male
GRUMPY," Obviously, we don't want you doing anything with your hands other than holding on for dear life.",male
GRUMPY, He's got three left?,male
GRUMPY, Where'd you learn to count?!,male
GRUMPY, A mob bank.  Guess the Joker's as crazy as they say.,male
GRUMPY, Where's the alarm guy?,male
GRUMPY," Funny, he told me something similar...",male
GRUMPY," C'mon, there's a lot to carry...",male
GRUMPY, If this guy was so smart he would have had us bring a bigger car.,male
GRUMPY, I'm betting the Joker told you to kill me soon as we loaded the cash.,male
GRUMPY, Bus driver?  What bus-,male
ENGEL," Mr Mayor, you were elected on a campaign to clean up the city... when are you going to start?",male
ENGEL, Like this so-called Batman- a lot of people say he's doing some good that criminals are running scared... but I say NO.  What kind of hero needs to wear a mask?  You don't let vigilantes run around breaking the law... where does it end?,male
ENGEL, ...Police released video footage found concealed on the body. Sensitive viewers be aware: it is disturbing.,male
ENGEL," With no word from the Batman- even as they mourn Commissioner Loeb, these cops have to be wondering if the Joker is going to make good on his threat to kill the Mayor today...",male
ENGEL, ...he's a credible source- an A and M lawyer for a prestigious consultancy. He says he's waited as long as he can for the Batman to do the right thing...,male
ENGEL," Now he's taking matters into his own hands.  We'll be live at five with the true identity of the Batman, stay with us...",male
ENGEL," Caller, you're on the air.",male
ENGEL," Guy's got a point- Dent didn't want Batman to give himself up, is this the right thing to do?",male
ENGEL," And we wish him a speedy recovery. God knows we need him, now.  Let's take another call-",male
ENGEL, Who is this?,male
ENGEL, Commissioner?!  You really think someone would try to-,male
ENGEL, Thanks.,male
MAYOR," Well, Mike-",male
MAYOR, I'm told our men in the Major Crimes Unit are close to an arrest.,male
MAYOR, DENT!  What was that circus?!,male
MAYOR, 549 criminals at once?!  How did you convince Surrillo to hear this farce?,male
MAYOR," Even if you blow enough smoke to get convictions out of Surrillo, you'll set a new record at appeals for quickest kick in the ass.",male
MAYOR," The public likes you, Dent.  That's the only reason this might fly.",male
MAYOR, Followed swiftly by you and me-,male
MAYOR, Back from the dead.,male
MAYOR, What do we got?,male
MAYOR," Go home, Gordon.  The clown'll keep till morning.  Get some rest- you're going to need it.  Tomorrow, you take the big job. You don't have any say in the matter. Commissioner Gordon.",male
MAYOR, Land routes East?,male
MAYOR, The men you and Dent put away?  Those aren't people I'm worried about.,male
ENGEL," Yet, we hear rumors that instead of trying to arrest him the cops are using him to do their dirty work.",male
RAMIREZ," Hey, Wuertz- the Mayor says you're closing in on the Batman.",male
RAMIREZ," Ever intending to see your wife again, Lieutenant?",male
RAMIREZ, They checked her back into hospital.,male
RAMIREZ, Least there she's got someone round the clock.  Unlike your wife. He hasn't shown?,male
RAMIREZ, Why wouldn't he come?,male
RAMIREZ, He can't resist showing us his face.,male
RAMIREZ," Give us a minute, please, people!",male
RAMIREZ, You're gonna want to see this.,male
RAMIREZ, That Joker card pinned to the body? Forensics found three sets of D.N.A..,male
RAMIREZ, All three.,male
RAMIREZ," The D.N.A. belongs to Judge Surrillo, Harvey Dent and Commissioner Loeb.",male
RAMIREZ, City hall.,male
RAMIREZ, Harvey Dent.,male
RAMIREZ, Us contaminate it?  It's because of you that these guys are dead in the first place-,male
RAMIREZ, Let him be!  He's been through enough-,male
RAMIREZ," I figured, counselor.",male
RAMIREZ," 250, 52nd street.  Leave as soon as the patrol car pulls out.",male
RAMIREZ, I didn't know-,male
RAMIREZ, I'm sorry- they got me early on.  My mother's medical bills and my-,male
RAMIREZ," I took a little from them- once they've got you, they keep you.  I'm sorry.",male
GORDON," I thought you had to go look after your mother, detective.",male
GORDON, I'm sorry.,male
GORDON, Often doesn't.  But I like reminding everybody that he's out there.,male
GORDON, Hopefully...  Because he's busy.,male
GORDON," Put this out, by morning we can put a big top over central holding and sell tickets.  What's he hiding under that makeup?",male
GORDON, Another bunch of small timers.,male
GORDON, My detectives have been making drug buys with them for weeks.  This bank was another drop for the mob.  That makes five banks- we've found the bulk of their dirty cash.,male
GORDON, What about this Joker guy?,male
GORDON," We'll have to hit all banks simultaneously.  SWAT teams, backup.",male
GORDON," When the new DA gets wind of this, he'll want in.",male
GORDON, Be hard to keep him out.,male
GORDON, I hear he's as stubborn as you.,male
GORDON, Word is you've got a hell of a right cross.  Shame Sal's going to walk.,male
GORDON, We liaise with various agencies-,male
GORDON, Official policy is to arrest the vigilante known as Batman on sight.,male
GORDON," If you have any concerns about... malfunctioning equipment... take them up with maintenance, counselor.",male
GORDON," In this town, the fewer people know something, the safer the operation.",male
GORDON, If I didn't work with cops you'd investigated while you were making your name at I.A.- I'd be working alone.  I don't get political points for being an idealist- I have to do the best I can with what I have.,male
GORDON, I can give you the names of the banks.,male
GORDON," You don't have to sell me, Dent.  We all know you're Gotham's white knight.",male
GORDON," Yeah?  All that was left in the vaults were the marked bills- they knew we were coming!  As soon as your office got involved, there's a leak-",male
GORDON," Don't try to cloud the fact that clearly Maroni's got people in your office, Dent.",male
GORDON, We're going after the mob's life savings.  Things will get ugly.,male
GORDON, He does that.,male
GORDON, Charge them with what?,male
GORDON, He can't go to County.  I'll keep him here in the holding cells.,male
GORDON, You trust them over at County?,male
GORDON, Lau stays.,male
GORDON," I am, counselor.",male
GORDON, Our boy looks good on the tube.,male
GORDON," Don't worry, they're coming, too.",male
GORDON," Forty-nine, sir.",male
GORDON, Any matches?,male
GORDON," The Joker's telling us who he's targeting- get a unit to Surrillo's house, tell Wuertz to find Dent- get them both into protective custody. Where's the Commissioner?",male
GORDON, Seal the building.  No one in or out till I get there.,male
GORDON," We're secure.  I want a floor-by- floor search of the entire building. I'm sorry, sir.  We believe the Joker has made a threat against your life.",male
GORDON," Sir, the Joker card had a trace of your D.N.A. on it-",male
GORDON, Somebody with access to your house or office must've lifted a tissue or a glass...,male
GORDON, Wait-,male
GORDON, Get a medic!,male
GORDON," As long as they don't get to Lau, we've cut off their funds.",male
GORDON, What about Dent?,male
GORDON, Patrick Harvey.  Richard Dent...,male
GORDON, Ramirez.,male
GORDON, That's brick- you're gonna try and take ballistics off a shattered bullet?,male
GORDON," Whatever you're gonna do, do it fast, 'cos we know his next target...",male
GORDON, How's it looking up top?,male
GORDON," We got you, you son of a bitch.",male
GORDON," We got him, Harvey.",male
GORDON," Stand away!  All of you.  I don't want anything for his mob lawyer to use, understand?  Handle this guy like he's made of glass.",male
GORDON, I couldn't chance my family's safety.,male
GORDON," Nothing.  No matches on prints, DNA, dental.  Clothing is custom, no labels.  Nothing in his pockets but knives and lint.  No name, no other alias... nothing.",male
GORDON, I couldn't tell you.  I couldn't risk-,male
GORDON," Actually, this time I saved him.",male
GORDON," Has he said anything, yet?",male
GORDON, Harvey Dent never made it home.,male
GORDON, What have you done with him?,male
GORDON, Where is he?,male
GORDON, What difference does that make?,male
GORDON," If we're going to play games, I'm going to need a cup of coffee.",male
GORDON, Not exactly.,male
GORDON, He's in control.,male
GORDON, Which one are you-,male
GORDON, With Lau? The Joker planned to be caught.  He wanted me to lock him up in M.C.U..,male
GORDON, I'm sorry about Rachel. The Doctor says you're in agonizing pain but you won't accept medication. That you're refusing skin grafts-,male
GORDON," Harvey, I can't-",male
GORDON, Two-face.  Harvey two-face.,male
GORDON," I... I know you tried to warn me. I'm sorry.  Wuertz picked you up- was he working for them? Do you know who picked up Rachel? Harvey, I need to know which of my men I can trust.",male
GORDON," I'm sorry, Harvey.",male
GORDON, You should have thought of that before you let the clown out of the box.,male
GORDON," Call in every officer- tell them to head to their nearest hospital and start evac and search.  Call the transit authority, school board, prisons- get every available bus down to a hospital- the priority is Gotham General- wheel everybody out of that place right now- my hunch is that's where the bomb is.",male
GORDON, That's where Harvey Dent is.,male
GORDON, To get Reese.,male
GORDON, Get the cars around back!,male
GORDON," Well, maybe Batman will save you.",male
GORDON," Berg, isn't it?",male
GORDON," You okay, son?",male
GORDON," I'm gonna need your weapon, son.",male
GORDON, Yeah.  That would be why.,male
GORDON," You okay, Mr.Wayne?",male
GORDON," That was a brave thing, you did.",male
GORDON, You weren't protecting the van?,male
GORDON," You don't watch a whole lot of news, do you, Mr.Wayne?",male
GORDON," Not today, I wouldn't.",male
GORDON, Gotham general... Did you get Dent out?,male
GORDON," You must know how many were inside- you've got patient lists, roll calls-",male
GORDON, Yeah?  What's your guess about where Harvey Dent is?,male
GORDON, Keep looking.  Keep it to yourself.,male
GORDON," My officers are going over every inch of the tunnels and bridges, but with the Joker's threat they're not and option.",male
GORDON," Backed up for hours.  Which leaves the ferries with thirty thousand waiting to board.  Plus, corrections are at capacity, so I want to use a ferry to take some prisoners off the island.",male
GORDON," You should be- they're the people you least want to be stuck with in an emergency.  Whatever the Joker's planning, it's a good bet that Harvey's prisoners might be involved. I want 'em out of here.",male
GORDON, Then we have a hostage situation.,male
GORDON, It's a shooting gallery.  Why'd he choose a spot with such big windows?,male
GORDON, Let's do it.,male
GORDON," What's simple, is that every second we don't take him, those people on the ferries get closer to blowing each other up!",male
GORDON, Then he'll blow them both up! There's no time- we have to go in now-,male
GORDON, That's why we can't wait- we can't play his games-,male
GORDON, No.  There's no time.  We have clear shots.,male
GORDON, Dent's in there with them.  We have to save Dent!  I have to save Dent! Get ready-,male
GORDON, Two minutes.  Then you breach.,male
GORDON," Hello?  Barbara, calm down-",male
GORDON, Harvey?  What the hell's going on?,male
GORDON, Dent?,male
GORDON, I know.  I was here.  Trying to save her.,male
GORDON, I couldn't.,male
GORDON, I was trying to fight the mob-,male
GORDON, Harvey.  Put the gun down.  You're not going to hurt my family.,male
GORDON, Put the gun down.,male
GORDON," Please, Harvey...",male
GORDON," Goddamit.  Stop pointing that gun at my family, Dent.",male
GORDON," I'm sorry, Harvey.  For everything. But, please.  Please don't hurt him.",male
GORDON," All they know is there's a situation. They don't know who, or what. They're just creating a perimeter.",male
GORDON," No one needs to escape, because no one's done anything wrong.  And nobody has to.",male
GORDON," You're right, Harvey.  Rachel's death was my fault.  But punish me-",male
GORDON," It's going to be all right, son.",male
GORDON, Thank-you.,male
GORDON," Yes, I do.",male
GORDON, The Joker won.,male
GORDON," Harvey's prosecution, everything he fought for, everything Rachel died for.  Undone.  Whatever chance Gotham had of fixing itself... whatever chance you gave us of fixing our city...  dies with Harvey's reputation.  We bet it all on him. The Joker took the best of us and tore him down.  People will lose all hope.",male
GORDON, Five dead?  Two of them cops?  We can't sweep that under-,male
GORDON, You?  You can't-,male
GORDON," No, you can't!  You're not!",male
GORDON, ...a hero.  Not the hero we deserved- the hero we needed.  Nothing less than a knight.  Shining...,male
GORDON, Because we have to chase him...,male
GORDON, Because...,male
CHECHEN, That's why we bring dogs.,male
CHECHEN, My little princes... The Batman's invisible to you fools... but my little princes... they can find human meat in complete darkness.,male
CHECHEN, Look!  Look what your drugs did to my customers!,male
CHECHEN, My business is repeat customers.,male
CHECHEN," Come on, sonofbitch- my dogs are hungry, pity there's only one of you...",male
CHECHEN, How you know?,male
CHECHEN, Who's stupid enough steal from us?,male
CHECHEN, Who the hell is that?,male
CHECHEN," You promised safe, clean money launder-",male
CHECHEN, What stops them getting to you?,male
CHECHEN, Sit.  I wanna hear proposition.,male
CHECHEN, What you propose?,male
CHECHEN, How much you want?,male
CHECHEN, I put word out.  We hire the clown. He was right.  We have to fix real problem.  Batman.,male
CHECHEN, Like I say- not so crazy as you look.,male
CHECHEN," More for us.  What you do with all your money, Mr.Joker?",male
CHECHEN, You said you were a man of your word.,male
CHECHEN, They won't work for a freak.,male
CHECHEN, Loose the dogs!,male
BATMAN, I don't need help.,male
BATMAN, Don't let me find you out here again.,male
BATMAN, I'm not wearing hockey pads.,male
BATMAN, Him again.  Who are the others?,male
BATMAN, Some of the marked bills I gave you.,male
BATMAN, Time to move in.,male
BATMAN, One man or the entire mob?  He can wait.,male
BATMAN, Do you trust him?,male
BATMAN," If I get him to you, can you get him to talk?",male
BATMAN, Then you're going to love me.,male
BATMAN, Drop the knife.,male
BATMAN, Let her go.,male
BATMAN, Are you alright?,male
BATMAN, He's safe.,male
BATMAN, I need ten minutes with the scene before your men contaminate it.,male
BATMAN, No.  Fingerprints.,male
BATMAN, I want the Joker.,male
BATMAN, I'm counting on it.,male
BATMAN, Where is he?,male
BATMAN, He must have friends.,male
BATMAN, Someone knows where he is.,male
BATMAN, You'd leave a man's life to chance?,male
BATMAN," His name's Schiff, Thomas.  He's a paranoid schizophrenic, a former patient at Arkham.  The kind of mind the Joker attracts.",male
BATMAN, What do expect to learn from him?,male
BATMAN," You're the symbol of hope that I could never be.  Your stand against organized crime is the first legitimate ray of light in Gotham for decades.  If anyone saw this, everything would be undone- all the criminals you got off the streets would be released.  And Jim Gordon will have died for nothing.",male
BATMAN, You're going to call a press conference.  Tomorrow morning.,male
BATMAN," No one else will die because of me. Gotham is in your hands, now.",male
BATMAN, You wanted me.  Here I am.,male
BATMAN, Where's Dent?,male
BATMAN, Then why do you want to kill me?,male
BATMAN, You're garbage who kills for money.,male
BATMAN, Where's Dent?,male
BATMAN, I have one rule.,male
BATMAN, Which is?,male
BATMAN, I'm considering it.,male
BATMAN, Them?,male
BATMAN, WHERE ARE THEY?!,male
BATMAN, WHERE ARE THEY?!,male
BATMAN, Dent knew the risks.,male
BATMAN," I'm sorry, Harvey.",male
BATMAN, Beautiful.  Isn't it?,male
BATMAN, And high frequency generator/receiver.,male
BATMAN," I've got to find this man, Lucius.",male
BATMAN, The database is null-key encrypted. It can only be accessed by one person.,male
BATMAN, Trust me.,male
BATMAN, This is the audio sample.,male
BATMAN," If he talks within range of any phone in the city, you'll be able to triangulate his position.",male
BATMAN," When you've finished, type your name to switch it off.",male
BATMAN, Fox?  There's something going on on the ferries...,male
BATMAN, Do you have a location on the Joker?,male
BATMAN, I have the Joker's location-,male
BATMAN, Prewitt building.  Assemble on the building opposite.,male
BATMAN, He likes the view.,male
BATMAN," It's not that simple.  With the Joker, it never is.",male
BATMAN, That won't happen.,male
BATMAN, There's always a catch with him-,male
BATMAN, I need five minutes.  Alone-,male
BATMAN, Fox.  I need picture.,male
BATMAN, Don't.  Move.,male
BATMAN, Where's the detonator?,male
BATMAN, There won't be any fireworks.,male
BATMAN," What were you hoping to prove?  That deep down, we're all as ugly as you?",male
BATMAN, You're alone.,male
BATMAN, No.  But I know how you get these-,male
BATMAN," You'll be in a padded cell, forever.",male
BATMAN, This city just showed you it's full of people ready to believe in good.,male
BATMAN, What did you do?,male
BATMAN, Lucius.  Find Harvey Dent.,male
BATMAN," You don't want to hurt the boy, Dent.",male
BATMAN," Nothing fair ever came out of the barrel of a gun, Dent.",male
BATMAN, What happened to Rachel wasn't chance.  We decided to act.  We three.  We knew the risks and we acted as one.  We are all responsible for the consequences.,male
BATMAN, It wasn't.,male
BATMAN, Because you were the best of us.  He wanted to prove that even someone as good as you could fall.,male
BATMAN," But your fooling yourself if you think you're letting chance decide. You're the one pointing the gun, Harvey.  So point it at the people who were responsible.  We all acted as one.  Gordon.  Me.  And you.",male
BATMAN, You don't have to-,male
BATMAN, No.  They won't. They can never know what he did.,male
BATMAN, No.  But the Joker cannot win.,male
BATMAN, Gotham needs its true hero.,male
BATMAN," Yes, I can.",male
BATMAN," You either die a hero or live long enough to see yourself become the villain. I can do those things because I'm not a hero, like Dent.  I killed those people.  That's what I can be.",male
BATMAN, I'm whatever Gotham needs me to be.,male
ALFRED, Be nice when Wayne Manor's rebuilt and you can swap not sleeping in a penthouse for not sleeping in a mansion.,male
ALFRED," You ought to be pretty knowledgeable by now, then.",male
ALFRED, I'm sure Mr.Fox can oblige. Did you get mauled by a tiger?,male
ALFRED, Perhaps you could hire some of them and take weekends off.,male
ALFRED, I know.  But things are improving. Look at the new District Attorney...,male
ALFRED, Are you interested in his character... or his social circle?,male
ALFRED," Well, I trust you're not following me on my day off.",male
ALFRED," Know your limits, Master Wayne.",male
ALFRED," Well, you do, sir.",male
ALFRED, And what happens the day you find out?,male
ALFRED," That day, Master Wayne, even I won't want to.  Probably.",male
ALFRED, I found one.  In Arizona.  Very nice man says it will take him a week to get it running.  And he takes cash. What about a flight crew?,male
ALFRED," Oh, yes.",male
ALFRED, I believe your plane is here.,male
ALFRED, If you can tell me the Russian for 'apply your own bloody suntan lotion.’,male
ALFRED," I think your fundraiser will be a great success, sir.",male
ALFRED, I assumed it was your usual reason for socialising beyond myself and the scum of Gotham's underbelly: to try and impress Miss Dawes.,male
ALFRED," A little liquid courage, Mr.Dent?",male
ALFRED," Yes, sir.",male
ALFRED," Not yet, sir.",male
ALFRED," Oh, you have no idea.",male
ALFRED," You crossed it first, sir.  You've hammered them, squeezed them to the point of desperation.  And now, in their desperation they've turned to a man they don't fully understand.",male
ALFRED," Respectfully, Master Wayne, perhaps this is a man you don't fully understand, either.",male
ALFRED," I was in Burma.  A long time ago.  My friends and I were working for the local government.  They were trying to buy the loyalty of tribal leaders, bribing them with precious stones. But their caravans were being raided in a forest north of Rangoon by a bandit.  We were asked to take care of the problem,  so we started looking for the stones.  But after six months, we couldn't find anyone who had traded with him.",male
ALFRED, One day I found a child playing with a ruby as big as a tangerine. The bandit had been throwing the stones away.,male
ALFRED," Because he thought it was good sport. Because some men aren't looking for anything logical, like money... they can't be bought, bullied, reasoned or negotiated with. Some men just want to watch the world burn.",male
ALFRED," I'm not sure you made it loud enough, sir.",male
ALFRED," Got one.  Melvin White, aggravated assault, moved to Arkham twice- 1502 Randolph Apartments, just off State-",male
ALFRED, Even the logs?,male
ALFRED," Endure, Master Wayne.  Take it. They'll hate you for it, but that's the point of Batman... he can be the outcast.  He can make the choice no one else can face.  The right choice.",male
ALFRED," Today, I don't want to. Although I did bloody tell you.",male
ALFRED, I suppose they'll lock me up as well. Your accomplice.,male
ALFRED, I don't know.  He went down to the press conference-,male
ALFRED," Perhaps both Bruce and Mr.Dent believe that Batman stands for something more important than a terrorist's whims, Miss Dawes, even if everyone hates him for it.",male
ALFRED, How will I know?,male
ALFRED," Goodbye, Rachel.",male
ALFRED, I prepared a little breakfast.,male
ALFRED, Very well.,male
ALFRED," Yes, Master Wayne?",male
ALFRED, You have inspired good.  But you spat in the face of Gotham's criminals- didn't you think there might be casualties?  Things were always going to have to get worse before they got better.,male
ALFRED, Rachel believed in what you stood for.  What we stand for.,male
ALFRED, Gotham needs you.,male
ALFRED," Which is why for now, they'll have to make do with you.",male
ALFRED, It can wait.,male
ALFRED, We burned the forest down.,male
ALFRED, You need to see this.,male
ALFRED, Looking for?,male
ALFRED," Will you be taking the batpod, sir?",male
ALFRED, The Lamborghini then. Much more subtle.,male
ALFRED, Nothing on them.  No immediate family members admitted to a Gotham hospital.,male
ALFRED, Burns is clean... Zachary...,male
ALFRED, When you stitch yourself up you make a bloody mess.,male
WAYNE, But I learn from my mistakes.,male
WAYNE, My armor... I'm carrying too much weight- I need to be faster.,male
WAYNE," A dog. A big dog.  There were more copycats last night, Alfred.  With guns.",male
WAYNE, This wasn't exactly what I had in mind when I said I wanted to inspire people.,male
WAYNE, I am.  Closely.  I need to know if he can be trusted.,male
WAYNE, Who Rachel spends her time with is her business.,male
WAYNE," If you ever took one, I might.",male
WAYNE, Batman has no limits.,male
WAYNE, I can't afford to know them.,male
WAYNE, We all know how much you like to say 'I told you so'.,male
WAYNE, OK.  Cancel the deal.,male
WAYNE, I needed a closer look at their books.,male
WAYNE, I need a new suit.,male
WAYNE," I'm not talking about fashion, Mr.Fox, so much as function.",male
WAYNE, Sure make backing out of the driveway easier.,male
WAYNE, Rachel!  Fancy that.,male
WAYNE," Rachel, Natascha.  Natascha, Rachel.",male
WAYNE, I certainly hope not.,male
WAYNE, Let's put a couple tables together.,male
WAYNE, They should!  I own the place.,male
WAYNE, How'd you know?,male
WAYNE, Prima ballerina for the Moscow Ballet.,male
WAYNE," You're into ballet, Harvey?",male
WAYNE, I was raised here.  I turned out OK.,male
WAYNE," The Palisades?  Sure.  You know, as our new D.A. you might want to figure out where your jurisdiction ends.",male
WAYNE, Exactly.  Who appointed the Batman?,male
WAYNE," Well, you've sold me, Dent.  I'm gonna throw you a fundraiser.",male
WAYNE," I don't think you understand.  One fundraiser with my pals, you'll never need another cent.",male
WAYNE, I'm sure you've always wanted to go to Hong Kong.,male
WAYNE, I think Mr.Lau deserves a more personal touch.,male
WAYNE, How about getting back into the plane?,male
WAYNE, Without it landing.,male
WAYNE, Sorry.,male
WAYNE," We wouldn't want things getting too easy, would we? How will it hold up against dogs?",male
WAYNE," South Korean smugglers.  They run flights into Pyongyang, below radar the whole way.  Did you think of an alibi?",male
WAYNE," You look tired, Alfred.  Will you be all right without me?",male
WAYNE, How's the view from L.S.I.Holdings?,male
WAYNE, What's this?,male
WAYNE, Sonar.  Just like a b-,male
WAYNE, And the other device?,male
WAYNE, How's it going?,male
WAYNE, And why do you think I wanted to hold a party for Harvey Dent?,male
WAYNE, Very droll.  But very wrong. Actually it's Dent.  You see-,male
WAYNE," Sorry, I'm late- glad you started without me!  Where's Rachel?!",male
WAYNE," Rachel Dawes- my oldest friend.  When she told me she was dating Harvey Dent, I had one thing to say...  the guy from those god-awful campaign commercials?",male
