character,text,gender
FOX, Like the phone I gave you in Hong Kong.  You took my sonar concept and applied it to everybody's phone in the City.  With half the city feeding you sonar you can image all of Gotham. This is wrong.,male
FOX, But at what cost?,male
FOX, No one should have that kind of power.,male
FOX, Spying on thirty million people wasn't in my job description.,male
FOX, I'll help you this one time...,male
FOX, But consider this my resignation.,male
FOX," As long as this machine is at Wayne Industries, I won't be.",male
FOX, I'm zeroing in.,male
FOX," His voice is on the ferry, but that's not the source...",male
FOX, It's west...,male
FOX," You've got p.o.v. on alpha channel, omni on beta-",male
REESE," Sir, I know Mr.Wayne's curious how his trust fund gets replenished but frankly... it's embarrassing.",male
REESE, It's done- the numbers are solid.,male
REESE, You asked me to do the diligence on the L.S.I.Holdings deal again.  I found irregularities.,male
REESE," Not with their numbers.  With yours. A whole division of Wayne Industries disappeared, overnight.  So I went down to the archives and started pulling old files.",male
REESE," My kids love the Batman.  I thought he was pretty cool, too.  Out there, kicking some ass.",male
REESE, Changes things when you know it's just a rich kid playing dress up.,male
REESE," Your project.  Don't tell me you didn't recognize your baby pancaking cop cars on the evening news.  Now you're getting sloppy.  Applied Sciences was a small, dead department- who'd notice?",male
REESE, That's simply not why I'm doing this.,male
REESE, If we could talk to Dent now he might feel differently-,male
REESE, I guess it would depend on the life.,male
REESE, Of course not.,male
REESE, They're trying to kill me.,male
DENT, ~Batman's looking for someone to take up his mantle.,male
DENT," Is there someone, anyone in this city we can trust?",male
DENT," And I promise you, the dawn is coming. One day, the Batman will have to answer for the laws he's broken- but to us, not to this madman.",male
LAU," Gentlemen, please. As you're all aware, one of our deposits was stolen.  A relatively small amount: 68 million.",male
FOX, There's a better view from the peak tram.,male
MAYOR," But that means it's on you.  They're all coming after you, now.  Not just the mob... politicians, journalists, cops- anyone whose wallet's about to get lighter.  Are you up to it? You better be.  They get anything on you... those criminals will be back on the streets...",male
STEPHENS, Just the normal number of bad guys in the building- and they're all city employees.  Here's a list.,male
STEPHENS," Jim, it's over.",male
STEPHENS, But the prosecution's over.,male
STEPHENS, No-one's standing up in front of a Judge while judges and police commissioners are getting blown away.,male
STEPHENS," If he's got any sense, Dent's halfway to Mexico by now.",male
STEPHENS," I'm sorry, Barbara.",male
STEPHENS, I'm sorry.,male
STEPHENS, Switch it off- he ain't coming. He doesn't want to talk to us.  God help whoever he does want to talk to-,male
STEPHENS, That's nice.,male
STEPHENS," I'm a twenty year man.  I can tell the difference between punks who need a little lesson in manners, and the freaks like you who would just enjoy it. And you killed six of my friends.",male
STEPHENS, I know you're going to enjoy this. But I'm going to enjoy it more.,male
STEPHENS, This is my own damn fault.  Just shoot him.,male
REESE," But now you've got the entire R and D department burning cash, claiming it's related to cell phones for the army.  What are you building him now? A rocket ship? I want ten million a year.  For the rest of my life.",male
WAYNE, Cross-reference the addresses. Look for Parkside and around.,male
DENT, But that's not why we're demanding he turn himself in.  We're doing it because we're scared.  We've been happy to let Batman clean up our streets for us until now-,male
DENT," Hello, Jim.",male
DENT, You're about to know what my suffering is really like...,male
ALFRED, That's the sacrifice he's making- to not be a hero.  To be something more.,male
RACHEL," Dear Bruce, I need to explain...",female
RACHEL, ...I need to be honest and clear. I'm going to marry Harvey Dent...,female
RACHEL," I love him, I want to spend the rest of my life with him...",female
RACHEL," When I told you that if Gotham no longer needed Batman we could be together, I meant it...",female
RACHEL, But I'm not sure the day will come...,female
RACHEL," ...when you no longer need Batman.  I hope it does, and if it does I will be there...",female
RACHEL, ...but as your friend.  I'm sorry to let you down...,female
RACHEL," If you lose your faith in me, please keep your faith in people...",female
RACHEL," Love, now and always, Rachel.",female
RAMIREZ," Barbara, it's Anna Ramirez-",male
RAMIREZ," Listen carefully, there's no time. Jim needs you to pack up and get the kids in the car right away.",male
RAMIREZ," Barbara, those cops can't be trusted. Jim needs you away from them as soon as possible.  I'll call them off for 10 minutes, you'll have to move fast-",male
RAMIREZ, I'm going to give you an address- Jim will meet you there...,male
GORDON, Where are you?  Where's my family?!,male
GORDON, They'll hunt you.,male
GORDON," ...he's the hero Gotham deserves... but not the one it needs right now. So we'll hunt him, because he can take it.  Because he's not our hero...",male
GORDON," ...he's a silent guardian, a watchful protector... a dark knight.",male
BATMAN, You'll hunt me.,male
BATMAN," You'll condemn me, set the dogs on me...",male
BATMAN, ...because it's what needs to happen.,male
BATMAN, Because sometimes the truth isn't good enough...,male
BATMAN," ...sometimes, people deserve more.",male
