,character,text,number,types
1007,TREEBEARD, They have business with the Orcs.,2,NaN
1008,TREEBEARD, Come my friends. The Ents are going to war. It is likely that we go to our doom. Last march of the Ents!,2,NaN
1009,TREEBEARD, Hold on little Hobbits!,2,NaN
1010,TREEBEARD," They come with fire. They come with axes. Gnawing, biting, breaking, hacking, burning! Destroyers and usurpers! Curse them!",2,NaN
1011,TREEBEARD, Such a beautiful verse.,2,NaN
1012,TREEBEARD," Sleep, little Shirelings. Heed no nightly noise. Sleep till morning light.",2,NaN
1013,TREEBEARD, I have business in the forest. There are many to call. Many that must come. The Shadow lies on Fangorn. The withering of all woods is drawing near.,2,NaN
1014,TREEBEARD, Go to sleep. Away with you.,2,NaN
1015,TREEBEARD," Come, the forest is waking up. It isn’t safe.",2,NaN
1016,TREEBEARD, The trees have grown wild and dangerous. Anger festers in their hearts. Black are their thoughts. Strong is their hate. They will harm you if they can. There are too few of us now. Too few of us Ents left to manage them.,2,NaN
1017,TREEBEARD, But now he has a mind of metal and wheels. He no longer cares for growing things.,2,NaN
1018,TREEBEARD," But now, something is about to happen that has not happened for an age ... Entmoot.",2,NaN
1019,TREEBEARD, Now we must decide if the Ents will go to war.,2,NaN
1020,TREEBEARD, We only just finished saying...good morning.,2,NaN
1021,TREEBEARD," South it is then. Hold on, little Shirelings.",2,NaN
1022,TREEBEARD, Many of these trees were my friends. Creatures I had known from nut and acorn.,2,NaN
1023,TREEBEARD, Saruman.,2,NaN
1024,TREEBEARD, A wizard should know better!,2,NaN
1025,TREEBEARD," There is no curse in Elvish, Entish or the tongues of Men for this treachery.",2,NaN
1026,TREEBEARD, My business is with Isengard tonight... with rock and stone.,2,NaN
1057,TREEBEARD, Beneath the roof of sleeping leaves And the dreams of trees unfold When woodland halls are green and cool And the wind is in the West Come back to me Come back to me And say my land is best,2,NaN
1263,TREEBEARD, Break the dam! Release the river!,2,NaN
442,UGLÚK, I don’t take orders from Orc-maggots.,2,male
443,UGLÚK," Sick, is he? Give him some medicine, boys!",2,male
444,UGLÚK, Can’t take his draught!,2,male
445,UGLÚK, Why?,2,male
446,UGLÚK, What is it? What do you smell?,2,male
447,UGLÚK, They've picked up our trail.,2,male
448,UGLÚK, Let's move!,2,male
449,UGLÚK, Get a fire going!,2,male
450,UGLÚK, They are not for eating.,2,male
451,UGLÚK," Get back, scum!",2,male
452,UGLÚK, They have something. An Elvish weapon. The master wants it for the war.,2,male
453,UGLÚK," Looks like meat’s back on the menu, boys.",2,male
454,UGLÚK, Saruman will have his prize. We will deliver them.,2,male
455,UGLÚK, You want some?,2,male
456,UGLÚK, Then keep your mouth shut.,2,male
457,UGLÚK, The prisoners go to Saruman. Alive and unspoiled.,2,male
968,URUK-HAI, I'm starving. We ain't had nothing but maggoty bread for three stinking days.,2,they
1171,VILLAGER, Helm’s Deep!,2,NaN
1035,WHITE WIZARD, You are tracking the footsteps of two young Hobbits.,2,male
1036,WHITE WIZARD, They passed this way the day before yesterday. They met someone they did not expect. Does that comfort you?,2,male
782,WILD MAN, We will fight for you.,2,male
783,WILD MAN, We will die for Saruman.,2,male
784,WILD MAN, Murderers!,2,male
863,WORMTONGUE, That is a lie.,2,male
864,WORMTONGUE, Saruman the White has ever been our friend and ally.,2,male
865,WORMTONGUE, You are banished forthwith from the kingdom of Rohan and all its domains under pain of death.,2,male
866,WORMTONGUE, He signed it this morning.,2,male
867,WORMTONGUE, I understand. His passing is hard to accept. Especially now that your brother has deserted you.,2,male
868,WORMTONGUE," So fair, so cold. Like a morning pale spring still clinging to winter's chill.",2,male
869,WORMTONGUE, He’s a herald of woe.,2,male
870,WORMTONGUE, Late is the hour in which this conjurer chooses to appear. Láthspell spell I name him. Ill news is an ill guest.,2,male
871,WORMTONGUE, I told you to take the wizard’s staff.,2,male
872,WORMTONGUE," His cloth was poor. And yet he bore a strange ring. Two serpents with emerald eyes. One devouring, the other crowned with golden flowers.",2,male
873,WORMTONGUE," It’s vulnerable. He knows this. He will expect an attack on the city. They will flee to Helm’s Deep, the great fortress of Rohan.",2,male
874,WORMTONGUE, They will have women and children  with them.,2,male
875,WORMTONGUE, How? How can fire undo stone? What kind of device could bring down the wall?,2,male
951,WORMTONGUE," Why do you lay these troubles on an already troubled mind? Can you not see? Your uncle is wearied by your malcontent, your warmongering.",2,male
952,WORMTONGUE," You see much, Éomer, Son of Éomund. Too much.",2,male
953,WORMTONGUE, This order does not come from me. It comes from the king.,2,male
954,WORMTONGUE," Oh, he must have died sometime in the night. What a tragedy for the king to lose his only son and heir.",2,male
955,WORMTONGUE," Oh, but you are alone. Who knows what you’ve spoken to the darkness in the bitter watches of the night when all your life seems to shrink. The walls of your bower closing in about you. A hutch to trammel some wild thing in.",2,male
956,WORMTONGUE," My lord, Gandalf the Grey is coming.",2,male
957,WORMTONGUE, He’s not welcome.,2,male
958,WORMTONGUE," A just question, my liege.",2,male
959,WORMTONGUE, His staff.,2,male
960,WORMTONGUE," I've only ever served you, my lord.",2,male
961,WORMTONGUE, Send me not from your sight.,2,male
962,WORMTONGUE, Get out of my way!,2,male
963,WORMTONGUE," There were three who followed the wizard. An Elf, a Dwarf, and a Man.",2,male
964,WORMTONGUE," No, from the North. One of the Dúnedain Rangers, I thought he was.",2,male
965,WORMTONGUE," Even if it is breached, it would take a number beyond reckoning, thousands, to storm the keep.",2,male
966,WORMTONGUE," But, my lord, there is no such force.",2,male
1068,WORMTONGUE, Théoden will not stay at Edoras.,2,male
1069,WORMTONGUE, Helm’s Deep has one weakness. Its outer wall is solid rock but for a small culvert at its base which is little more than a drain.,2,male
1070,WORMTONGUE, It is a dangerous road to take through the mountains. They will be slow.,2,male
797,ÉOMER, Théodred. Find the king’s son!,2,male
798,ÉOMER, These Orcs are not from Mordor.,2,male
799,ÉOMER, He’s alive.,2,male
800,ÉOMER, He was ambushed by Orcs.,2,male
801,ÉOMER, Orcs are running freely across our lands. Unchecked. Unchallenged. Killing at will. Orcs bearing the White Hand of Saruman.,2,male
802,ÉOMER, Warmongering?,2,male
803,ÉOMER, You have no authority here. Your orders mean nothing.,2,male
804,ÉOMER," What business does an Elf, a Man and a Dwarf have in the Riddermark? Speak quickly!",2,male
805,ÉOMER," I would cut off your head, beard and all, Master Dwarf, if it stood but a little higher from the ground.",2,male
806,ÉOMER, Théoden no longer recognizes friend from foe.,2,male
807,ÉOMER, The Uruks are destroyed. We slaughtered them during the night.,2,male
808,ÉOMER, We left none alive. We piled the carcasses and burned them.,2,male
809,ÉOMER, I am sorry.,2,male
810,ÉOMER, Hasufel! Arod!,2,male
811,ÉOMER, May these horses bear you to better fortune than their former masters. Farewell.,2,male
812,ÉOMER, Look for your friends. But do not trust to hope. It has forsaken these lands. We ride north!,2,male
813,ÉOMER, Not alone.,2,male
814,ÉOMER, To the king!,2,male
815,ÉOMER, Stay out of the forest! Keep away from the trees!,2,male
857,ÉOMER," If we don’t defend our country, Saruman will take it by force.",2,male
858,ÉOMER," How long is it since Saruman bought you? What was the promised price, Gríma? When all the Men are dead, you will take your share of the treasure?",2,male
859,ÉOMER, Too long have you watched my sister. Too long have you haunted her steps.,2,male
860,ÉOMER, Not even his own kin.,2,male
861,ÉOMER," Saruman has poisoned the mind of the king and claimed lordship over these lands. My company are those loyal to Rohan. And for that, we are banished. The White Wizard is cunning. He walks here and there, they say, as an old man hooded and cloaked. And everywhere, his spies slip past our nets.",2,male
862,ÉOMER, Rohirrim!,2,male
796,ÉOTHAIN," Yes, Mama!",2,male
818,ÉOWYN, Théodred!,2,female
819,ÉOWYN," My lord, your son...he is dead.",2,female
820,ÉOWYN, Your words are poison.,2,female
821,ÉOWYN," Bealocwealm hafað fréone frecan forth onsended giedd sculon singan gléomenn sorgiende on Meduselde þæt he ma no wære his dryhtne dyrest and mæga deorost. Bealo... An evil death has set forth the noble warrior A song shall sing sorrowing minstrels in Meduseld that he is no more, to his lord dearest and kinsmen most beloved. An evil death...",2,female
822,ÉOWYN," The had no warning. They were unarmed. Now the Wild Men are moving through the Westfold, burning as they go.",2,female
823,ÉOWYN, His name is Brego.,2,female
824,ÉOWYN," I have heard of the magic of Elves, but I did not look for it in a Ranger from the North. You speak as one of their own.",2,female
825,ÉOWYN, Women of this country learned long ago: those without swords may still die upon them. I fear neither death nor pain.,2,female
826,ÉOWYN, A cage. To stay behind bars until use and old age accept them. And all chance of valor has gone beyond recall or desire.,2,female
827,ÉOWYN, Gimli.,2,female
828,ÉOWYN," I made some stew. It isn’t much, but it’s hot.",2,female
829,ÉOWYN, Really?,2,female
830,ÉOWYN, Then you must be at least 60.,2,female
831,ÉOWYN, You are one of the Dúnedain.,2,female
832,ÉOWYN," I’m sorry. Please, eat.",2,female
833,ÉOWYN, Where is she?,2,female
834,ÉOWYN, My lord?,2,female
835,ÉOWYN, I can fight!,2,female
836,ÉOWYN, Make for the lower ground!,2,female
837,ÉOWYN, Stay together!,2,female
838,ÉOWYN, Where is the rest?,2,female
839,ÉOWYN, Take it to the caves.,2,female
840,ÉOWYN, So few. So few of you have returned.,2,female
841,ÉOWYN, Lord Aragorn ... where is he?,2,female
842,ÉOWYN," To mind the children, to find food and bedding with the men return. What renown is there in that?",2,female
843,ÉOWYN, Let me stand at your side.,2,female
844,ÉOWYN, You do not command the others to stay! They fight beside you because they would not be parted from you. Because they love you!,2,female
845,ÉOWYN," Your son is badly wounded, my lord.",2,female
846,ÉOWYN, My lord? Uncle?,2,female
847,ÉOWYN, Will you not go to him? Will you do nothing?,2,female
848,ÉOWYN," Rick, cot and tree.",2,female
849,ÉOWYN, He was my cousin’s horse.,2,female
850,ÉOWYN," My uncle told me a strange thing. He said that you rode to war with Thengel, my grandfather. But he must be mistaken.",2,female
851,ÉOWYN, Seventy?,2,female
852,ÉOWYN, But you cannot be 80!,2,female
853,ÉOWYN," A descendant of Númenor, blessed with long life. It was said that your race had passed into legend.",2,female
854,ÉOWYN, The woman who gave you that jewel.,2,female
855,ÉOWYN, I’m to be sent with the women into the caves.,2,female
856,ÉOWYN, I’m sorry.,2,female
1243,ÉOWYN, Aragorn! Aragorn!,2,female
