,character,text,number,types
505,MERRY, Hasty? Our friends are out there. They need our help. They cannot fight this war on their own.,2,male
506,MERRY, How can that be your decision?!,2,male
507,MERRY, But you're part of this world!,2,male
508,MERRY, The fires of Isengard will spread And the woods of Tuckborough and Buckland will burn. And...,2,male
509,MERRY, Are you mad? We’ll be caught.,2,male
510,MERRY, Where are they going?,2,male
511,MERRY, Yes!,2,male
512,MERRY, Pippin! Hold on!,2,male
513,MERRY," He doesn’t look too happy, does he?",2,male
514,MERRY," Still, I suppose the view would be quite nice from up there.",2,male
515,MERRY," Nothing. The world’s back to normal, that’s all.",2,male
516,MERRY, Good luck trying to find something decent to eat around here. Probably dead rats and moldy bread.,2,male
517,MERRY, It can’t be.,2,male
518,MERRY, The finest pipe-weed in South Farthing.,2,male
519,MERRY, Share it? No. No. Dead plant and all that. Don’t think he’d understand.,2,male
520,MERRY, Exactly. Bah-hrum.,2,male
521,MERRY," Don’t worry about me, Pippin.",2,male
522,MERRY, Run!,2,male
523,MERRY, He's gone.,2,male
524,MERRY, Treebeard? Where’s he gone?,2,male
525,MERRY, There it is again. Something’s not right here. Not right at all.,2,male
526,MERRY, You just said something ... Treeish.,2,male
527,MERRY, You did something.,2,male
528,MERRY, Aren’t you?!,2,male
529,MERRY, You must help. Please. You must do something.,2,male
530,MERRY, ...and all that was once green and good in this world will be gone.,2,male
531,MERRY," There won't be a Shire, Pippin.",2,male
532,MERRY, Saruman’s storeroom!,2,male
533,MERRY, It is!,2,male
534,MERRY, Could be a distant relative.,2,male
785,MORWEN, Éothain! Éothain!,2,female
786,MORWEN, Listen to me. You must ride to Edoras and raise the alarm. Do you understand me?,2,female
787,MORWEN," Freda, I will find you there.",2,female
788,MORWEN, Éothain! Freda!,2,female
789,MORWEN, You’ll take your sister. You’ll go faster with just two.,2,female
790,MORWEN, Quickly!,2,female
791,MORWEN," Go, child.",2,female
967,ORC, We’re not going no further till we’ve had a breather.,2,NaN
767,ORC OVERSEER," But, my lord, there are too many! They cannot all be armed in time, we don’t have the means.",2,NaN
768,ORC OVERSEER, We don’t have enough fuel to feed the fires.,2,NaN
769,ORC OVERSEER, Yes.,2,NaN
384,PIPPIN, Merry! Merry!,2,male
385,PIPPIN, Merry! Merry? Wake up.,2,male
386,PIPPIN, Stop it!,2,male
387,PIPPIN, Leave him alone!,2,male
388,PIPPIN, Merry.,2,male
389,PIPPIN, You’re hurt.,2,male
390,PIPPIN, An act?,2,male
391,PIPPIN, Aragorn!,2,male
392,PIPPIN, Merry! Merry!,2,male
393,PIPPIN, What’s making that noise?,2,male
394,PIPPIN, What?,2,male
395,PIPPIN, Alive?,2,male
396,PIPPIN, They think we have the Ring.,2,male
397,PIPPIN, Did we lose him? I think we lost him.,2,male
398,PIPPIN, Merry!,2,male
399,PIPPIN," Run, Merry!",2,male
400,PIPPIN," It’s talking, Merry. The tree is talking.",2,male
401,PIPPIN," Don’t talk to it, Merry. Don’t encourage it!",2,male
402,PIPPIN, And whose side are you on?,2,male
403,PIPPIN, The White Wizard?,2,male
404,PIPPIN," I had the loveliest dream last night. There was this large barrel, full of pipe-weed. And we smoked all of it. And then...you were sick.",2,male
405,PIPPIN, I’d give anything for a whiff of Old Toby.,2,male
406,PIPPIN," No, I didn’t. I was just stretching.",2,male
407,PIPPIN, Who?,2,male
408,PIPPIN, Than what?,2,male
409,PIPPIN, I’ve always been taller than you.,2,male
410,PIPPIN," Please, Merry. You’re what? Three-foot-six? At the most?",2,male
411,PIPPIN, Merry don’t! Don’t drink it!,2,male
412,PIPPIN, It could well be dangerous!,2,male
413,PIPPIN, Merry!,2,male
414,PIPPIN, Why are there so few of you when you have lived so long? Are there Ent children?,2,male
415,PIPPIN," Oh, I’m sorry. How did they die?",2,male
416,PIPPIN, What do they look like?,2,male
417,PIPPIN, Look! There’s smoke to the south.,2,male
418,PIPPIN, What is it?,2,male
419,PIPPIN, They must have decided something by now.,2,male
420,PIPPIN, Merry!,2,male
421,PIPPIN," Well, that’s good news.",2,male
422,PIPPIN," Maybe Treebeard’s right. We don’t belong here, Merry. It's too big for us. What can we do in the end? We've got the Shire. Maybe we should go home.",2,male
423,PIPPIN, Wait! Stop! Stop!,2,male
424,PIPPIN," Yes. Exactly. If we go south we can slip past Saruman unnoticed. The closer we are to danger, the farther we are from harm. It’s the last thing he’ll expect.",2,male
425,PIPPIN, No we won’t. Not this time.,2,male
426,PIPPIN," I’m sorry, Treebeard.",2,male
427,PIPPIN, Look! The trees! They’re moving!,2,male
428,PIPPIN," Not too happy at all, Merry.",2,male
429,PIPPIN," Oh, yes, it’s a quality establishment. I hear the staff are very good.",2,male
430,PIPPIN, What are you doing?,2,male
431,PIPPIN," No, it isn’t. I’m starving.",2,male
432,PIPPIN, I don’t believe it.,2,male
433,PIPPIN, Longbottom Leaf.,2,male
434,PIPPIN, It’s perfect. One barrel each.,2,male
435,PIPPIN, I get it. Don’t be hasty.,2,male
458,PIPPIN, My friend is sick.,2,male
459,PIPPIN, He needs water. Please!,2,male
460,PIPPIN," Whereas me, I’m pushing 3’7”.",2,male
461,PIPPIN, 3’8”!,2,male
462,PIPPIN," Merry! No, Treebeard said that you shouldn’t have any.",2,male
463,PIPPIN, Give me it back. Merry!,2,male
464,PIPPIN, What’s happening!,2,male
465,PIPPIN, Help!,2,male
466,PIPPIN, Turn around. Turn around. Take us south!,2,male
467,PIPPIN, Wait. Do you think we should share it with Treebeard?,2,male
1260,RANGER, Mordor has come.,2,male
1261,RANGER, Watch out!,2,male
816,ROHAN SOLDIER 1, Mordor will pay for this.,2,male
817,ROHAN SOLDIER 2," My Lord Éomer, over here!",2,male
135,SAM," What is it, Mr. Frodo?",2,male
136,SAM, Can you see the bottom?,2,male
137,SAM," Catch it! Grab it, Mr. Frodo!",2,male
138,SAM, Mr. Frodo!,2,male
139,SAM," Bogs and rope, and goodness knows what. It ain’t natural, none of it.",2,male
140,SAM, Nothing. Just a bit of seasoning. I thought maybe if we was having a roast chicken one night or something.,2,male
141,SAM, You never know.,2,male
142,SAM," It’s very special, that. It’s the best salt in all the Shire.",2,male
143,SAM," Who’s gonna to follow us down here, Mr. Frodo?",2,male
144,SAM, Mordor. The one place in Middle-earth we don’t want to see any closer. And the one place we’re trying to get to. It’s just where we can’t get.,2,male
145,SAM, Mr. Frodo?,2,male
146,SAM, Let me see.,2,male
147,SAM, Those rain clouds might.,2,male
148,SAM, This looks strangely familiar.,2,male
149,SAM, What's that horrid stink? I warrant there's a nasty bog nearby. Can you smell it?,2,male
150,SAM," Quiet, you!",2,male
151,SAM, It’s no more than you deserve!,2,male
152,SAM, I don’t believe you!,2,male
153,SAM, He’s trying to trick us! If we let him go he’ll throttle us in our sleep.,2,male
154,SAM, Hey! Come back now! Come back!,2,male
155,SAM, It’s a bog. He’s led us into a swamp.,2,male
156,SAM, I hate this place. It’s too quiet. There’s been no sight or sound of a bird for two days.,2,male
157,SAM," Well, starve, then. And good riddance!",2,male
158,SAM, There are dead things! Dead faces in the water.,2,male
159,SAM, Frodo!,2,male
160,SAM, Mr. Frodo! Are you all right?,2,male
161,SAM, Black Riders!,2,male
162,SAM," Come on, Frodo! Come on!",2,male
163,SAM, I thought they were dead!,2,male
164,SAM, Mr. Frodo! It’s alright. I’m here.,2,male
165,SAM," Oh, save us.",2,male
166,SAM, That’s it then. We can’t get past that.,2,male
167,SAM," I know, Mr. Frodo. I doubt even these Elvish cloaks will hide us in there.",2,male
168,SAM, Why haven’t you spoken of this before?!,2,male
169,SAM, He’s up to something.,2,male
170,SAM," Mr. Frodo, no.",2,male
171,SAM, No.,2,male
172,SAM," Hey, stinker, don’t go getting too far ahead!",2,male
173,SAM, What?,2,male
174,SAM," Because. Because that's what he is, Mr. Frodo. There's naught left in him but lies and deceit. It's the Ring he wants. It's all he cares about.",2,male
175,SAM, Why?,2,male
176,SAM," You can’t save him, Mr. Frodo.",2,male
177,SAM," I do. It's the Ring. You can't take your eyes off it! I've seen you. You're not eating. You barely sleep. It's taken hold of you, Mr. Frodo. You have to fight it.",2,male
178,SAM, Can't you hear yourself? Don't you know who you sound like?,2,male
179,SAM," You’ll make him sick, you will...",2,male
180,SAM, What’s to ruin? There’s hardly any meat on them.,2,male
181,SAM," Po-ta-toes. Boil them, mash them, stick them in a stew. Lovely big golden chips with a nice piece of fried fish.",2,male
182,SAM, You’re hopeless.,2,male
183,SAM, Ready to do what?,2,male
184,SAM, Mr. Frodo. Look. It’s an oliphaunt.,2,male
185,SAM, No one at home will believe this.,2,male
186,SAM, Wait! We’re innocent travelers!,2,male
187,SAM, Spies?! Now wait just a minute!,2,male
188,SAM, His gardener.,2,male
189,SAM," We have to get out of here. You go. Go, now.",2,male
190,SAM, Mr. Frodo...,2,male
191,SAM, Stop it! Leave him alone! Don’t you understand? He’s got to destroy it! That’s where we’re going ... into Mordor ... to the mountain of fire.,2,male
192,SAM, Please. It’s such a burden. Will you not help him?,2,male
193,SAM, Frodo!,2,male
194,SAM," Hold on, Mr. Frodo. You'll be all right.",2,male
195,SAM, You want to know what happened to Boromir?,2,male
196,SAM, Mr. Frodo?,2,male
197,SAM, What are you doing?,2,male
198,SAM, I know. It’s all wrong. By rights we shouldn’t even be here.,2,male
199,SAM," There’s some good in this world, Mr. Frodo. And it’s worth fighting for.",2,male
200,SAM," Captain Faramir...you have shown your quality, sir.",2,male
201,SAM," Mr. Frodo didn’t mean for them Rangers to hurt you. You know that, don’t you? He was trying to save you, see?",2,male
202,SAM, So there’s no hard feelings. Forgive and forget.,2,male
203,SAM," Very decent of you. Very decent, indeed, Gollum.",2,male
204,SAM, I wonder if we’ll ever be put into songs or tales.,2,male
205,SAM," I wonder if people will ever say, “Let’s hear about Frodo and the Ring.” And they’ll say “Yes, that’s one of my favorite stories. Frodo was really courageous, wasn’t he, dad.” “Yes, my boy, the most famousest of Hobbits. And that’s saying a lot.”",2,male
206,SAM," Now Mr. Frodo, you shouldn’t make fun. I was being serious.",2,male
207,SAM, “Samwise the Brave.”,2,male
208,SAM, We’re not gonna wait for you. Come on!,2,male
209,SAM," Where is he? Where’s he gone? Hey, Gollum! Where are you?",2,male
232,SAM," It’s a shame, really. Lady Galadriel gave me that. Real Elvish rope.",2,male
233,SAM," Well, there’s nothing for it. It’s one of my knots. Won’t come free in a hurry.",2,male
234,SAM," Let’s face it, Mr. Frodo, we’re lost.",2,male
235,SAM, I don’t think Gandalf meant for us to come this way.,2,male
236,SAM," It’s the Ring, isn’t it?",2,male
237,SAM," Oh yes, lovely. Lembas bread. And look!",2,male
238,SAM, More Lembas bread.,2,male
239,SAM," I don't usually hold with foreign food, but this Elvish stuff, it’s not bad.",2,male
240,SAM, It’s hopeless. Every Orc in Mordor’s going to hear this racket. Let’s just tie him up and leave him.,2,male
241,SAM," Get down! I said, down!",2,male
242,SAM," There! What did I tell you? He’s run off, the old villain. So much for his promises.",2,male
243,SAM, My old Gaffer would have a thing or two to say if he could see us now.,2,male
244,SAM, Look! The gate. It's opening!,2,male
245,SAM, I can see a way down.,2,male
246,SAM, ...behaving like that!,2,male
247,SAM, There’s only one way to eat a brace of coneys.,2,male
248,SAM, What we need is a few good taters.,2,male
249,SAM, Even you couldn’t say no to that.,2,male
250,SAM, Mr. Frodo?,2,male
251,SAM, Who are they?,2,male
252,SAM," You can do it. Use the Ring, Mr. Frodo. Just this once. Put it on. Disappear.",2,male
253,SAM," You want to know why your brother died? He tried to take the Ring from Frodo! After swearing an oath to protect him, he tried to kill him! The Ring drove your brother mad!",2,male
254,SAM, Where are you going?!,2,male
255,SAM, It’s me. It’s your Sam. Don’t you know your Sam?,2,male
256,SAM, But we are.,2,male
257,SAM," It’s like in the great stories, Mr. Frodo. The ones that really mattered. Full of darkness and danger they were. And sometimes you didn’t want to know the end. Because how could the end be happy?",2,male
258,SAM, Folk in those stories had lots of chances of turning back only they didn’t. They kept going because they were holding on to something.,2,male
259,SAM, The very highest.,2,male
1264,SAM, How could the world go back to the way it was when so much bad had happened?,2,male
1265,SAM, Even darkness must pass. A new day will come.,2,male
1266,SAM, And when the sun shines it will shine out the clearer.,2,male
1267,SAM, Those were the stories that stayed with you...,2,male
1268,SAM, ...that meant something. Even if you were too small to understand why.,2,male
1269,SAM," But I think, Mr. Frodo, I do understand. I know now.",2,male
1270,SAM," But in the end, it’s only a passing thing, this shadow.",2,male
748,SARUMAN, The world is changing.,2,male
749,SARUMAN," Rohan, my lord, is ready to fall.",2,male
750,SARUMAN, Who now has the strength to stand against the armies of Isengard and Mordor?,2,male
751,SARUMAN, To stand against the might of Sauron and Saruman and the union of the two towers?,2,male
752,SARUMAN," Together, my Lord Sauron, we shall rule this Middle-earth.",2,male
753,SARUMAN, The Old World will burn in the fires of industry. The forests will fall.,2,male
754,SARUMAN, A new order will rise. We will drive the machine of war with the sword and the spear and the iron fists of the Orc.,2,male
755,SARUMAN, We have only to remove those who oppose us.,2,male
756,SARUMAN, It will begin in Rohan.,2,male
757,SARUMAN, Too long have these peasants stood against you. But no more.,2,male
758,SARUMAN, I want them armed and ready to march within two weeks!,2,male
759,SARUMAN, Burn it.,2,male
760,SARUMAN, They drove your people into the hills to scratch a living off rocks.,2,male
761,SARUMAN, The Man... ...was he from Gondor?,2,male
762,SARUMAN, It matters not. The world of Men shall fall. It will begin at Edoras.,2,male
763,SARUMAN," This night, the land would be stained with the blood of Rohan!",2,male
764,SARUMAN, March to Helms Deep! Leave none alive!,2,male
765,SARUMAN, To war!,2,male
766,SARUMAN, There will be no dawn for Men.,2,male
770,SARUMAN," Build a dam, block the stream, work the furnaces night and day.",2,male
771,SARUMAN, The FOREST OF FANGORN lies on our doorstep.,2,male
772,SARUMAN, Swear it.,2,male
773,SARUMAN, The Horse-men took your land.,2,male
774,SARUMAN, Take back the lands they stole from you. Burn every village!,2,male
775,SARUMAN, Gandalf the White. Gandalf the Fool! Does he seek to humble me with his newfound piety?,2,male
776,SARUMAN, You stink of horse.,2,male
777,SARUMAN, The Ring of Barahir. So Gandalf Greyhame thinks he has found Isildur’s heir. The lost king of Gondor. He is a fool. The line was broken years ago.,2,male
778,SARUMAN, Send out your Warg-riders.,2,male
779,SARUMAN," If the wall is breached, Helm's Deep will fall.",2,male
780,SARUMAN, Tens of thousands.,2,male
781,SARUMAN, A new power is rising. Its victory is at hand.,2,male
1169,SHARKU, He’s ... dead.,2,NaN
1170,SHARKU, Took a little tumble off the cliff.,2,NaN
359,SMÉAGOL," To the Gate, to the Gate! To the Gate, the master says. Yes!",2,male
360,SMÉAGOL, But we swore to serve the master of the precious.,2,male
361,SMÉAGOL, No. Not Master.,2,male
362,SMÉAGOL, Master’s my friend.,2,male
363,SMÉAGOL, Not listening. I’m not listening.,2,male
364,SMÉAGOL, No.,2,male
365,SMÉAGOL, Go away.,2,male
366,SMÉAGOL, I hate you. I hate you.,2,male
367,SMÉAGOL, Not anymore.,2,male
368,SMÉAGOL, Master looks after us now. We don’t need you.,2,male
369,SMÉAGOL, Leave now and never come back.,2,male
370,SMÉAGOL, Leave now and never come back.,2,male
371,SMÉAGOL, Cruel Men hurts us. Master tricksed us.,2,male
372,SMÉAGOL, Master is our friend ... our friend.,2,male
373,SMÉAGOL, No. Not its business. Leave us alone!,2,male
374,SMÉAGOL, No ... No.,2,male
375,SMÉAGOL, Master. Master looks after us. Master wouldn’t hurt us.,2,male
376,SMÉAGOL," Don’t ask Sméagol. Poor, poor Sméagol.",2,male
377,SMÉAGOL," But the fat Hobbit, he knows. Eyes always watching.",2,male
378,SMÉAGOL, Yes! Yes! Yes!,2,male
379,SMÉAGOL, Yes! No! No!,2,male
380,SMÉAGOL, It’s too risky. It’s too risky.,2,male
381,SMÉAGOL, Yes. She could do it.,2,male
382,SMÉAGOL, Once they’re dead.,2,male
383,SMÉAGOL," Come on, Hobbits. Long ways to go yet. Sméagol will show you the way.",2,male
1071,SMÉAGOL, Leave now and never come back!,2,male
1072,SMÉAGOL," We told him to go away. And away he goes, precious.",2,male
1073,SMÉAGOL, Gone! Gone! Gone! Sméagol is free!,2,male
969,SNAGA, Yeah! Why can’t we have some meat?!,2,male
970,SNAGA, What about them? They’re fresh.,2,male
971,SNAGA, Just a mouthful. A bit of the flank.,2,male
1067,SOLDIER," That horse is half mad, my lord. There’s nothing you can do. Leave him.",2,male
975,THE TREE, Little Orcs. Burárum...,2,NaN
976,THE TREE, Tree? I am no tree! I am an Ent.,2,NaN
876,THÉODEN, Gríma... Gríma...,2,male
877,THÉODEN," Why should I welcome you, Gandalf Stormcrow?",2,male
878,THÉODEN," You have no power here, Gandalf the Grey.",2,male
879,THÉODEN, I know your face. Éowyn. Éowyn.,2,male
880,THÉODEN, Dark have been my dreams of late.,2,male
881,THÉODEN, Your leechcraft would have had me crawling on all fours like a beast!,2,male
882,THÉODEN, Where is Théodred? Where is my son?,2,male
883,THÉODEN, Simbelmynë.,2,male
884,THÉODEN, No parent should have to bury their child.,2,male
885,THÉODEN, They will be 300 leagues from here by now. Éomer cannot help us.,2,male
886,THÉODEN," When last I looked, Théoden, not Aragorn, was king of Rohan.",2,male
887,THÉODEN," I am ready, Gamling. Bring my horse.",2,male
888,THÉODEN, I haven’t seen my niece smile for a long time. She was a girl when they brought her father back dead. Cut down by Orcs. She watched her mother succumb to grief.,2,male
889,THÉODEN, What is it? What do you see?,2,male
890,THÉODEN, All riders to the head of the column!,2,male
891,THÉODEN," You must lead the people to Helm’s Deep, and make haste.",2,male
892,THÉODEN, No!,2,male
893,THÉODEN, Get the wounded on horses. The wolves of Isengard will return. Leave the dead.,2,male
894,THÉODEN, Our people are safe.,2,male
895,THÉODEN, Draw all our forces behind the wall. Bar the gate. And set a watch on the surround.,2,male
896,THÉODEN, Get them into the caves.,2,male
897,THÉODEN," A great host, you say?",2,male
898,THÉODEN, How many?,2,male
899,THÉODEN, Ten thousand?,2,male
900,THÉODEN, Let them come!,2,male
901,THÉODEN," I have fought many wars, Master Dwarf. I know how to defend my own Keep.",2,male
902,THÉODEN, What would you have me do? Look at my Men. Their courage hangs by a thread.,2,male
903,THÉODEN, And who will come? Elves? Dwarves? We are not so lucky in our friends as you. The old alliances are dead.,2,male
904,THÉODEN, Gondor?! Where was Gondor when the Westfold fell? Where was Gondor when our enemies closed in around us?! Where was Gon--?,2,male
905,THÉODEN, There is no time. War is upon us.,2,male
906,THÉODEN," Who am I, Gamling?",2,male
907,THÉODEN, And do you trust your king?,2,male
908,THÉODEN, To whatever end...,2,male
909,THÉODEN, How is this possible?,2,male
910,THÉODEN, So it begins.,2,male
911,THÉODEN, Give them a volley.,2,male
912,THÉODEN," Is this it? Is this all you can conjure, Saruman?",2,male
913,THÉODEN, Brace the Gate!,2,male
914,THÉODEN, To the gate. Draw your swords!,2,male
915,THÉODEN, Hold them!,2,male
916,THÉODEN, As long as you can give me.,2,male
917,THÉODEN, Shore up the door!,2,male
918,THÉODEN, Gimli! Aragorn! Get out of there!,2,male
919,THÉODEN, Pull everybody back! Pull them back!,2,male
920,THÉODEN, The fortress is taken. It is over.,2,male
921,THÉODEN, So much death. What can Men do against such reckless hate?,2,male
922,THÉODEN, For death and glory.,2,male
923,THÉODEN, Yes. Yes. The horn of Helm Hammerhand shall sound in the deep one last time!,2,male
924,THÉODEN, Let this be the hour when we draw swords together.,2,male
925,THÉODEN, Éomer.,2,male
926,THÉODEN, Victory! We have victory!,2,male
927,THÉODEN, My son... Gríma...,2,male
928,THÉODEN, Gandalf?,2,male
929,THÉODEN, Ever has it grown on the tombs of my forebearers.,2,male
930,THÉODEN, Now it shall cover the grave of my son. Alas that these evil days should be mine. The young perish and the old linger. That I should live to see the last days of my house.,2,male
931,THÉODEN," I know what it is that you want of me, but I will not bring further death to my people. I will not risk open war.",2,male
932,THÉODEN, This is not a defeat.,2,male
933,THÉODEN, We will return.,2,male
934,THÉODEN, We will return.,2,male
935,THÉODEN," Then she was left alone, to tend her king in growing fear. Doomed to wait upon an old man who should have loved her as a father.",2,male
936,THÉODEN, You must do this...for me.,2,male
937,THÉODEN, Follow me!,2,male
938,THÉODEN, Come.,2,male
939,THÉODEN, We have paid for it with many lives.,2,male
940,THÉODEN, Saruman's arm will have grown long indeed if he thinks he can reach us here.,2,male
941,THÉODEN, I want every man and strong lad able to bear arms to be ready for battle by nightfall.,2,male
942,THÉODEN, We will cover the causeway and the gate from above. No army has ever breached the Deeping Wall or set foot inside the Hornburg!,2,male
943,THÉODEN," They will break upon this fortress like water on rock. Saruman’s hordes will pillage and burn. We’ve seen it before. Crops can be resown; homes rebuilt. Within these walls, we will outlast them.",2,male
944,THÉODEN," If this is to be our end, then I would have them make such an end as to be worthy of remembrance.",2,male
945,THÉODEN," No, my Lord Aragorn...we are alone.",2,male
946,THÉODEN, Get the women and children into the caves.,2,male
947,THÉODEN, Where is the horse and the rider? Where is the horn that was blowing?,2,male
948,THÉODEN, How did it come to this?,2,male
949,THÉODEN, Fell deeds awake...now for wrath...now for ruin and a red dawn!,2,male
950,THÉODEN, Forth Eorlingas!,2,male
1246,THÉODEN, They have passed like rain on the mountains.,2,male
1247,THÉODEN, Like wind in the meadow.,2,male
1248,THÉODEN, The days have gone down in the west...,2,male
1249,THÉODEN, ...behind the hills...,2,male
1250,THÉODEN, ...into Shadow.,2,male
1259,THÉODEN, Aragorn! Fall back to the Keep! Get your Men out of there!,2,male
1065,THÉODEN/SARUMAN," If I go, Théoden dies.",2,male
1066,THÉODEN/SARUMAN, Rohan is mine.,2,male
977,TREEBEARD," TREEBEARD, some call me.",2,NaN
978,TREEBEARD," Side? I am on nobody’s side because nobody’s on my side, little Orc. Nobody cares for the woods anymore.",2,NaN
979,TREEBEARD, Hobbits? Never heard of a Hobbit before. Sounds like Orc mischief to me!,2,NaN
980,TREEBEARD, Maybe you are and maybe you aren’t. The White Wizard will know.,2,NaN
981,TREEBEARD, O Rowan mine I saw you shine Upon a summer’s day Upon your head How golden-red The crown you bore aloft,2,NaN
982,TREEBEARD," Bru-ra-hroom. Don’t be hasty. You might call it far, perhaps. My home lies deep in the forest near the roots of the mountain. I told Gandalf I would keep you safe. And safe is where I’ll keep you. I believe you will enjoy this next one too. It’s one of my own compositions. Right.",2,NaN
983,TREEBEARD, Away with you. You should not be waking. Eat earth. Dig deep. Drink water.,2,NaN
984,TREEBEARD, Bru-ra-hroom. There have been no Entings for a terrible long count of years.,2,NaN
985,TREEBEARD, We lost the Entwives.,2,NaN
986,TREEBEARD, Die? No. We lost them. And now we cannot find them. I don’t suppose you’ve seen Entwives in the Shire?,2,NaN
987,TREEBEARD, I don’t remember now.,2,NaN
988,TREEBEARD, There is always smoke rising from Isengard these days.,2,NaN
989,TREEBEARD, There was a time when Saruman would walk in my woods.,2,NaN
990,TREEBEARD, The Ents have not troubled about the wars of Men and wizards for a very long time.,2,NaN
991,TREEBEARD, 'Tis a gathering.,2,NaN
992,TREEBEARD, Beech. Oak. Chestnut. Ash. Good. Good. Good. Many have come.,2,NaN
993,TREEBEARD, Decided? No.,2,NaN
994,TREEBEARD, Don’t be hasty.,2,NaN
995,TREEBEARD, We have just agreed.,2,NaN
996,TREEBEARD, I have told your names to the Entmoot and we have agreed ... you are not Orcs.,2,NaN
997,TREEBEARD," Now don’t be hasty, Master Meriadoc.",2,NaN
998,TREEBEARD," War? Yes. It affects us all. Tree, root and twig. But you must understand, young Hobbit...it takes a long time to say anything in Old Entish...and we never say anything unless it is worth taking...a long time to say.",2,NaN
999,TREEBEARD, The Ents cannot hold back this storm. We must weather such things as we have always done.,2,NaN
1000,TREEBEARD, This is not our war.,2,NaN
1001,TREEBEARD," You are young and brave, Master Merry. But your part in this tale is over. Go back to your home.",2,NaN
1002,TREEBEARD, I will leave you at the western borders of the forest. You can make your way north to your homeland from there.,2,NaN
1003,TREEBEARD, South? But that will lead you past Isengard.,2,NaN
1004,TREEBEARD," That doesn’t make sense to me. But then, you are very small. Perhaps you’re right.",2,NaN
1005,TREEBEARD," And a little family of field mice that climb up sometimes, and they tickle me awfully. They’re always trying to get somewhere where they...",2,NaN
1006,TREEBEARD, They had voices of their own.,2,NaN
